line_no,text,lg,l_id,folio,col,speaker
1354,Et ſeellees en la lettre,15,l-193r-1-32,193r,1,
1355,/La virge /aaron toute floꝛie,15,l-193r-1-33,193r,1,
1356,Moult avoit bele compaignie,15,l-193r-1-34,193r,1,
1357,De Virge et d'anges empenez,15,l-193r-1-35,193r,1,
1358,Moult ſeroit de bone heure nez,15,l-193r-1-36,193r,1,
1359,Qui ſouvent l'avroit en memoire,15,l-193r-1-37,193r,1,
1360,Car elle eſt mireoir de gloire,15,l-193r-1-38,193r,1,
1361,Que li ange en parvis remirent,15,l-193r-2-1,193r,2,
1362,Le mireoir ou il ſe mirent,15,l-193r-2-2,193r,2,
1363,Fait moult gloꝛieus remirer,15,l-193r-2-3,193r,2,
1364,En ſi cler mireoir mirer,15,l-193r-2-4,193r,2,
1365,Nous devons tous car qui ſ'i mire,15,l-193r-2-5,193r,2,
1366,Ja de mal qu'il ait n'avra mire,15,l-193r-2-6,193r,2,
1367,Foꝛs /la virge mere Marie,15,l-193r-2-7,193r,2,
1368,Ses eux et ſa penſee toute,15,l-193r-2-8,193r,2,
1369,Il puet bien dire que po doubte,15,l-193r-2-9,193r,2,
1370,/Antecriſt et toute ſa gent,15,l-193r-2-10,193r,2,
1371,En .i. tref a coꝛdez d'argent,15,l-193r-2-11,193r,2,
1372,D'un dyapꝛe de couloꝛ ynde,15,l-193r-2-12,193r,2,
1373,Qui fu fais et ouurez en /ynde,15,l-193r-2-13,193r,2,
1374,Deſcendi deſſus la riviere,15,l-193r-2-14,193r,2,
1375,Le treſt eſtoit de grant maniere,15,l-193r-2-15,193r,2,
1376,A merveilles parans et biaus,15,l-193r-2-16,193r,2,
1377,Car il ert ouurez a eſgliaus,15,l-193r-2-17,193r,2,
1378,De fin oꝛ en azur aſſis,15,l-193r-2-18,193r,2,
1379,Li pommiaus que Diex y ot mis,15,l-193r-2-19,193r,2,
1380,Eſtoit d'une eſcharboucle ardant,15,l-193r-2-20,193r,2,
1381,Soꝛ la riviere en .i. pendant,15,l-193r-2-21,193r,2,
1382,Entendus par tele meſtire,15,l-193r-2-22,193r,2,
1383,Qu'il faiſoit tout entoꝛ reluire,15,l-193r-2-23,193r,2,
1384,Le bois le pꝛe et la riviere,15,l-193r-2-24,193r,2,
1385,Si que li rais de ſa lumiere,15,l-193r-2-25,193r,2,
1386,Feroit juſqu'en la meſtre toꝛ,15,l-193r-2-26,193r,2,
1387,En .i. trone de riche atoꝛ,15,l-193r-2-27,193r,2,
1388,Pare de paile d'aumairie,15,l-193r-2-28,193r,2,
1389,Se ſil /la royne Marie,15,l-193r-2-29,193r,2,
1390,Poꝛ les chevaliers eſgarder,15,l-193r-2-30,193r,2,
1391,Et meeſmement poꝛ garder,15,l-193r-2-31,193r,2,
1392,Sa gent de moꝛt et de meſchief,15,l-193r-2-32,193r,2,
1393,Oꝛ me doinſt Diex venir a chief,15,l-193r-2-33,193r,2,
1394,De deſcrire virginité,15,l-193r-2-34,193r,2,
1395,Toute en reluiſoit la cité,15,l-193r-2-35,193r,2,
1396,Tant eſtoit pure et clere et fine,15,l-193r-2-36,193r,2,
1397,De /la devant dite royne,15,l-193r-2-37,193r,2,
1398,Eſt moult dame virginitez.,15,l-193r-2-38,193r,2,
1399,De lui eſt tex la verité.,15,l-193v-1-1,193v,1,
1400,Que moult eſt gloꝛieus ſes nons,15,l-193v-1-2,193v,1,
1401,Loꝛs deſploient les gonfanons,15,l-193v-1-3,193v,1,
1402,Religions et abſtinance,15,l-193v-1-4,193v,1,
1403,Confeſſion et penitance,15,l-193v-1-5,193v,1,
1404,Et charitez qui grant gent mainne,15,l-193v-1-6,193v,1,
1405,Virginitez vait primerainne,15,l-193v-1-7,193v,1,
1406,Soꝛ moult petite cheuauchiee,15,l-193v-1-8,193v,1,
1407,N'ot pas encoꝛe cheuauchiee,15,l-193v-1-9,193v,1,
1408,Une archie de pꝛe fauchie,15,l-193v-1-10,193v,1,
1409,Quant cil wui oꝛent cheuahcie,15,l-193v-1-11,193v,1,
1410,Auant furent venu as lices,15,l-193v-1-12,193v,1,
1411,Ja ne queſiſſe autre delices,15,l-193v-1-13,193v,1,
1412,Que regarder virginité,15,l-193v-1-14,193v,1,
1413,Son hyaume ſon eſcu liſte,15,l-193v-1-15,193v,1,
1414,Et ſa lance et ſon gonfanon,15,l-193v-1-16,193v,1,
1415,Prez de lui n'ot ſe virges non,15,l-193v-1-17,193v,1,
1416,Mais ſachiez il en y ot poi,15,l-193v-1-18,193v,1,
1417,Conques connoiſtre n'en y poi,15,l-193v-1-19,193v,1,
1418,De ueres virges plus de .xx.,15,l-193v-1-20,193v,1,
1419,Virginitez montee vint,15,l-193v-1-21,193v,1,
1420,Soꝛ grant deſtrier de /maſonie,15,l-193v-1-22,193v,1,
1421,Toute en reluiſt la praerie,15,l-193v-1-23,193v,1,
1422,Tant par eſt cointe et aceſmee,15,l-193v-1-24,193v,1,
1423,De blanches armes eſt armee.,15,l-193v-1-25,193v,1,
1424,Plus flamboians que nule glace,15,l-193v-1-26,193v,1,
1425,Ses eſcus fait luire la place,15,l-193v-1-27,193v,1,
1426,Qu'ele avoit poꝛ ſon coꝛps garder,15,l-193v-1-28,193v,1,
1427,Ne l'oſai pas bien eſgarder,15,l-193v-1-29,193v,1,
1428,Que je n'en eſtoie pas dignes,15,l-193v-1-30,193v,1,
1429,Li eſcus ert plus blans que cines,15,l-193v-1-31,193v,1,
1430,S'ert entelez de mainte iame,15,l-193v-1-32,193v,1,
1431,Bendez du ſalut /Nostre Dame,15,l-193v-1-33,193v,1,
1432,Cheuronnez de feſtes anniex,15,l-193v-1-34,193v,1,
1433,De blanches touailles d'autiex,15,l-193v-1-35,193v,1,
1434,Avoit fait tote a armer,15,l-193v-1-36,193v,1,
1435,Et d'un dyapꝛe d'outremer,15,l-193v-1-37,193v,1,
1436,L'avoit a la hante atachiee,15,l-193v-1-38,193v,1,
1437,D'une tache noire tachie,15,l-193v-1-39,193v,1,
1438,Ains ert blanche com floꝛ de lis,15,l-193v-2-1,193v,2,
1439,Moult mis mon cuer et mon avis,15,l-193v-2-2,193v,2,
1440,A regarder virginité,15,l-193v-2-3,193v,2,
1441,Elle ot hyaume d'umilité,15,l-193v-2-4,193v,2,
1442,A .i. foꝛt cercle d'ignoꝛance,15,l-193v-2-5,193v,2,
1443,Doure de nete conſcience,15,l-193v-2-6,193v,2,
1444,S'ot blanches armes ce m'eſt uis,15,l-193v-2-7,193v,2,
1445,Poꝛ ce qu'as anges de parvis,15,l-193v-2-8,193v,2,
1446,Eſt couſine ſi com moi ſamble,15,l-193v-2-9,193v,2,
1447,Et que virginitez reſſamble,15,l-193v-2-10,193v,2,
1448,Les anges et ſoit loꝛ germainne,15,l-193v-2-11,193v,2,
1449,En ſa lance ot .i. fer d'adꝛegne,15,l-193v-2-12,193v,2,
1450,Et poꝛtrais petis angelos,15,l-193v-2-13,193v,2,
1451,Onques glaive ne iauelos,15,l-193v-2-14,193v,2,
1452,Ne fu plus cointes ne plus gens,15,l-193v-2-15,193v,2,
1453,Qui trop eſtoit fins li argens,15,l-193v-2-16,193v,2,
1454,Ou il erent aſſis et paint,15,l-193v-2-17,193v,2,
1455,Volant les fiſt cil qui les paint,15,l-193v-2-18,193v,2,
1456,D'oꝛ et d'azur ſoꝛ blanc argent,15,l-193v-2-19,193v,2,
1457,S'en furent plus bel et plus gent,15,l-193v-2-20,193v,2,
1458,Abſtinence vint en la pꝛee,16,l-193v-2-21,193v,2,
1459,Soꝛ les armes dont ert armee,16,l-193v-2-22,193v,2,
1460,Sambloit qu'us trop bien negie,16,l-193v-2-23,193v,2,
1461,El poꝛtoit l'eſcu loſengie,16,l-193v-2-24,193v,2,
1462,De ieunes et d'aſtinance,16,l-193v-2-25,193v,2,
1463,Apres religion ſ'auance,16,l-193v-2-26,193v,2,
1464,De ſ'eſperance ſ'en parti,16,l-193v-2-27,193v,2,
1465,Quele poꝛtoit l'eſcu parti,16,l-193v-2-28,193v,2,
1466,D'oꝛoiſon et d'obedience,16,l-193v-2-29,193v,2,
1467,Et ot hyaume de pacience,16,l-193v-2-30,193v,2,
1468,A .i. cercle foꝛt et metable,16,l-193v-2-31,193v,2,
1469,Doꝛe de gloire pardurable,16,l-193v-2-32,193v,2,
1470,.I. penoncel de ignoꝛance,16,l-193v-2-33,193v,2,
1471,Relegion ſoꝛ penitance,16,l-193v-2-34,193v,2,
1472,Qui eſtoit d'un haubert veſtue,16,l-193v-2-35,193v,2,
1473,Et d'une heir a ſa char nue,16,l-193v-2-36,193v,2,
1474,S'ot eſcu de confeſſion,16,l-193v-2-37,193v,2,
1475,Loſengie de compuction,16,l-193v-2-38,193v,2,
1476,Et de pitié a une manche,16,l-193v-2-39,193v,2,
1477,Qui ſ'entreſambloient de vis,17,l-196r-1-1,196r,1,
1478,/Coꝛuain /cadꝛus et /meraugis,17,l-196r-1-2,196r,1,
1479,Ont fait de loꝛ gent .ii. parties,17,l-196r-1-3,196r,1,
1480,Et oꝛent armes mi parties,17,l-196r-1-4,196r,1,
1481,De biauté et de coꝛtoiſie,17,l-196r-1-5,196r,1,
1482,Poꝛ la biauté de loꝛ amie,17,l-196r-1-6,196r,1,
1483,Qui ot non /la bele l'ydoine,17,l-196r-1-7,196r,1,
1484,D'entre les poꝛs de /macedoine,17,l-196r-1-8,196r,1,
1485,Vient au toꝛnoy la baronnie,17,l-196r-1-9,196r,1,
1486,Les armes le roy d'oꝛcanie,17,l-196r-1-10,196r,1,
1487,Furent poꝛtretes de merveilles,17,l-196r-1-11,196r,1,
1488,/Perceual ot armes vermeilles,17,l-196r-1-12,196r,1,
1489,Qu'il toli jadis en /yrlande,17,l-196r-1-13,196r,1,
1490,Au vermeil de la rouge lande,17,l-196r-1-14,196r,1,
1491,Quant il fu chevaliers nouuiaus,17,l-196r-1-15,196r,1,
1492,/Me ſire kex li ſeneſchiaus,17,l-196r-1-16,196r,1,
1493,Sans faire autre diſcretion,17,l-196r-1-17,196r,1,
1494,Ot les armes de traction.,17,l-196r-1-18,196r,1,
1495,Endentees de felonie,17,l-196r-1-19,196r,1,
1496,As rampoſnes de vilonnie,17,l-196r-1-20,196r,1,
1497,A .iii. toꝛiaus fez et farſis,17,l-196r-1-21,196r,1,
1498,De rampoſnes et de meſdis,17,l-196r-1-22,196r,1,
1499,Qui trop bien en l'eſcu auindꝛent,17,l-196r-1-23,196r,1,
1500,Yceſte gent derrieres vindꝛent,17,l-196r-1-24,196r,1,
1501,Qu'il n'y avoit que de lacier,17,l-196r-1-25,196r,1,
1502,Les hyaumes mais pour ſolacier,17,l-196r-1-26,196r,1,
1503,Se l'ont loꝛ ancien deduit,17,l-196r-1-27,196r,1,
1504,Oꝛent cheuauchie toute nuit,17,l-196r-1-28,196r,1,
1505,Par bois et par foꝛes obſcures,17,l-196r-1-29,196r,1,
1506,Querant depoꝛs et auentures,17,l-196r-1-30,196r,1,
1507,Par /coꝛnouaille et par /yrlande,17,l-196r-1-31,196r,1,
1508,Et vindꝛent par /Broceliande,17,l-196r-1-32,196r,1,
1509,Ou par po ne furent tuit moꝛt,17,l-196r-1-33,196r,1,
1510,Car /percheual qui par depoꝛt,17,l-196r-1-34,196r,1,
1511,Cuida arrouſer le perron,17,l-196r-1-35,196r,1,
1512,L'arrouſa par tel deſraiſon,17,l-196r-1-36,196r,1,
1513,Que la foudꝛe occiſt plus de .c.,17,l-196r-1-37,196r,1,
1514,De loꝛ maiſnie et de loꝛ gent,17,l-196r-1-38,196r,1,
1515,Ainsi d'une ville et de l'autre,18,l-196r-2-1,196r,2,
1516,Sont iſſu et lance ſoꝛ fautre,18,l-196r-2-2,196r,2,
1517,La pꝛaerie ont cheuauchie,18,l-196r-2-3,196r,2,
1518,D'ambedeus pars ot grant cheucie,18,l-196r-2-4,196r,2,
1519,Mais trop plus ot gent ſans doutance,18,l-196r-2-5,196r,2,
1520,Li ſires de deſeſperance,18,l-196r-2-6,196r,2,
1521,Que cil d'eſperance d'aſſez,18,l-196r-2-7,196r,2,
1522,Car /Antecriſt ot amaſſez,18,l-196r-2-8,196r,2,
1523,Tant de gent comme pot avoir,18,l-196r-2-9,196r,2,
1524,Et abandonna ſon avoir,18,l-196r-2-10,196r,2,
1525,As ſeriens et as ſoudiers,18,l-196r-2-11,196r,2,
1526,Et poꝛ plus avoit chevaliers,18,l-196r-2-12,196r,2,
1527,Maint uſurier et maint vilain,18,l-196r-2-13,196r,2,
1528,Ot fait chevalier de ſa main,18,l-196r-2-14,196r,2,
1529,Poꝛ ce ſi ot plus /Antecriſt,18,l-196r-2-15,196r,2,
1530,Chevaliers que n'ot /Jhesucriſt,18,l-196r-2-16,196r,2,
1531,Amenez au toꝛnoiement,18,l-196r-2-17,196r,2,
1532,Poꝛ ce conuint moult longuement,18,l-196r-2-18,196r,2,
1533,De l'une et de l'autre partie,18,l-196r-2-19,196r,2,
1534,Barquanier de la departie,18,l-196r-2-20,196r,2,
1535,Des chevaliers que trop eſt grief,18,l-196r-2-21,196r,2,
1536,D'aſſambler a ſi grant meſchief,18,l-196r-2-22,196r,2,
1537,Poꝛ ce dient cil d'eſperance,18,l-196r-2-23,196r,2,
1538,Ne volons pas en tel balance,18,l-196r-2-24,196r,2,
1539,N'a ſi grant meſchief toꝛnoier,18,l-196r-2-25,196r,2,
1540,Mais donnez nous cel chevalier,18,l-196r-2-26,196r,2,
1541,A cel eſcu d'oꝛ fueillete,18,l-196r-2-27,196r,2,
1542,Et nous donnez cel oillete,18,l-196r-2-28,196r,2,
1543,Et cel noir et cel loſengie,18,l-196r-2-29,196r,2,
1544,Et cil .iii. qui ſont la rengie,18,l-196r-2-30,196r,2,
1545,A ces grans banieres vermeilles,18,l-196r-2-31,196r,2,
1546,Oꝛ eſcoutez fieres merveilles,18,l-196r-2-32,196r,2,
1547,Dient cil de deſeſperance,18,l-196r-2-33,196r,2,
1548,Ne ſ'auiez eſcu ne lance,18,l-196r-2-34,196r,2,
1549,Haubert en dos ne hyaume en chief,18,l-196r-2-35,196r,2,
1550,Si ſerions nous a meſchief,18,l-196r-2-36,196r,2,
1551,Mais ſe vous volez toꝛnoier,18,l-196r-2-37,196r,2,
1552,Donnez nous cel grant chevalier.,18,l-196r-2-38,196r,2,
1553,A cele grant baniere blanche,18,l-196v-1-1,196v,1,
1554,Et celui qui poꝛte la manche,18,l-196v-1-2,196v,1,
1555,D'ermine a l'eſcu liſte,18,l-196v-1-3,196v,1,
1556,Et donez nous cel billete,18,l-196v-1-4,196v,1,
1557,Au lyon rampant de /ſynople,18,l-196v-1-5,196v,1,
1558,Et celui que voi la plus noble,18,l-196v-1-6,196v,1,
1559,A angelos poꝛtrais d'argent,18,l-196v-1-7,196v,1,
1560,Avec vous avez tant de gent,18,l-196v-1-8,196v,1,
1561,Que n'en devez nul demander,18,l-196v-1-9,196v,1,
1562,Mais alez ſans contremander,18,l-196v-1-10,196v,1,
1563,Lacier les hyaumes viſtement,18,l-196v-1-11,196v,1,
1564,Car l'oꝛe du toꝛnoiement,18,l-196v-1-12,196v,1,
1565,Treſpaſſe le joꝛ ſe define,18,l-196v-1-13,196v,1,
1566,Atant la barquainne define,18,l-196v-1-14,196v,1,
1567,Car le toꝛnoy ont acoꝛde,18,l-196v-1-15,196v,1,
1568,Et /Antecriſt a demande,18,l-196v-1-16,196v,1,
1569,A .i. hyraut qu'as armes crit,18,l-196v-1-17,196v,1,
1570,Auſſi ont de par /Jhesucriſt,18,l-196v-1-18,196v,1,
1571,Fait crier ſi que tuit l'entendent,18,l-196v-1-19,196v,1,
1572,Et cil heraut ces heaumes tendent,18,l-196v-1-20,196v,1,
1573,A ces bons chevaliers de pꝛis,18,l-196v-1-21,196v,1,
1574,Qui plus volentiers les ont pris,18,l-196v-1-22,196v,1,
1575,Que chapeles de floꝛs nouveles,18,l-196v-1-23,196v,1,
1576,Que moult loꝛ plaiſent tex nouveles,18,l-196v-1-24,196v,1,
1577,Tencon qui premier a lacie,19,l-196v-1-25,196v,1,
1578,Le hyaume a l'eſcu embꝛacie,19,l-196v-1-26,196v,1,
1579,Et ſ'eſt miſe foꝛs du conroi,19,l-196v-1-27,196v,1,
1580,Par ſon oꝛgueil par ſon deſroy,19,l-196v-1-28,196v,1,
1581,Eſt alee iouſter premiere,19,l-196v-1-29,196v,1,
1582,Et freneſie ſa baniere,19,l-196v-1-30,196v,1,
1583,Poꝛte qui ſ'embat en la preſſe,19,l-196v-1-31,196v,1,
1584,Tencon contre ſilence leſſe,19,l-196v-1-32,196v,1,
1585,Cheual coꝛre ſans arreſter,19,l-196v-1-33,196v,1,
1586,Mais ſilence poꝛ eſcouter,19,l-196v-1-34,196v,1,
1587,Ot l'auctoꝛite de tencon,19,l-196v-1-35,196v,1,
1588,Coꝛrous plus ardant que raiſon,19,l-196v-2-1,196v,2,
1589,Aſſailli debonnairete,19,l-196v-2-2,196v,2,
1590,Ytant vous di poꝛ verité,19,l-196v-2-3,196v,2,
1591,Quele a coꝛrous pris et vaincu,19,l-196v-2-4,196v,2,
1592,Poꝛ ce quele poꝛtoit l'eſcu,19,l-196v-2-5,196v,2,
1593,De pacience qui tout vaint,19,l-196v-2-6,196v,2,
1594,Pacience qui ne ſe faint,19,l-196v-2-7,196v,2,
1595,Leſſe aler contre freneſie,19,l-196v-2-8,196v,2,
1596,Sus l'eſcu paint de reuerie,19,l-196v-2-9,196v,2,
1597,Auſſi com ſ'el fuſt foꝛſenee,19,l-196v-2-10,196v,2,
1598,Si a freneſie aſſenee,19,l-196v-2-11,196v,2,
1599,Que le heaume li fent par mi,19,l-196v-2-12,196v,2,
1600,Et du cheval l'abat en mi,19,l-196v-2-13,196v,2,
1601,La place treſtoute eſtoꝛdie,19,l-196v-2-14,196v,2,
1602,Priſon fiance freneſie,19,l-196v-2-15,196v,2,
1603,Quant elle ot le cheval perdu,19,l-196v-2-16,196v,2,
1604,El ne tint pas poꝛ eſp[er]du,19,l-196v-2-17,196v,2,
1605,.I. jongleoꝛ qui vieloit,19,l-196v-2-18,196v,2,
1606,Qui requiſt le deſtrier et l'ot,19,l-196v-2-19,196v,2,
1607,Amiſtie et pais et concoꝛde,20,l-196v-2-20,196v,2,
1608,Encontre hayne et deſcoꝛde,20,l-196v-2-21,196v,2,
1609,Leſſent coꝛre a ennemiſtie,20,l-196v-2-22,196v,2,
1610,Pais et concoꝛde et amiſtié,20,l-196v-2-23,196v,2,
1611,Ont faite ſi riche auenue,20,l-196v-2-24,196v,2,
1612,Que juſqu'es poins en loꝛ venue,20,l-196v-2-25,196v,2,
1613,Ont les lances frenines fraites,20,l-196v-2-26,196v,2,
1614,Au toꝛner les chevaus ont tartes,20,l-196v-2-27,196v,2,
1615,Les grans eſpees de /couloigne,20,l-196v-2-28,196v,2,
1616,Sans faire demoꝛe n'aloigne,20,l-196v-2-29,196v,2,
1617,Pais et amiſtié et concoꝛde,20,l-196v-2-30,196v,2,
1618,D'armes ont hainte et deſcoꝛde,20,l-196v-2-31,196v,2,
1619,Conquiſes et ennemiſtie,20,l-196v-2-32,196v,2,
1620,Par los largece et pitié,20,l-196v-2-33,196v,2,
1621,Mains meneſtrel y ot fait riche,20,l-196v-2-34,196v,2,
1622,Qu'il n'i avoit aver ne chiche,20,l-196v-2-35,196v,2,
1623,D'ambedeus pars fu grans l'effoꝛs,21,l-197r-1-1,197r,1,
1624,Larrecin qui fu pꝛeus et foꝛs,21,l-197r-1-2,197r,1,
1625,El toꝛnoy ſe fiert a emble,21,l-197r-1-3,197r,1,
1626,Par grant air a aſſamble,21,l-197r-1-4,197r,1,
1627,Lance beſſie a loiauté,21,l-197r-1-5,197r,1,
1628,Moult iouſta par grant cruauté,21,l-197r-1-6,197r,1,
1629,Mais ce ne fu pas au tant quant,21,l-197r-1-7,197r,1,
1630,Car bien ot larrecin .ii. tant,21,l-197r-1-8,197r,1,
1631,Chevaliers que loiauté n'os,21,l-197r-1-9,197r,1,
1632,Car larrecin o ſoi menot,21,l-197r-1-10,197r,1,
1633,Homicide et deſloiauté,21,l-197r-1-11,197r,1,
1634,Et muſtriſſe qui loiauté,21,l-197r-1-12,197r,1,
1635,La lance grant aaſtine,21,l-197r-1-13,197r,1,
1636,A deſloiauté abeſſie,21,l-197r-1-14,197r,1,
1637,Et loiauté toute eſleſſie,21,l-197r-1-15,197r,1,
1638,Et trebuchiee et reuerſee,21,l-197r-1-16,197r,1,
1639,Larrecins le filz mienuit,21,l-197r-1-17,197r,1,
1640,Haſart qui tricherie ſuit,21,l-197r-1-18,197r,1,
1641,Ne pot atendꝛe loiauté,21,l-197r-1-19,197r,1,
1642,Menconge devant v[er]ite,21,l-197r-1-20,197r,1,
1643,Vait fuiant car ne l'oſe atendꝛe,21,l-197r-1-21,197r,1,
1644,Verite poꝛ menconge pꝛendꝛe,21,l-197r-1-22,197r,1,
1645,Par le toꝛnoy toꝛne et retoꝛne,21,l-197r-1-23,197r,1,
1646,Qu'il encontre et ne ſe deſtoꝛne,21,l-197r-1-24,197r,1,
1647,Il es moꝛs car je le ſai bien,21,l-197r-1-25,197r,1,
1648,Car verité n'eſpargne rien,21,l-197r-1-26,197r,1,
1649,A ſes .ii. ennemis enſamble,21,l-197r-1-27,197r,1,
1650,Qui li veulent ſi com moi ſamble,21,l-197r-1-28,197r,1,
1651,Et li vouldꝛont coper la coꝛge,21,l-197r-1-29,197r,1,
1652,A loꝛ eſpee cope goꝛge,21,l-197r-1-30,197r,1,
1653,Mais juſtice tant ſ'entremet,21,l-197r-1-31,197r,1,
1654,Qu'a murtreuille le gibet,21,l-197r-1-32,197r,1,
1655,Les leva a .i. cheval fuſt,21,l-197r-1-33,197r,1,
1656,Aincois que retoꝛnee fuſt,21,l-197r-1-34,197r,1,
1657,Si com li cheuax la treſpoꝛte,21,l-197r-1-35,197r,1,
1658,Traiſon encontre en la poꝛte,21,l-197r-1-36,197r,1,
1659,Du cheval par en ſon la croupe,21,l-197r-1-37,197r,1,
1660,Et au retourner a fait ſoupe,21,l-197r-1-38,197r,1,
1661,D'ypocriſie .i. putel,21,l-197r-2-1,197r,2,
1662,Mais partout le meſtre chaſtel,21,l-197r-2-2,197r,2,
1663,A fait trainer meſpꝛiſon,21,l-197r-2-3,197r,2,
1664,Qui voult par ſa grant meſpꝛiſon.,21,l-197r-2-4,197r,2,
1665,Murtrier loiauté par deſtriez,21,l-197r-2-5,197r,2,
1666,O traiſon ſ'eſtoit coulee,21,l-197r-2-6,197r,2,
1667,Mais veritez toute pꝛouvee,21,l-197r-2-7,197r,2,
1668,La pꝛent le coutel en la main,21,l-197r-2-8,197r,2,
1669,Iuſtice encontre tout de plain,21,l-197r-2-9,197r,2,
1670,Rapine la ſuer roberie,21,l-197r-2-10,197r,2,
1671,Et abati ſa[n]s lauberie,21,l-197r-2-11,197r,2,
1672,Rapine et meſconte et meſtret,21,l-197r-2-12,197r,2,
1673,A hazart a le bꝛanc mi trait,21,l-197r-2-13,197r,2,
1674,Qui plus fu ioi[n]s que eſpeuriers,21,l-197r-2-14,197r,2,
1675,S'a des et viſtes et legiers,21,l-197r-2-15,197r,2,
1676,Et coꝛs loiauté a l'encontre,21,l-197r-2-16,197r,2,
1677,Mais loiautéz d'un ſol encontre,21,l-197r-2-17,197r,2,
1678,A fait tantoſt haſart du mains,21,l-197r-2-18,197r,2,
1679,Hazart tint l'eſpee a .ii. mains,21,l-197r-2-19,197r,2,
1680,Et l'en fiert mais ce fu en vain,21,l-197r-2-20,197r,2,
1681,Qu'il fiert haſart arriere main,21,l-197r-2-21,197r,2,
1682,D'un geter de .xviii. poins,21,l-197r-2-22,197r,2,
1683,Si qu'il li fiſt voler des poins,21,l-197r-2-23,197r,2,
1684,L'eſpee par ſa meſcheance,21,l-197r-2-24,197r,2,
1685,Et a donne double cheance,21,l-197r-2-25,197r,2,
1686,A haſart dont li meſchei,21,l-197r-2-26,197r,2,
1687,Qu'a cele cheance cheï,21,l-197r-2-27,197r,2,
1688,D'ou tant que li deſtriers fu haulz,21,l-197r-2-28,197r,2,
1689,Soꝛ l'eſcu paint a enuiaus,21,l-197r-2-29,197r,2,
1690,Mais a cel cop pas ne renuie,21,l-197r-2-30,197r,2,
1691,Haſart car il perdi la vie,21,l-197r-2-31,197r,2,
1692,Si n'ot mais de coy enuier,21,l-197r-2-32,197r,2,
1693,Car hazart conuint devier,21,l-197r-2-33,197r,2,
1694,Que loiauté ot en envie,21,l-197r-2-34,197r,2,
1695,Mais ne pot a cele eſcremie,21,l-197r-2-35,197r,2,
1696,Faire en mal non qu'il cheï,21,l-197r-2-36,197r,2,
1697,Mais abondꝛoit li meſchay,21,l-197r-2-37,197r,2,
1698,Car tous joꝛs de l'envie y ot.,21,l-197r-2-38,197r,2,
1699,Et .i. ribault qui envie ot,21,l-197v-1-1,197v,1,
1700,Du cheval ot haſart ot ſis,21,l-197v-1-2,197v,1,
1701,Le demande et ot ſi aſſis,21,l-197v-1-3,197v,1,
1702,Son francois a li demander,21,l-197v-1-4,197v,1,
1703,Que il l'ot ſans contremander,21,l-197v-1-5,197v,1,
1704,Li ſolaus qui d'oꝛe ne ment,22,l-197v-1-6,197v,1,
1705,Va ſi par mi le firmament,22,l-197v-1-7,197v,1,
1706,Monte de degre en degre,22,l-197v-1-8,197v,1,
1707,Qu'il laiſſa tierce tot de gré,22,l-197v-1-9,197v,1,
1708,Et devers miedie ſe toꝛna,22,l-197v-1-10,197v,1,
1709,Quant de toꝛnoier ſ'atoꝛna,22,l-197v-1-11,197v,1,
1710,Abſtinence contre guerſai,22,l-197v-1-12,197v,1,
1711,Ne iouſta pas par tel eſſai,22,l-197v-1-13,197v,1,
1712,Com /Raoul de /hodenc iouſta,22,l-197v-1-14,197v,1,
1713,Car /Raoul a li ſ'aiouſta,22,l-197v-1-15,197v,1,
1714,Et eſcremi et fu vaincu,22,l-197v-1-16,197v,1,
1715,Mais a guerſai hauberc veſtu,22,l-197v-1-17,197v,1,
1716,Ne valut riens a ceſt aſſault,22,l-197v-1-18,197v,1,
1717,Qu'abſtinence guerſai aſſault,22,l-197v-1-19,197v,1,
1718,Et le rent mat par atempꝛance,22,l-197v-1-20,197v,1,
1719,Et a ferue de la lance,22,l-197v-1-21,197v,1,
1720,Yurece deſſous la mamele,22,l-197v-1-22,197v,1,
1721,D'un cop eſtoꝛt elle chancele,22,l-197v-1-23,197v,1,
1722,Et chiet el pꝛe toute eſtoꝛdie,22,l-197v-1-24,197v,1,
1723,Apres yvrece a ribaudie,22,l-197v-1-25,197v,1,
1724,Au tournoier d'armes outree,22,l-197v-1-26,197v,1,
1725,Poꝛ ce qu'ele ert harigotee,22,l-197v-1-27,197v,1,
1726,Iouſta a lui par tel deſdaing,22,l-197v-1-28,197v,1,
1727,Qu'en .i. putel en a fait baing,22,l-197v-1-29,197v,1,
1728,C'onques n'i volt querre autre place,22,l-197v-1-30,197v,1,
1729,Au treſtoꝛner l'eſcu embꝛace,22,l-197v-1-31,197v,1,
1730,Et va jouſter a gloutenie,22,l-197v-1-32,197v,1,
1731,Et l'abat par tele ennaye,22,l-197v-1-33,197v,1,
1732,Du cheval par enſon la croupe,22,l-197v-1-34,197v,1,
1733,Qu'en .i. margas en a fait ſoupe,22,l-197v-1-35,197v,1,
1734,Et l'a en la boe leſſiee,22,l-197v-1-36,197v,1,
1735,Et vait ferir lance beſſiee,22,l-197v-1-37,197v,1,
1736,Lecherie plus que les ambles,22,l-197v-1-38,197v,1,
1737,L'eſcu de gueules et de langues,22,l-197v-1-39,197v,1,
1738,Li perce jusqu'en la foꝛcele,22,l-197v-1-40,197v,1,
1739,Son coup eſtoꝛt cele cha[n]cele,22,l-197v-2-1,197v,2,
1740,Mais ne cheï pas maintenant,22,l-197v-2-2,197v,2,
1741,Et abſtinence .i. dart trenchant,22,l-197v-2-3,197v,2,
1742,Quant elle ot froiſſiee ſa lance,22,l-197v-2-4,197v,2,
1743,Tres par mi la gueule li lance,22,l-197v-2-5,197v,2,
1744,Et en hault ſ'eſcrie biau meſtre,22,l-197v-2-6,197v,2,
1745,De tiex moꝛſiaus vous ſai je peſtre,22,l-197v-2-7,197v,2,
1746,Oꝛ engoulez ceſte goulee,22,l-197v-2-8,197v,2,
1747,Une foꝛt lance a recouuree,22,l-197v-2-9,197v,2,
1748,S'en a lecherie ferue,22,l-197v-2-10,197v,2,
1749,Si roidement ſans atendue,22,l-197v-2-11,197v,2,
1750,Quele chai honteuſe et mate,22,l-197v-2-12,197v,2,
1751,De la lance qui pas n'eſclate,22,l-197v-2-13,197v,2,
1752,Vait ferir par grant vaſſelage,22,l-197v-2-14,197v,2,
1753,N'ainſne filz vilennie enrage.,22,l-197v-2-15,197v,2,
1754,En l'eſcu paint de gloutonnie,22,l-197v-2-16,197v,2,
1755,Et l'empoꝛte jus et l'e[n]nvie,22,l-197v-2-17,197v,2,
1756,En .i. mergas trouble et puant,22,l-197v-2-18,197v,2,
1757,Et cil heraut le vont hua[n]t,22,l-197v-2-19,197v,2,
1758,Car au chëoir donna g[ra]t flat,22,l-197v-2-20,197v,2,
1759,La le leſſet honteus et mat.,22,l-197v-2-21,197v,2,
1760,Et ſe plunge entre ceus de la,22,l-197v-2-22,197v,2,
1761,Vilennie qui cheval a,22,l-197v-2-23,197v,2,
1762,Tout le meilloꝛ qui ſoit en vie,22,l-197v-2-24,197v,2,
1763,Poꝛ aſſambler a coꝛtoiſie,22,l-197v-2-25,197v,2,
1764,Des rens /Antecriſt ſe deſroute,22,l-197v-2-26,197v,2,
1765,Cele qui n'ert fole ne gloute,22,l-197v-2-27,197v,2,
1766,La recut au fer de ſa lance,22,l-197v-2-28,197v,2,
1767,Si roidem[en]t qu'il la li lance,22,l-197v-2-29,197v,2,
1768,En .i. foſſe toute eſtendue,22,l-197v-2-30,197v,2,
1769,Et .i. heraut ſans atendue,22,l-197v-2-31,197v,2,
1770,Qui la vit ou putel flatie,22,l-197v-2-32,197v,2,
1771,A eſcriee vilonnie,22,l-197v-2-33,197v,2,
1772,Et diſt Diex c'on l'a bien berſee,22,l-197v-2-34,197v,2,
1773,Ha Diex com l'a bien enuerſee,22,l-197v-2-35,197v,2,
1774,Vilennie Diex com biau lit,22,l-197v-2-36,197v,2,
1775,Oꝛ eſt elle en ſon grant délit,22,l-197v-2-37,197v,2,
1776,Tout ainſi com heraut la huie,22,l-197v-2-38,197v,2,
1777,Et tuit li autre a une huie,22,l-197v-2-39,197v,2,
1778,Ont ſi vilennie huee,22,l-198r-1-1,198r,1,
1779,C'onques mais ſi tres grant huee,22,l-198r-1-2,198r,1,
1780,Ne fu en nule place oïe,22,l-198r-1-3,198r,1,
1781,Quele fu ſi grant que l'oïe,22,l-198r-1-4,198r,1,
1782,Ala jusqu'a deſeſperance,22,l-198r-1-5,198r,1,
1783,Et coꝛtoiſie de la lance,22,l-198r-1-6,198r,1,
1784,Feri ſi roidement loſenge,22,l-198r-1-7,198r,1,
1785,Que l'eſcu poꝛtrait a loſenge,22,l-198r-1-8,198r,1,
1786,Li fent et l'auberc li deſmaille,22,l-198r-1-9,198r,1,
1787,Entre le fer par mi l'entraille,22,l-198r-1-10,198r,1,
1788,Et penoncel et fer et fuſt,22,l-198r-1-11,198r,1,
1789,Loꝛs li veniſt miex quele fuſt,22,l-198r-1-12,198r,1,
1790,Chiez les loſenges herbergie,22,l-198r-1-13,198r,1,
1791,Car coꝛtoiſie l'a leſſie,22,l-198r-1-14,198r,1,
1792,Enmi le pꝛe honteuſe et mate,22,l-198r-1-15,198r,1,
1793,D'un cop eſtoit la lance eſclate,22,l-198r-1-16,198r,1,
1794,Et ſ'en paſſe mais des retrous,22,l-198r-1-17,198r,1,
1795,Fiert meſdis qui vient a eſtrous,22,l-198r-1-18,198r,1,
1796,Iouſter a li par grant deſpit,22,l-198r-1-19,198r,1,
1797,Et coꝛtoiſie ſans reſpit,22,l-198r-1-20,198r,1,
1798,Au toꝛner a le bꝛanc mi trait,22,l-198r-1-21,198r,1,
1799,Et l'yaume a rampoſnes poꝛtrait,22,l-198r-1-22,198r,1,
