line_no,text,lg,l_id,folio,col,speaker
893,Quant ſa grant biauté tant priſoient,27,l-402v-1-21,402v,1,
894,Quant touchieꝛs,28,l-402v-1-22,402v,1,
895,ot ce entendu,28,l-402v-1-23,402v,1,
896,Et gouteꝛs,28,l-402v-1-24,402v,1,
897,plus n'ot atendu,28,l-402v-1-25,402v,1,
898,Ainz ſont friant et eſueilliet,28,l-402v-1-26,402v,1,
899,Et penſent qu'il ſont traueilliet,28,l-402v-2-1,402v,2,
900,Lonc temps pour nient en vanité,28,l-402v-2-2,402v,2,
901,Mais ſ'il treuvent humilité,28,l-402v-2-3,402v,2,
902,En baiſſant gouteꝛ gouteꝛa,28,l-402v-2-4,402v,2,
903,Ce que touchieꝛs enſeingneꝛa,28,l-402v-2-5,402v,2,
904,Jamais le cueꝛ en fait deſfance,28,l-402v-2-6,402v,2,
905,Ne les paſſeꝛa d'ignoꝛence,28,l-402v-2-7,402v,2,
906,Qu'il queꝛront deduit en la chace,28,l-402v-2-8,402v,2,
907,N'eſt mais dꝛois que li cueꝛs debate,28,l-402v-2-9,402v,2,
908,Qu'il fuient ſelonc leur entente,28,l-402v-2-10,402v,2,
909,Ainz doit vivre en la douce atente,28,l-402v-2-11,402v,2,
910,De deduit qui eſt non pareux,28,l-402v-2-12,402v,2,
911,Et de quoi cilz ſens tout par eux,28,l-402v-2-13,402v,2,
912,Si eureuſement ſeꝛoient,28,l-402v-2-14,402v,2,
913,Raempli que miex ne querroient,28,l-402v-2-15,402v,2,
914,Quant pities madame mouura,28,l-402v-2-16,402v,2,
915,Tant qu'a moi ſa grace esmourra,28,l-402v-2-17,402v,2,
916,Que me venra meꝛci donneꝛ,28,l-402v-2-18,402v,2,
917,Pour plaiſenment gueꝛredonneꝛ,28,l-402v-2-19,402v,2,
918,Le ſeꝛuice de vrai ami,28,l-402v-2-20,402v,2,
919,Mi. ſens quar chaſcun pour ſon plaire,28,l-402v-2-21,402v,2,
920,Deſirroit ſon office a faire,28,l-402v-2-22,402v,2,
921,Ou plus cuidoit deduit avoir,28,l-402v-2-23,402v,2,
922,Ainſi ne ſavoie ja voir,28,l-402v-2-24,402v,2,
923,Que faire ainz eſtoie eſbahis,28,l-402v-2-25,402v,2,
924,J'eſtoie par mes ſens trais,28,l-402v-2-26,402v,2,
925,Qui me deuſſent gouuerneꝛ,28,l-402v-2-27,402v,2,
926,Mais amours qui pas ſeiourneꝛ,28,l-402v-2-28,402v,2,
927,Ne veut tant que m'ait mis a point,28,l-402v-2-29,402v,2,
928,Se rembat ſur moy en cel point,28,l-402v-2-30,402v,2,
929,Et pour recommancieꝛ l'aſaut,28,l-402v-2-31,402v,2,
930,Hue bas et pensee ſaut,28,l-402v-2-32,402v,2,
931,Si me pꝛent et m'a griement moꝛs,28,l-402v-2-33,402v,2,
932,Car touz mes ſans ſ'en eſt fuis,28,l-402v-2-34,402v,2,
933,Et ſui auſſi qu'eſuanuis,28,l-402v-2-35,402v,2,
934,Loꝛs que je fui pꝛis de pensee,28,l-402v-2-36,402v,2,
935,Dont ne puis plus eſtre tanſſee,28,l-402v-2-37,402v,2,
936,Ma ionnece au buiſſon plaiſant,28,l-402v-2-38,402v,2,
937,Ou tant m'ieꝛe aleꝛ aaiſſant,28,l-403r-1-1,403r,1,
938,Quar je ſai bien qu'amours penſe,28,l-403r-1-2,403r,1,
939,Qu'il eſt iſſues hoꝛs d'ingnocence,28,l-403r-1-3,403r,1,
940,Bien voi que voidieꝛ me convient,28,l-403r-1-4,403r,1,
941,Loꝛs ſail hoꝛs que quant me ſouuient,28,l-403r-1-5,403r,1,
942,Selonc ce que penſe avoie,28,l-403r-1-6,403r,1,
943,De la belle pleſſant et gaye,28,l-403r-1-7,403r,1,
944,En qui parfaitement compꝛis,28,l-403r-1-8,403r,1,
945,Eſt tout quanqu'il afieꝛt apꝛis,28,l-403r-1-9,403r,1,
946,Il m'eſtuet changieꝛ contenance,28,l-403r-1-10,403r,1,
947,Et ce me met en grant doutance,28,l-403r-1-11,403r,1,
948,Que bien voi ſomme laiſſe prendꝛe,28,l-403r-1-12,403r,1,
949,Qu'il me convendꝛa trop aprendꝛe,28,l-403r-1-13,403r,1,
950,D'angoiſſe ainz que puiſſe monteꝛ,28,l-403r-1-14,403r,1,
951,Si haut qu'elle weille aconteꝛ,28,l-403r-1-15,403r,1,
952,A moy. et ce me fait peur,28,l-403r-1-16,403r,1,
953,Car je vis de l'eſtat ſeur,28,l-403r-1-17,403r,1,
954,Qui m'ieꝛt de tout anui tenſſant,28,l-403r-1-18,403r,1,
955,Dont ſe complaint mes cueꝛs penſſant,28,l-403r-1-19,403r,1,
956,Belle et bonne entieꝛement.,29,l-403r-1-20,403r,1,
957,Treſoꝛ de joie et d'onneur.,29,l-403r-1-21,403r,1,
958,Oꝛ ne puis je longuement,29,l-403r-1-22,403r,1,
959,fuir contre vostre amour,29,l-403r-1-23,403r,1,
960,Li temps eſt uenus.,29,l-403r-1-24,403r,1,
961,ſi me rens pꝛis et tenus vaincus.,29,l-403r-1-25,403r,1,
962,Oꝛdenez ent.,29,l-403r-1-26,403r,1,
963,Vostres gent coꝛps m'eſpꝛent.,30,l-403r-1-27,403r,1,
964,Et ſi pꝛans en vos valour,30,l-403r-1-28,403r,1,
965,vouloir d'ameꝛ loy alment.,30,l-403r-1-29,403r,1,
966,Eſpoit pꝛens en vo douceur,30,l-403r-1-30,403r,1,
967,d'eſtre retenus.,30,l-403r-1-31,403r,1,
968,Oꝛ ſoit pitiez mes es cus,30,l-403r-1-32,403r,1,
969,ſe raiſon le vous deſfant.,30,l-403r-1-33,403r,1,
970,puis qu'a vous me ſui rendus.,30,l-403r-1-34,403r,1,
971,Oꝛdenez ent.,30,l-403r-1-35,403r,1,
972,Oꝛ m'oes piteuſement.,31,l-403r-1-36,403r,1,
973,Dous cueꝛs a qui nul anui tour.,31,l-403r-1-37,403r,1,
974,Ne puis vivre bien le ſent.,31,l-403r-1-38,403r,1,
975,Se je n'ai bꝛiement retour,31,l-403r-1-39,403r,1,
976,d'eſtre ſecourus.,31,l-403r-1-40,403r,1,
977,ſ'il vous plais je ſui peꝛdus,31,l-403r-1-41,403r,1,
978,ouurites joieu ſement,31,l-403r-1-42,403r,1,
979,pour ce pitié audeſſus.,31,l-403r-1-43,403r,1,
980,Oꝛ denez ent.,31,l-403r-1-44,403r,1,
981,En ſecres dis ha; belle et gente,32,l-403r-1-45,403r,1,
982,Sage plaiſſans oꝛ eſt l'entente,32,l-403r-2-1,403r,2,
983,Du tout a vostre dous vouloir,32,l-403r-2-2,403r,2,
984,Que ſanz pareil en biauté pure,32,l-403r-2-3,403r,2,
985,Eſtes de toute creature,32,l-403r-2-4,403r,2,
986,Flours floꝛiſſans et c'eſt du mains,32,l-403r-2-5,403r,2,
987,Car nus entendemens humains,32,l-403r-2-6,403r,2,
988,Ne vaut. puiſt penſeꝛ n'antendꝛe,32,l-403r-2-7,403r,2,
989,A la bonté de vous entendꝛe,32,l-403r-2-8,403r,2,
990,Bien voi que vostre dous dengier,32,l-403r-2-9,403r,2,
991,Feꝛa amours mon temps changier,32,l-403r-2-10,403r,2,
992,Je ne pourrai veꝛs vous fuir,32,l-403r-2-11,403r,2,
993,Se moꝛs me devoit anuir,32,l-403r-2-12,403r,2,
994,Couuenra qu'amours me pꝛaigne,32,l-403r-2-13,403r,2,
995,Par vous et eſtat que j'ataigne,32,l-403r-2-14,403r,2,
996,Vostre vouloir quant pris m'arés,32,l-403r-2-15,403r,2,
997,Je ne ſai ſe ja jour ſares,32,l-403r-2-16,403r,2,
998,Comment amours me demenra,32,l-403r-2-17,403r,2,
999,Mais tant que par vous venra,32,l-403r-2-18,403r,2,
1000,Moꝛt ou ma ſente ou joie,32,l-403r-2-19,403r,2,
1001,Vueil pꝛendꝛe en gré ou que je ſoie,32,l-403r-2-20,403r,2,
1002,Mais ce m'eſmaie trop ſanz faille,32,l-403r-2-21,403r,2,
1003,Que paour ay que ne vous chaille,32,l-403r-2-22,403r,2,
1004,De ce que j'ay a endureꝛ,32,l-403r-2-23,403r,2,
1005,Dont me laiſſiez ainſi dureꝛ,32,l-403r-2-24,403r,2,
1006,Ne vous chaura comment ce ſoit,32,l-403r-2-25,403r,2,
1007,Ne pour quant ſ'il ne vous plaiſoit,32,l-403r-2-26,403r,2,
1008,Le mien ſeꝛuice a recevoir,32,l-403r-2-27,403r,2,
1009,Ne puis vivre je le ſai de voir,32,l-403r-2-28,403r,2,
1010,Ne puis eſtre de moꝛt reſcous,32,l-403r-2-29,403r,2,
1011,Et ſeꝛont li bon ames tous,32,l-403r-2-30,403r,2,
1012,Qu'amours m'a ja mis au devant,32,l-403r-2-31,403r,2,
1013,Quat ſ'il vont vo cueꝛ eſleuant,32,l-403r-2-32,403r,2,
1014,Que les metres encontre mi,32,l-403r-2-33,403r,2,
1015,Riens eſt de ma vie et demi,32,l-403r-2-34,403r,2,
1016,Fins cueꝛs ſi n'i prenez pas guarde,32,l-403r-2-35,403r,2,
1017,Mais ſe pitié vers moi regarde,32,l-403r-2-36,403r,2,
1018,Tant que vouſſiſſiez ameꝛ,32,l-403r-2-37,403r,2,
1019,On me devroit bien blaſmeꝛ,32,l-403r-2-38,403r,2,
1020,Se jamés contre vous fuioie,32,l-403v-1-1,403v,1,
1021,Mais ne ſai en moi trouveꝛ voie,32,l-403v-1-2,403v,1,
1022,Comme je puiſſe avenir,32,l-403v-1-3,403v,1,
1023,De ce que .i. ſeul ſouvenir,32,l-403v-1-4,403v,1,
1024,De moi recevoir vous veniſt,32,l-403v-1-5,403v,1,
1025,Quar je ſai bien qu'ancoꝛe vit,32,l-403v-1-6,403v,1,
1026,De vous riens qui par amours veigne,32,l-403v-1-7,403v,1,
1027,N'il n'eſt dꝛois qu'il vous en ſoueigne,32,l-403v-1-8,403v,1,
1028,Car n'eſtez d'amoureus couvent,32,l-403v-1-9,403v,1,
1029,Encoꝛe ainz v premieꝛ iouuent,32,l-403v-1-10,403v,1,
1030,Vous tient nature qui a mis,32,l-403v-1-11,403v,1,
1031,En vous biens plus c'onques promis,32,l-403v-1-12,403v,1,
1032,N'avoit a matieꝛe oꝛdeneꝛ,32,l-403v-1-13,403v,1,
1033,Car tant ſe vout de vous peneꝛ,32,l-403v-1-14,403v,1,
1034,Que a vous fourmeꝛ ſi noblement,32,l-403v-1-15,403v,1,
1035,Miſt ſon pooir entieꝛement,32,l-403v-1-16,403v,1,
1036,Et tout ſon ſans et ſe ſavoit,32,l-403v-1-17,403v,1,
1037,Faire ainſi belle et ſe elle avoit,32,l-403v-1-18,403v,1,
1038,Matieꝛe diſpoſee apoint,32,l-403v-1-19,403v,1,
1039,Jamais n'en venroit en cel point,32,l-403v-1-20,403v,1,
1040,Car tout a ſouhait en vous vint,32,l-403v-1-21,403v,1,
1041,Et de age entre .xvi. ans et vint,32,l-403v-1-22,403v,1,
1042,V point que chaleur en ſouvint,32,l-403v-1-23,403v,1,
1043,Fait biauté croiſtre et eſpanir,32,l-403v-1-24,403v,1,
1044,Et donne apetit et plaiſſance,32,l-403v-1-25,403v,1,
1045,N'onques n'eüſtez connoiſſance,32,l-403v-1-26,403v,1,
1046,Que c'eſt ne d'ami ne d'ameꝛ,32,l-403v-1-27,403v,1,
1047,Dont te tendꝛoie a en ce mueꝛ,32,l-403v-1-28,403v,1,
1048,Vouloir premieꝛs bien pour voie,32,l-403v-1-29,403v,1,
1049,Tant atendꝛoie que je moꝛroie,32,l-403v-1-30,403v,1,
1050,Si eſt grant peꝛis de l'enprendꝛe,32,l-403v-1-31,403v,1,
1051,Car bien voi ſe me leſſe prendꝛe,32,l-403v-1-32,403v,1,
1052,J'entrepꝛendꝛai trop grief fais,32,l-403v-1-33,403v,1,
1053,Ha; amours eſt ce de ces fais,32,l-403v-1-34,403v,1,
1054,Ses tu de tiex reuiaus iueꝛ,32,l-403v-1-35,403v,1,
1055,Quant pour moi ſe jone cueꝛ,32,l-403v-1-36,403v,1,
1056,Me veut pꝛendꝛe ceſt outre raiſon,32,l-403v-1-37,403v,1,
1057,S'il y eüſt juſte achoiſſon,32,l-403v-1-38,403v,1,
1058,On te peüſt bien excuſſeꝛ,32,l-403v-2-1,403v,2,
1059,Mais ta vie veus faire muſeꝛ,32,l-403v-2-2,403v,2,
1060,Si haut que je ſui ja aſſés,32,l-403v-2-3,403v,2,
1061,Du conſideꝛeꝛ 7 laſſes,32,l-403v-2-4,403v,2,
1062,Tu me veus bien faire au vent tendꝛe,32,l-403v-2-5,403v,2,
1063,Quant riche. ſage. jonne. et tendꝛe,32,l-403v-2-6,403v,2,
1064,A moy qui ſui uns enfancons,32,l-403v-2-7,403v,2,
1065,Veus faire ameꝛ ceſte lecons,32,l-403v-2-8,403v,2,
1066,Ne me ſeꝛa ja repetee,32,l-403v-2-9,403v,2,
1067,Ains m'en fuirai ceſte levee,32,l-403v-2-10,403v,2,
1068,N'ai cure d'eſtre pꝛis ſ'ay dꝛoit,32,l-403v-2-11,403v,2,
1069,On dit que tu donnes a dꝛoit,32,l-403v-2-12,403v,2,
1070,Pareil a chaſcun ſelonc li,32,l-403v-2-13,403v,2,
1071,Mais c'eſt faus car en vers celui,32,l-403v-2-14,403v,2,
1072,Ne fui ne qu'eſtains encontre oꝛ,32,l-403v-2-15,403v,2,
1073,S[e] tu m'auoies en reſtoꝛ,32,l-403v-2-16,403v,2,
1074,Li pꝛiſſe ſe ſavoit raiſons,32,l-403v-2-17,403v,2,
1075,Ainſſi di quar onques mais hons,32,l-403v-2-18,403v,2,
1076,Ne fu ſi griement aſaillis,32,l-403v-2-19,403v,2,
1077,J'eꝛe du buiſſons ſaillis,32,l-403v-2-20,403v,2,
1078,Penſee m'en avoit chacie,32,l-403v-2-21,403v,2,
1079,Et amours qui m'ot dechacie,32,l-403v-2-22,403v,2,
1080,Tant qu'an j'eꝛe traueillies,32,l-403v-2-23,403v,2,
1081,Doutiex penſis desconſeillies,32,l-403v-2-24,403v,2,
1082,Voiz encontre les chiens fuiant,32,l-403v-2-25,403v,2,
1083,Par ſon dous amoureus debat,32,l-403v-2-26,403v,2,
1084,Le chemin cointiſſe m'en bat,32,l-403v-2-27,403v,2,
1085,Moult me plut au commancement,33,l-403v-2-28,403v,2,
1086,Cointiſſe. ſi qu'antieꝛement,33,l-403v-2-29,403v,2,
1087,Selonc mon povoir m'i tenoie,33,l-403v-2-30,403v,2,
1088,Et pour veꝛité je y pꝛenoie,33,l-403v-2-31,403v,2,
1089,Plaiſſance en tant qu'antre la gent,33,l-403v-2-32,403v,2,
1090,Me faiſſoit contenir plus gent,33,l-403v-2-33,403v,2,
1091,Car courtoiſſie avec franchiſſe,33,l-403v-2-34,403v,2,
1092,Mainnent avec vraie cointiſſe,33,l-403v-2-35,403v,2,
1093,Et pour ce eſt ſi plaiſſant la voie,33,l-403v-2-36,403v,2,
1094,Et a roy plus c'onques n'avoie,33,l-403v-2-37,403v,2,
1095,Auant qu'amours m'eüſt meu,33,l-403v-2-38,403v,2,
1096,Ce ioli chemin conneu,33,l-404r-1-1,404r,1,
1097,N'onques avant eſté n'avoie,33,l-404r-1-2,404r,1,
1098,Foꝛs tant ſanz plus quant je veoie,33,l-404r-1-3,404r,1,
1099,Ceus qu'amours i avoit menez,33,l-404r-1-4,404r,1,
1100,Iolis. joians. gays oꝛdenez,33,l-404r-1-5,404r,1,
1101,Et que ueoie que leur fait,33,l-404r-1-6,404r,1,
1102,Erent en toute honneſte fait,33,l-404r-1-7,404r,1,
1103,On diſſoit bien ce que ce faiſſoit,33,l-404r-1-8,404r,1,
1104,Amours qui les y conduiſſoit,33,l-404r-1-9,404r,1,
1105,Dont moult me plot a grant merveille,33,l-404r-1-10,404r,1,
1106,L'oꝛdenance qui me conſeille,33,l-404r-1-11,404r,1,
1107,A moy maintenir cointement,33,l-404r-1-12,404r,1,
1108,Mais amours qui moult aigrement,33,l-404r-1-13,404r,1,
1109,Me chacoit rioit aprés moy,33,l-404r-1-14,404r,1,
1110,Loꝛs ſaillent chien ſanz nul abay,33,l-404r-1-15,404r,1,
1111,Plaiſance acueurt et vouloirs ſaut,33,l-404r-1-16,404r,1,
1112,Souuenirs vient penſeꝛs m'aſaut,33,l-404r-1-17,404r,1,
1113,Renons ſ'eſcrie et amours coꝛne,33,l-404r-1-18,404r,1,
1114,Loꝛs ſe tienent penſis et moꝛne,33,l-404r-1-19,404r,1,
1115,Mi ſens regars eſt arreſtez,33,l-404r-1-20,404r,1,
1116,Oirs d'eſcouteꝛ apreſtez,33,l-404r-1-21,404r,1,
1117,Gouſteꝛ eſtoit tout entrepꝛis,33,l-404r-1-22,404r,1,
1118,Touchieꝛs vouroit ja eſtre pꝛis,33,l-404r-1-23,404r,1,
1119,Et flairieꝛs. dont plus n'i a mais,33,l-404r-1-24,404r,1,
1120,A fuir je les ay peꝛdus,33,l-404r-1-25,404r,1,
1121,Loꝛs ſ'en fuit mes cueꝛs eſperdus,33,l-404r-1-26,404r,1,
1122,Quant qu'il puet ſe va d'eulz gaitant,33,l-404r-1-27,404r,1,
1123,Mais amours qui le va coitant,33,l-404r-1-28,404r,1,
1124,Par ſa foꝛce me ramenoit,33,l-404r-1-29,404r,1,
1125,Ou biauté coie ſe tenoit,33,l-404r-1-30,404r,1,
1126,Et loꝛs que regars l'ot veue,33,l-404r-1-31,404r,1,
1127,Li a ſa ſoif ſi foꝛt creue,33,l-404r-1-32,404r,1,
1128,Qu'au lieu amoureuus regardeꝛ,33,l-404r-1-33,404r,1,
1129,Ne ſe puet ne me veut guardeꝛ,33,l-404r-1-34,404r,1,
1130,Tant plaiſſenment eſt detenus,33,l-404r-1-35,404r,1,
1131,Que ydꝛopiques eſt deuenus,33,l-404r-1-36,404r,1,
1132,Et bien a ſon contenir peꝛt,33,l-404r-1-37,404r,1,
1133,Quar nient plus que ydꝛopiques part,33,l-404r-1-38,404r,1,
1134,La ſoif qui l'engoiſſe en buuant,33,l-404r-2-1,404r,2,
1135,Ainſi quant biauté eſt devant,33,l-404r-2-2,404r,2,
1136,Regars n'eſt de ſa ſoif deliures,33,l-404r-2-3,404r,2,
1137,Ainz a plus ſoif com plus eſt yvres,33,l-404r-2-4,404r,2,
1138,En ſucant plaiſſance buuoit,33,l-404r-2-5,404r,2,
1139,Et quant plus le voit plus le ſeche,33,l-404r-2-6,404r,2,
1140,C'eſt yvrece qui touz jours leiche,33,l-404r-2-7,404r,2,
1141,En ſoy moꝛdant ſe va lechant,33,l-404r-2-8,404r,2,
1142,Et en beuant ſe va lechant,33,l-404r-2-9,404r,2,
1143,C'eſt ydꝛopiſie amoureuſe,33,l-404r-2-10,404r,2,
1144,Et yureſce la deſirreuſe,33,l-404r-2-11,404r,2,
1145,Qui fait eſioir et doloir,33,l-404r-2-12,404r,2,
1146,Qui en ſuſcant delant le voloir,33,l-404r-2-13,404r,2,
1147,D'ami le plaiſt de conuoitiſſe,33,l-404r-2-14,404r,2,
1148,S'ilz boire la chaleur atiſſe,33,l-404r-2-15,404r,2,
1149,Qui fait le cueꝛ frire et lardeꝛ,33,l-404r-2-16,404r,2,
1150,Quant ſ'entr'oublie a regardeꝛ,33,l-404r-2-17,404r,2,
1151,C'eſt amoureuſſe ydꝛopiſie,33,l-404r-2-18,404r,2,
1152,Ceſte deduiſſant melodie,33,l-404r-2-19,404r,2,
1153,Eſtoit ce qui ſi me doloit,33,l-404r-2-20,404r,2,
1154,Regars qui fuir me vouloit,33,l-404r-2-21,404r,2,
1155,Ainz menoit a quelque paine,33,l-404r-2-22,404r,2,
1156,Vs biauté qui ieꝛt la fontaine,33,l-404r-2-23,404r,2,
1157,Ou il buuoit ſanz ſaouleꝛ,33,l-404r-2-24,404r,2,
1158,Onques n'i leſſai a aleꝛ,33,l-404r-2-25,404r,2,
1159,Pour les chiens. Aincois par mi eulz,33,l-404r-2-26,404r,2,
1160,Au douz gent coꝛs deliciex,33,l-404r-2-27,404r,2,
1161,Apercoi loꝛs pour miex choiſſir,33,l-404r-2-28,404r,2,
1162,Sa noble biauté a loiſſir,33,l-404r-2-29,404r,2,
1163,Et pour vëoir com plus le veoie,33,l-404r-2-30,404r,2,
1164,Plus me plaiſſoit et me prenoie,33,l-404r-2-31,404r,2,
1165,Com papillons a la chandelle,33,l-404r-2-32,404r,2,
1166,Et n'eſtoit ce pas merveille,33,l-404r-2-33,404r,2,
1167,Quar en la phiſoſonomie,33,l-404r-2-34,404r,2,
1168,Plaiſſant prometant amie,33,l-404r-2-35,404r,2,
1169,Et eſpoit de vie et ſuſtance,33,l-404r-2-36,404r,2,
1170,Et ſi gracieuſe ſemblance,33,l-404r-2-37,404r,2,
1171,Qu'an voit la couleur du viaire,33,l-404r-2-38,404r,2,
1172,La bouche riant debonnaire,33,l-404v-1-1,404v,1,
1173,Eſpeꝛeꝛ grace me faiſſoit,33,l-404v-1-2,404v,1,
1174,Et trop doucement m'apaiſſoit,33,l-404v-1-3,404v,1,
1175,Li regars dous et amoureus,33,l-404v-1-4,404v,1,
1176,D'uns iex bꝛuns. ſes gay. et riens,33,l-404v-1-5,404v,1,
1177,Si par caus pour ſouef ouvrir,33,l-404v-1-6,404v,1,
1178,Coꝛps pour cueꝛ traire et deſcouurir,33,l-404v-1-7,404v,1,
1179,Qu'il plais a tous vrais amis dont,33,l-404v-1-8,404v,1,
1180,Liez et joiaus diſſoie adont,33,l-404v-1-9,404v,1,
1181,Fins cueꝛs dous quant paieꝛont,34,l-404v-1-10,404v,1,
1182,Vostre oeil ce que il m'ont pꝛo mis.,34,l-404v-1-11,404v,1,
1183,Se faus entendꝛe me font.,34,l-404v-1-12,404v,1,
1184,Moꝛs ſui je n'ai plus d'amis.,34,l-404v-1-13,404v,1,
1185,Et ce par eulz ſui trais,34,l-404v-1-14,404v,1,
1186,par pꝛomeſſe en atraient,34,l-404v-1-15,404v,1,
1187,je ſay bien ou ament.,34,l-404v-1-16,404v,1,
1188,ſe rende pꝛis.,34,l-404v-1-17,404v,1,
1189,Car ſi plaiſant douceur ont,35,l-404v-1-18,404v,1,
1190,en leur dous regars compꝛis,35,l-404v-1-19,404v,1,
1191,Quant ſentir mon cueꝛ refont.,35,l-404v-1-20,404v,1,
1192,Mes coꝛs eſt en vigueur mis,35,l-404v-1-21,404v,1,
1193,et je ſui ſi esbahis,35,l-404v-1-22,404v,1,
1194,de joie en eulx regardant,35,l-404v-1-23,404v,1,
1195,Que tuit mi ſens mi laiſſent,35,l-404v-1-24,404v,1,
1196,ſe rendent pꝛis.,35,l-404v-1-25,404v,1,
1197,Ainſi mi debteur,36,l-404v-1-26,404v,1,
1198,je les ai em pleige pꝛis.,36,l-404v-1-27,404v,1,
1199,Dont ſe vos cueꝛs ne reſpont,36,l-404v-1-28,404v,1,
1200,pour eulx je ſui deſconfis.,36,l-404v-1-29,404v,1,
1201,ſi weilliez gent coꝛps faitis,36,l-404v-1-30,404v,1,
1202,a moi pou euls faire tant,36,l-404v-1-31,404v,1,
1203,que vo vouloir en auent,36,l-404v-1-32,404v,1,
1204,ſe rendent pꝛis.,36,l-404v-1-33,404v,1,
1205,Ainſi gayement entrepꝛis,37,l-404v-1-34,404v,1,
1206,En vëoir ma dame de pꝛis,37,l-404v-1-35,404v,1,
1207,M'aſeuroie et deuiſſoie,37,l-404v-1-36,404v,1,
1208,Et en boy penſoie et diſſoie,37,l-404v-1-37,404v,1,
1209,Qu'au coꝛs ſi gent et ſi parfait,37,l-404v-1-38,404v,1,
1210,Ne povoit avoir riens par fait,37,l-404v-1-39,404v,1,
1211,Foꝛs douceurs et humelite,37,l-404v-1-40,404v,1,
1212,Si mi aſeurai pour pitié,37,l-404v-1-41,404v,1,
1213,Que je penſai qu trouueꝛoie,37,l-404v-1-42,404v,1,
1214,Et en la fin quant je pris ſeꝛoie,37,l-404v-1-43,404v,1,
1215,Et que la ſeꝛoit mes retours,37,l-404v-2-1,404v,2,
1216,Adont laiſſai del tout le coꝛs,37,l-404v-2-2,404v,2,
1217,Ne ſot mais c'un poi treſtourneꝛ,37,l-404v-2-3,404v,2,
1218,Loꝛs commance amours a coꝛneꝛ,37,l-404v-2-4,404v,2,
1219,Si chien ſaillent amours ſemont,37,l-404v-2-5,404v,2,
1220,Et me queurent ſus en .i. mont,37,l-404v-2-6,404v,2,
1221,Je reculai comme eſpeꝛdus,37,l-404v-2-7,404v,2,
1222,Car je avoie mes ſens perdus,37,l-404v-2-8,404v,2,
1223,Regars fu a cel aſſaut pꝛis,37,l-404v-2-9,404v,2,
1224,Car plaiſſa[n]ce qui l'ot ſeur pꝛis,37,l-404v-2-10,404v,2,
1225,Le tient ſi par ydꝛopiſie,37,l-404v-2-11,404v,2,
1226,Qu'an la maladie pꝛiſe,37,l-404v-2-12,404v,2,
1227,Ne ſe pot aidieꝛ ne mouvoir,37,l-404v-2-13,404v,2,
1228,Et oirs eꝛt tenus pour voir,37,l-404v-2-14,404v,2,
1229,Renons et los l'ont abatu,37,l-404v-2-15,404v,2,
1230,S'avoit il aſſés debatu,37,l-404v-2-16,404v,2,
1231,Tant que nul ne l'en doit blaſmeꝛ,37,l-404v-2-17,404v,2,
1232,Prins eſt amours le fait ameꝛ,37,l-404v-2-18,404v,2,
1233,Mi autre ſens ſi eſbahi,37,l-404v-2-19,404v,2,
1234,Erent com ſ'il fuſſent tray,37,l-404v-2-20,404v,2,
1235,Si que ne ſe ſoꝛent deffendꝛe,37,l-404v-2-21,404v,2,
1236,Ainz ſont pꝛis de iex [a] amoureus rendꝛe,37,l-404v-2-22,404v,2,
1237,Par un temps ſouſfrante ceſt eſtour,37,l-404v-2-23,404v,2,
1238,A pꝛis mes cueꝛs fuite et deſtour,37,l-404v-2-24,404v,2,
1239,Comme eſpaoures et douteux,37,l-404v-2-25,404v,2,
1240,Mais li dous veneꝛres ſoutiex,37,l-404v-2-26,404v,2,
1241,Amours qui tant prent et entriſtre,37,l-404v-2-27,404v,2,
1242,.II. leurieꝛs qui eꝛent au titre,37,l-404v-2-28,404v,2,
1243,De manieꝛe touz reſemblans,37,l-404v-2-29,404v,2,
1244,Eſtoit eſpoirs et dous ſemblant,37,l-404v-2-30,404v,2,
1245,Deſcouple et a moy les envoie,37,l-404v-2-31,404v,2,
1246,Dont m'areſtai enmi la voie,37,l-404v-2-32,404v,2,
1247,Sans moy nient pour eulz eſmaieꝛ,37,l-404v-2-33,404v,2,
1248,Quar quant les oÿ abaieꝛ,37,l-404v-2-34,404v,2,
1249,Si com ſemblans eſpoir amaine,37,l-404v-2-35,404v,2,
1250,Pour melodie ſouveꝛaine,37,l-404v-2-36,404v,2,
1251,Les eſcoute ententiuement,37,l-404v-2-37,404v,2,
1252,Car eſpoirs ſi ioieuſſement,37,l-404v-2-38,404v,2,
1253,Plus que nulz autres chiens abaye,37,l-405r-1-1,405r,1,
1254,Qu'il n'eſt nus cueꝛs qui ne ſ'apaie,37,l-405r-1-2,405r,1,
1255,En lui eſcouteꝛ et ouir,37,l-405r-1-3,405r,1,
1256,Dont mon cueꝛ faiſſoit eſioir,37,l-405r-1-4,405r,1,
1257,Ses abays quant il glatiſſoit,37,l-405r-1-5,405r,1,
1258,Que auſſi qu'au pꝛemetant diſſoit,37,l-405r-1-6,405r,1,
1259,Ha; qui te muet a contreſteꝛ,37,l-405r-1-7,405r,1,
1260,Aus biens qu'amours te veut preſteꝛ,37,l-405r-1-8,405r,1,
1261,celi en qui aſſeures,37,l-405r-1-9,405r,1,
1262,Pourras tant d'onneur recevoir,37,l-405r-1-10,405r,1,
1263,Que ſe tu fais bien ton devoir,37,l-405r-1-11,405r,1,
1264,Tu iouiras en l'otroi de grace,37,l-405r-1-12,405r,1,
1265,De l'amour celui qui tout paſſe,37,l-405r-1-13,405r,1,
1266,Le monde quar quant qu'il comprent,37,l-405r-1-14,405r,1,
1267,A ſi douce amour ne ſe pꝛent,37,l-405r-1-15,405r,1,
1268,Adont avras en ton deduit,37,l-405r-1-16,405r,1,
1269,Quant que raiſon de bien conduit,37,l-405r-1-17,405r,1,
1270,Avec le povoir de nature,37,l-405r-1-18,405r,1,
1271,Ha qui n'avroit de ſa figure,37,l-405r-1-19,405r,1,
1272,Que penſſeꝛ et le ſouhaidie,37,l-405r-1-20,405r,1,
1273,N'eſt ce aſſez pour lui aidieꝛ,37,l-405r-1-21,405r,1,
1274,A lui ou uouloir eſioir,37,l-405r-1-22,405r,1,
1275,Plus d'aſſés que d'autre ioir,37,l-405r-1-23,405r,1,
1276,Regarde l'amoureus viaire,37,l-405r-1-24,405r,1,
1277,Criens tu que ſi bel ſaintuaire,37,l-405r-1-25,405r,1,
1278,Ne ſoit toute douceur encloſe,37,l-405r-1-26,405r,1,
1279,Couars eſt qui enpꝛendꝛe n'oſe,37,l-405r-1-27,405r,1,
1280,Pour li un petit a tenir,37,l-405r-1-28,405r,1,
1281,Ce dont grant bien li puet venir,37,l-405r-1-29,405r,1,
1282,Et ſ'un poy eſt au pꝛemieꝛ dure,37,l-405r-1-30,405r,1,
1283,Sueffre tien te a moy et endure,37,l-405r-1-31,405r,1,
1284,Amours t'aideꝛa et pities,37,l-405r-1-32,405r,1,
1285,Et ſi li di ſ'eꝛt veꝛites,37,l-405r-1-33,405r,1,
1286,S'en vostre douce figure.,38,l-405r-1-34,405r,1,
1287,Dame eſt eſcondis muciez.,38,l-405r-1-35,405r,1,
1288,C'eſt deceuans couueꝛture.,38,l-405r-1-36,405r,1,
1289,C'eſt marchiez de ſous pꝛeſure.,38,l-405r-1-37,405r,1,
1290,ou amis eſt engignies.,38,l-405r-1-38,405r,1,
1291,S'en vostre .[douce figure].,38,l-405r-1-39,405r,1,
1292,vos dous ſemblans as ſeure,39,l-405r-1-40,405r,1,
1293,et ſe plus le dechaciez,39,l-405r-2-1,405r,2,
1294,n'eſt ce raiſon obſcure.,39,l-405r-2-2,405r,2,
1295,S'en vostre .[douce figure].,39,l-405r-2-3,405r,2,
1296,A ce dous abay areſtez,40,l-405r-2-4,405r,2,
1297,Et touz de la tendꝛe apreſtez,40,l-405r-2-5,405r,2,
1298,Touz cois ou chemin me tenoie,40,l-405r-2-6,405r,2,
1299,Quar tant de ſeurte prenoie,40,l-405r-2-7,405r,2,
1300,Es pꝛomeſſes qu'eſpoir faiſſoit,40,l-405r-2-8,405r,2,
1301,Que mes cueꝛs auque ſ'apaſſoit,40,l-405r-2-9,405r,2,
1302,N'eſtoie mes eſpeures,40,l-405r-2-10,405r,2,
1303,Aincois diſſoie aſſeures,40,l-405r-2-11,405r,2,
1304,Et par moy de voulenté ſaine,40,l-405r-2-12,405r,2,
1305,Ha; belle de tout bien fontaine,40,l-405r-2-13,405r,2,
1306,Vrais eſſemplaire de biauté,40,l-405r-2-14,405r,2,
1307,Parfaite en ſens et en bonté,40,l-405r-2-15,405r,2,
1308,Cueꝛ dous tant m'eſt bien avenu,40,l-405r-2-16,405r,2,
1309,Quant amours pour vous m'a tenu,40,l-405r-2-17,405r,2,
1310,En chace pour moy pour vous prendꝛe,40,l-405r-2-18,405r,2,
1311,Quar loꝛs qu'il vous plairoit entendꝛe,40,l-405r-2-19,405r,2,
1312,Moy tout imparfait parfaire,40,l-405r-2-20,405r,2,
1313,Plus de biens ne me pourroit faire,40,l-405r-2-21,405r,2,
1314,Raiſons Foꝛtune ne nature,40,l-405r-2-22,405r,2,
1315,Ha; flour de toute creature,40,l-405r-2-23,405r,2,
1316,Tant aroit plus qu'a ſouhaidieꝛ,40,l-405r-2-24,405r,2,
1317,Cilz a qui vous uoudꝛiez aider,40,l-405r-2-25,405r,2,
1318,Car il aroit j'en ſui touz filz,40,l-405r-2-26,405r,2,
1319,Joie honneurs deduire et profis,40,l-405r-2-27,405r,2,
1320,N'i a dont foꝛs de bien ſeꝛvir,40,l-405r-2-28,405r,2,
1321,Pour noble amour deseꝛvir,40,l-405r-2-29,405r,2,
1322,Et de loial cueꝛ enbꝛacieꝛ,40,l-405r-2-30,405r,2,
1323,Aſſes me pues dechacieꝛ,40,l-405r-2-31,405r,2,
1324,Dame connoiſtre entieꝛement,40,l-405r-2-32,405r,2,
1325,Car ſe chaſcuns naturelment,40,l-405r-2-33,405r,2,
1326,Biaute quieꝛt et ſans et bonte,40,l-405r-2-34,405r,2,
1327,Et vous avez tant ſeurmonte,40,l-405r-2-35,405r,2,
1328,Je ne doy dont eſtre repris,40,l-405r-2-36,405r,2,
1329,Se plus foꝛt ſui d'un autre eſpris,40,l-405r-2-37,405r,2,
1330,Pour ce me rent bien me doy rendꝛe,40,l-405r-2-38,405r,2,
