line_no,text,lg,l_id,folio,col,speaker
1331,Je ne me quieꝛ jamais deſfendꝛe,40,l-405r-2-39,405r,2,
1332,Ou point qu'em cel point eſtoie,41,l-405v-1-1,405v,1,
1333,Et en pensee dont m'areſtoie,41,l-405v-1-2,405v,1,
1334,Ou ſemblans et eſpoirs me mainnent,41,l-405v-1-3,405v,1,
1335,Et a leur plaiſſir me demainnent,41,l-405v-1-4,405v,1,
1336,Comme pꝛis ſans autre debat,41,l-405v-1-5,405v,1,
1337,Doutance ſur moy ſe rembat,41,l-405v-1-6,405v,1,
1338,Et entre mes preſſours de boute,41,l-405v-1-7,405v,1,
1339,Et depiece l'entente toute,41,l-405v-1-8,405v,1,
1340,Et biens qu'amours m'ot preſtez,41,l-405v-1-9,405v,1,
1341,En diſſant es tu arreſtez,41,l-405v-1-10,405v,1,
1342,A croire eſpoir le deceuant,41,l-405v-1-11,405v,1,
1343,Sur ce que il te met devant,41,l-405v-1-12,405v,1,
1344,Les pꝛomeſſes de courtoiſſie,41,l-405v-1-13,405v,1,
1345,Saches qui en eſpoir ſe fie,41,l-405v-1-14,405v,1,
1346,Souvent ſe treuve deceus,41,l-405v-1-15,405v,1,
1347,Se tu as les dous iex veus,41,l-405v-1-16,405v,1,
1348,Ta dame et ſon vis debonnaire,41,l-405v-1-17,405v,1,
1349,Le cuidez tu pour ce atraire,41,l-405v-1-18,405v,1,
1350,A ce que elle te weille ameꝛ,41,l-405v-1-19,405v,1,
1351,On la devroit bien blaſmeꝛ,41,l-405v-1-20,405v,1,
1352,S'elle metoit ſ'amour en toi,41,l-405v-1-21,405v,1,
1353,Se tu as par regars ſenti,41,l-405v-1-22,405v,1,
1354,La grant biauté dont elle es plaine,41,l-405v-1-23,405v,1,
1355,Je te liueꝛrai aſſez paine,41,l-405v-1-24,405v,1,
1356,plus que tu ne poꝛras poꝛteꝛ,41,l-405v-1-25,405v,1,
1357,Souvent fait fol reconfoꝛteꝛ,41,l-405v-1-26,405v,1,
1358,Sans donneꝛ la pꝛomeſſe en vain,41,l-405v-1-27,405v,1,
1359,Il a aſſez plus de leuain,41,l-405v-1-28,405v,1,
1360,En ſa douceur que tu ne crois,41,l-405v-1-29,405v,1,
1361,Se li maintiens eſt dous et cois,41,l-405v-1-30,405v,1,
1362,Li cueꝛs eſt oꝛguillieꝛs et grant,41,l-405v-1-31,405v,1,
1363,Bien eſt de toi ocirre en grant,41,l-405v-1-32,405v,1,
1364,Qui pour .i. ſeul eſpoir emp[re]rendꝛe,41,l-405v-1-33,405v,1,
1365,Veus tes fais com toy faire prendꝛe,41,l-405v-1-34,405v,1,
1366,Arrieꝛe m'a dont tire,41,l-405v-1-35,405v,1,
1367,Et en tirant ai ſoupire,41,l-405v-1-36,405v,1,
1368,Car eſpoir d'une part m'ognoit,41,l-405v-1-37,405v,1,
1369,Et doubte d'autre me poignoir,41,l-405v-1-38,405v,1,
1370,Ainſſi a moy contrebatoie,41,l-405v-2-1,405v,2,
1371,Et en ce grant debat metoie,41,l-405v-2-2,405v,2,
1372,Sur ma dame tout le deſcoꝛt,41,l-405v-2-3,405v,2,
1373,Et pour trouveꝛ plus dous acoꝛt,41,l-405v-2-4,405v,2,
1374,Eſt ce que ſus lui le voult prendꝛe,41,l-405v-2-5,405v,2,
1375,En moy diſſoie ſanz meſprendꝛe,41,l-405v-2-6,405v,2,
1376,Mon cueꝛ qu'a douce combat,42,l-405v-2-7,405v,2,
1377,pour vos dous ſeꝛviſce emprendꝛe,42,l-405v-2-8,405v,2,
1378,aidiez cueꝛ dous a deſfendꝛe,42,l-405v-2-9,405v,2,
1379,pour a paiſſieꝛ le debat.,43,l-405v-2-10,405v,2,
1380,weilliez en vo merci prendꝛe,43,l-405v-2-11,405v,2,
1381,mon cueꝛ .[qu'a douce combat pour vos dous ſeꝛviſce empꝛendꝛe].,43,l-405v-2-12,405v,2,
1382,Car ou dous es poir l'embat.,44,l-405v-2-13,405v,2,
1383,Doute ne le laiſſe entendꝛe,44,l-405v-2-14,405v,2,
1384,ainſſi ne ſay a qui rendꝛe.,44,l-405v-2-15,405v,2,
1385,Mon cueꝛ [qu'a douce combat pour vos dous ſeꝛviſce empꝛendꝛe].,44,l-405v-2-16,405v,2,
1386,Toutes fois doute de faillir,45,l-405v-2-17,405v,2,
1387,Me faiſſoit plaindꝛe et treſaillir,45,l-405v-2-18,405v,2,
1388,Couleur mueꝛ et contenance,45,l-405v-2-19,405v,2,
1389,Car quant vienent en remembꝛance,45,l-405v-2-20,405v,2,
1390,Je treſail et tremble et fremis,45,l-405v-2-21,405v,2,
1391,Et eſpoirs y vienent au devant,45,l-405v-2-22,405v,2,
1392,Loꝛs me va li cueꝛs ſouleuant,45,l-405v-2-23,405v,2,
1393,Si chante et ris et bale et dance,45,l-405v-2-24,405v,2,
1394,Ainſi en diueꝛſe manieꝛe,45,l-405v-2-25,405v,2,
1395,Me convient eſtre celle heure,45,l-405v-2-26,405v,2,
1396,Une fois chante l'autre fois pleure,45,l-405v-2-27,405v,2,
1397,C'eſt l'eſtat aus nouuiaus amis,45,l-405v-2-28,405v,2,
1398,Qu'amours en ceſte chace a mis,45,l-405v-2-29,405v,2,
1399,C'eſt le langueꝛeus aus amoureuus,45,l-405v-2-30,405v,2,
1400,Et qui le veult nomeꝛ pour eluls,45,l-405v-2-31,405v,2,
1401,Par dꝛoit eſt li mos desguiſſes,45,l-405v-2-32,405v,2,
1402,Que nulz tant ſoit bien aviſſez,45,l-405v-2-33,405v,2,
1403,Ne ſet les pꝛopꝛietes dire,45,l-405v-2-34,405v,2,
1404,Ne les contenances descrire,45,l-405v-2-35,405v,2,
1405,Oꝛ veult oꝛ ne veult oꝛ le grieue,45,l-405v-2-36,405v,2,
1406,Oꝛ li pleſt oꝛ ſe ſiet oꝛ ſe lieve,45,l-405v-2-37,405v,2,
1407,Oꝛ pꝛomet loiauté eſtable,45,l-405v-2-38,405v,2,
1408,Sur voulenté feꝛme et muable,45,l-405v-2-39,405v,2,
1409,Ainſi comme en ce point eſtoie,45,l-405v-2-40,405v,2,
1410,Ne fuioie ne arreſtoie,45,l-406r-1-1,406r,1,
1411,Ne ne ſavoie que fin p[re]ndꝛe,45,l-406r-1-2,406r,1,
1412,Amours qui me fait emprendꝛe,45,l-406r-1-3,406r,1,
1413,L'ameꝛ et a laiſſieꝛ le cours,45,l-406r-1-4,406r,1,
1414,Vint en mannieꝛe de ſecours,45,l-406r-1-5,406r,1,
1415,Et touz ces chiens a amenez,45,l-406r-1-6,406r,1,
1416,Loꝛs coꝛne a lui prenez pꝛenez,45,l-406r-1-7,406r,1,
1417,Puis ſ'escrie hars il eſt pꝛis,45,l-406r-1-8,406r,1,
1418,Adont fui foꝛment entrepꝛis,45,l-406r-1-9,406r,1,
1419,Car chaſcun d'eulz me moꝛt et pꝛent,45,l-406r-1-10,406r,1,
1420,Plaiſſance eſmuet vouloirs eſprent,45,l-406r-1-11,406r,1,
1421,Renons encoꝛe les conſeille,45,l-406r-1-12,406r,1,
1422,Penſeꝛs moꝛt. ſouuenirs reueille,45,l-406r-1-13,406r,1,
1423,Samblant atrait eſpoirs promet,45,l-406r-1-14,406r,1,
1424,Et amoꝛs foꝛment ſ'entremet,45,l-406r-1-15,406r,1,
1425,De moi prendꝛe ſans plus blecieꝛ,45,l-406r-1-16,406r,1,
1426,refieꝛt avec ſanz menacieꝛ,45,l-406r-1-17,406r,1,
1427,Des graces de ma douce dame,45,l-406r-1-18,406r,1,
1428,Dont n'es meꝛveille ſe ma dame,45,l-406r-1-19,406r,1,
1429,Le quieꝛt car ſoutilment y trait,45,l-406r-1-20,406r,1,
1430,Les roſes qui cueillent atrait,45,l-406r-1-21,406r,1,
1431,Et cis atrais en atraiant,45,l-406r-1-22,406r,1,
1432,En aloit doubte atraiant,45,l-406r-1-23,406r,1,
1433,Car com plus croiſſoit vouloir,45,l-406r-1-24,406r,1,
1434,Tant fait doutance maint douloir,45,l-406r-1-25,406r,1,
1435,Cueꝛ qui ſemblent et eſpoir tienent,45,l-406r-1-26,406r,1,
1436,Qui les nourriſſent et maintienent,45,l-406r-1-27,406r,1,
1437,Si tres plaiſſenment que touz dis,45,l-406r-1-28,406r,1,
1438,Pour doutance d'eſtre eſcondis,45,l-406r-1-29,406r,1,
1439,N'entrelaiſſe a eſtre amoureus,45,l-406r-1-30,406r,1,
1440,Pour ce cilz atrais ſauoureus,45,l-406r-1-31,406r,1,
1441,Qu'amours me metoit au deuant,45,l-406r-1-32,406r,1,
1442,Aloit [ſi] mon cueꝛ eſmouuant,45,l-406r-1-33,406r,1,
1443,Quantre les chiens ſ'abandonoit,45,l-406r-1-34,406r,1,
1444,Ne pour les cops qu'amours donnoit,45,l-406r-1-35,406r,1,
1445,Ne ſ'aloit de riens eſmaient,45,l-406r-1-36,406r,1,
1446,Ainz l'aloit eſpois ſupaient,45,l-406r-1-37,406r,1,
1447,Si doucement que hoꝛs boutes,45,l-406r-1-38,406r,1,
1448,Eſtoit doutance nient doutee,45,l-406r-2-1,406r,2,
1449,Et tant la fiſt de moi voidieꝛ,45,l-406r-2-2,406r,2,
1450,Qu'il m'enbat par foꝛce en cuidieꝛ,45,l-406r-2-3,406r,2,
1451,Qui eꝛt ou bos la quarte voie,45,l-406r-2-4,406r,2,
1452,Dont je parle avant avoie,45,l-406r-2-5,406r,2,
1453,Pris ſui la chace eſt afinee,46,l-406r-2-6,406r,2,
1454,Amours pardonne deſtinee,46,l-406r-2-7,406r,2,
1455,M'a vaincu et c'eſt mes profis,46,l-406r-2-8,406r,2,
1456,Car oꝛ ſui ge de ce tout fis,46,l-406r-2-9,406r,2,
1457,Que miex en vail et doi valoir,46,l-406r-2-10,406r,2,
1458,Et loꝛs quant a ſon douz vouloir,46,l-406r-2-11,406r,2,
1459,M'ot pꝛis et ſaiſſi plainement,46,l-406r-2-12,406r,2,
1460,Si m'a faite moult noblement,46,l-406r-2-13,406r,2,
1461,Onques d'iluec ne ſe parti,46,l-406r-2-14,406r,2,
1462,Si comme aprés chace apartient,46,l-406r-2-15,406r,2,
1463,Mon coꝛps ſans plus a ſa part tient,46,l-406r-2-16,406r,2,
1464,Et vout que ces oeuvres teniſt,46,l-406r-2-17,406r,2,
1465,Et ces fais touz jours ſouſteniſt,46,l-406r-2-18,406r,2,
1466,Qu'il convient que li coꝛs ſouſtienne,46,l-406r-2-19,406r,2,
1467,Les fais d'amours quoi qu'an aveigne,46,l-406r-2-20,406r,2,
1468,Et les peꝛilz et les deduis,46,l-406r-2-21,406r,2,
1469,Selonc ce qu'il eſt conduis,46,l-406v-1-1,406v,1,
1470,Pour ce li coꝛps li demourra,46,l-406v-1-2,406v,1,
1471,Si me ſemble qu'il me honnoꝛra,46,l-406v-1-3,406v,1,
1472,Apres ſi comme a chace avient,47,l-406v-1-4,406v,1,
1473,Que repaiſtre les chiens convient,47,l-406v-1-5,406v,1,
1474,Amours l'os ot et les iſſues,47,l-406v-1-6,406v,1,
1475,Qui aus entrailles ſont tiſſues,47,l-406v-1-7,406v,1,
1476,Donne aus chiens et mon ſanc a boivre,47,l-406v-1-8,406v,1,
1477,Dont ne fuſt nul qui peüſt croire,47,l-406v-1-9,406v,1,
1478,Comment je eſtoie demenez,47,l-406v-1-10,406v,1,
1479,Quant chaſcun des chiens amenez,47,l-406v-1-11,406v,1,
1480,Eu pour leur char de moi mengieꝛ,47,l-406v-1-12,406v,1,
1481,Ne je ne me peu reuengieꝛ,47,l-406v-1-13,406v,1,
1482,Ainz ſueſfre comme vrai martire,47,l-406v-1-14,406v,1,
1483,Qui voit aus chiens departir,47,l-406v-1-15,406v,1,
1484,Mon coꝛps dedens et degaſteꝛ,47,l-406v-1-16,406v,1,
1485,Et plaiſance mon cueꝛ taſteꝛ,47,l-406v-1-17,406v,1,
1486,Et tracieꝛ mon ſanc et ſuſcieꝛ,47,l-406v-1-18,406v,1,
1487,Et vouloit loꝛs ſanz menacieꝛ,47,l-406v-1-19,406v,1,
1488,Tireꝛ encontre lui aus dens,47,l-406v-1-20,406v,1,
1489,Il ne demeure riens dedens,47,l-406v-1-21,406v,1,
1490,Mon coꝛps dont n'aient loꝛ aſſés,47,l-406v-1-22,406v,1,
1491,Penſeꝛs ſans point eſtre laſſes,47,l-406v-1-23,406v,1,
1492,M'a ja pꝛis que tout mon ſanc trait,47,l-406v-1-24,406v,1,
1493,S'eſpoirs ne m'i meſiſt entrait,47,l-406v-1-25,406v,1,
1494,Mal me fuſt ais tant l'e je cher,47,l-406v-1-26,406v,1,
1495,Qu'il ne me fait foꝛs delechieꝛ,47,l-406v-1-27,406v,1,
1496,Quant li chien furent abuure,48,l-406v-1-28,406v,1,
1497,Amours a mon cur deſſevré,48,l-406v-1-29,406v,1,
1498,Et ma voulenté enſement,48,l-406v-1-30,406v,1,
1499,Et le donna entieꝛement,48,l-406v-1-31,406v,1,
1500,A la douce gente parfaite,48,l-406v-1-32,406v,1,
1501,Par cui chiens la pꝛiſe fu faite,48,l-406v-1-33,406v,1,
1502,Et vouſt que de ma voulenté,48,l-406v-1-34,406v,1,
1503,Et de mon cueꝛ qu'il m'a oſte,48,l-406v-1-35,406v,1,
1504,Fuſt dame ſi tres ligement,48,l-406v-1-36,406v,1,
1505,Que nulz foꝛs elle ſeulement,48,l-406v-1-37,406v,1,
1506,N'i peüſt hauſaige meneꝛ,48,l-406v-1-38,406v,1,
1507,Et qu'an li ſeꝛvir et ameꝛ,48,l-406v-2-1,406v,2,
1508,En ſ'onneur guardeꝛ me meiſſe,48,l-406v-2-2,406v,2,
1509,Loyalment tant que je veſquiſſe,48,l-406v-2-3,406v,2,
1510,Par quoi monteꝛ peuſſe em pꝛis,48,l-406v-2-4,406v,2,
1511,Et je dame com loyaus pꝛis,48,l-406v-2-5,406v,2,
1512,Rendus a vous ſans riens meſp[re]ndꝛe,48,l-406v-2-6,406v,2,
1513,Weil vo noble ſeꝛuice comprendꝛe,48,l-406v-2-7,406v,2,
1514,Com cilz qui ſur li n'a povoir,48,l-406v-2-8,406v,2,
1515,Dame et ſe vous povez vëoir,48,l-406v-2-9,406v,2,
1516,Qu'a mon povoir mon devoir face,48,l-406v-2-10,406v,2,
1517,Pour Dieu que vo cueꝛ ne debate,48,l-406v-2-11,406v,2,
1518,A moy pour vostre retenir,48,l-406v-2-12,406v,2,
1519,Et ſe ja a ce puis avenir,48,l-406v-2-13,406v,2,
1520,A tel ſans que par mon defaut,48,l-406v-2-14,406v,2,
1521,S'il n'eſt il pas hons qui ne faut,48,l-406v-2-15,406v,2,
1522,Meſpꝛaigne en aucune manieꝛe,48,l-406v-2-16,406v,2,
1523,Madame deſirree et chieꝛe,48,l-406v-2-17,406v,2,
1524,Plaiſſe le vous a coꝛrigieꝛ,48,l-406v-2-18,406v,2,
1525,Et ſe i a ne puis eſligieꝛ,48,l-406v-2-19,406v,2,
1526,Tant de biens en moy que je doie,48,l-406v-2-20,406v,2,
1527,Vostre eſtre au mains ſe je povoie,48,l-406v-2-21,406v,2,
1528,Pour nulle paine a ce venir,48,l-406v-2-22,406v,2,
1529,Biau le uauroie ſouſtenir,48,l-406v-2-23,406v,2,
1530,Si prenez coulente pour fait,48,l-406v-2-24,406v,2,
1531,Car par vostre gent coꝛs parfait,48,l-406v-2-25,406v,2,
1532,Fins cueꝛs dous ſui a ce menez,48,l-406v-2-26,406v,2,
1533,Vostres ſui oꝛ en oꝛdenez,48,l-406v-2-27,406v,2,
1534,Par pitié non pas par raiſon,48,l-406v-2-28,406v,2,
1535,Pris ſui jonnes et de ſaiſon,48,l-406v-2-29,406v,2,
1536,Pour plus en vous ſeꝛuant dureꝛ,48,l-406v-2-30,406v,2,
1537,Et ce ſe vient a l'endureꝛ,48,l-406v-2-31,406v,2,
1538,Tant ſouſfeꝛai qu'a dire voir,48,l-406v-2-32,406v,2,
1539,Bien vous pourrez aperceuoir,48,l-406v-2-33,406v,2,
1540,Qu'emſement de cueꝛ voulentieu,48,l-406v-2-34,406v,2,
1541,Et ſe me veés ententieu,48,l-406v-2-35,406v,2,
1542,Fins cueꝛs a emp[re]ndꝛe ces fais,48,l-406v-2-36,406v,2,
1543,Pour Dieu dame que mes biens fais,48,l-406v-2-37,406v,2,
1544,Ne ſoit peꝛdus par cruauté,48,l-406v-2-38,406v,2,
1545,Car ſe par vostre grant biauté,48,l-407r-1-1,407r,1,
1546,Sui pꝛins et en amour mendie,48,l-407r-1-2,407r,1,
1547,Penſez que de ma maladie,48,l-407r-1-3,407r,1,
1548,Eſtez cauſſe dont enſement,48,l-407r-1-4,407r,1,
1549,Soiez cauſe d'alegement,48,l-407r-1-5,407r,1,
1550,S'arés vostre amis amonte,48,l-407r-1-6,407r,1,
1551,Car en l'eſpooir de vo bonté,48,l-407r-1-7,407r,1,
1552,Cueꝛ dous me ſui rendus et pris,48,l-407r-1-8,407r,1,
1553,Et pour ce dont ſe j'ai empꝛis,48,l-407r-1-9,407r,1,
1554,Si haute amour a deſeꝛvir,48,l-407r-1-10,407r,1,
1555,Et je ne puiſſe tant ſeꝛvir,48,l-407r-1-11,407r,1,
1556,Que j'en deſeꝛue poi ne grant,48,l-407r-1-12,407r,1,
1557,Par pitié aiez en cueꝛ engrant,48,l-407r-1-13,407r,1,
1558,D'aidieꝛ vostre ſeꝛf a valoir,48,l-407r-1-14,407r,1,
1559,Car ſe mis ſui a nonchaloir,48,l-407r-1-15,407r,1,
1560,Qu'an pitié ne me regardez,48,l-407r-1-16,407r,1,
1561,De moꝛt ne puis eſtre gardez,48,l-407r-1-17,407r,1,
1562,Foꝛce nature ne ionnece,48,l-407r-1-18,407r,1,
1563,Liece deduis et richece,48,l-407r-1-19,407r,1,
1564,Ne me pourroient reſpitieꝛ,48,l-407r-1-20,407r,1,
1565,Oꝛ weillez mon cueꝛ viſiteꝛ,48,l-407r-1-21,407r,1,
1566,Fins cueꝛs dous comment il vous plaira,48,l-407r-1-22,407r,1,
1567,Vez ci moy qui atendꝛa,48,l-407r-1-23,407r,1,
1568,Moꝛt ou vie ou vostre oꝛdenane.,48,l-407r-1-24,407r,1,
1569,Et quant vous arez congnoiſance,48,l-407r-1-25,407r,1,
1570,Comment par vous ay eſté pꝛis,48,l-407r-1-26,407r,1,
1571,Et com durement entrepꝛis,48,l-407r-1-27,407r,1,
1572,Ay par vous en la chace eſté,48,l-407r-1-28,407r,1,
1573,fins cueꝛs dous par vostre honeſte,48,l-407r-1-29,407r,1,
1574,Baiſſiez juſques a moy vos iex,48,l-407r-1-30,407r,1,
1575,Je ne quieꝛ ja demandeꝛ miex,48,l-407r-1-31,407r,1,
1576,Ma dame que vo voulenté,48,l-407r-1-32,407r,1,
1577,N'avrai ami pou grant plenté,48,l-407r-1-33,407r,1,
1578,Se de bon cueꝛ le me donnez,48,l-407r-1-34,407r,1,
1579,Et pour Dieu oꝛ me pardonez,48,l-407r-1-35,407r,1,
1580,Se je veꝛs vous fui a prendꝛe,48,l-407r-1-36,407r,1,
1581,Car je me cremoie a meſprendꝛe,48,l-407r-1-37,407r,1,
1582,D'empꝛandꝛe ſi haut a ameꝛ,48,l-407r-1-38,407r,1,
1583,Et ſi ne m'en devez blaſmeꝛ,48,l-407r-2-1,407r,2,
1584,Car aprés tout l'afaitement,48,l-407r-2-2,407r,2,
1585,Bonne et belle parfaitement,48,l-407r-2-3,407r,2,
1586,Par vous que tout le monde pꝛiſe,48,l-407r-2-4,407r,2,
1587,Amours ſur moy a coꝛne priſe.,48,l-407r-2-5,407r,2,
