line_no,text,lg,l_id,folio,col,speaker
1,Se chaſcuns cuers penſoit a la ſouffrance,1,l-303r-1-1,303r,1,
2,Que /li Filz Dieu poꝛ pecheours ſouffri,1,l-303r-1-2,303r,1,
3,et regardaſt ſi grant humilian ce.,1,l-303r-1-3,303r,1,
4,dont nous ſommes rache te et nourri.,1,l-303r-1-4,303r,1,
5,/Vierge touſtanz ſervie ſanz nul. ſi.,1,l-303r-1-5,303r,1,
6,ſeries dou moult grant contraire.,1,l-303r-1-6,303r,1,
7,Car en vos beneois flans,1,l-303r-1-7,303r,1,
8,fu pꝛiſe pour nous refaire.,1,l-303r-1-8,303r,1,
9,char humainne et ſans,1,l-303r-1-9,303r,1,
10,Don ſai je bien et tele eſt ma creance,2,l-303r-1-10,303r,1,
11,que Diex et homs /vierge de vous naſqui.,2,l-303r-1-11,303r,1,
12,et tot ce fiſt par rieule d'oꝛdenance,2,l-303r-1-12,303r,1,
13,vraie acomplir que pꝛiſe avoit en li.,2,l-303r-1-13,303r,1,
14,Quant il de vous pour le pechié iſſi.,2,l-303r-1-14,303r,1,
15,d'/Adan et ſe voult eſtraire,2,l-303r-1-15,303r,1,
16,ſanc et ſueur ſouffranz,2,l-303r-1-16,303r,1,
17,de ſe coꝛs pour exemplaire,2,l-303r-1-17,303r,1,
18,mouſtrer d'i eſtre amans.,2,l-303r-1-18,303r,1,
19,Et apꝛés ce /dame de grant poiſſance.,3,l-303r-1-19,303r,1,
20,ſe benoite chars. le vendꝛedi,3,l-303r-1-20,303r,1,
21,a l'eſtake ba tue tenre et blance,3,l-303r-2-1,303r,2,
22,fu cruel ment et tout ce conſenti.,3,l-303r-2-2,303r,2,
23,et puis ſouffri plus aſſez dont je di.,3,l-303r-2-3,303r,2,
24,ke ſ'il ne le vouſiſt faire.,3,l-303r-2-4,303r,2,
25,pour pecheours meudians.,3,l-303r-2-5,303r,2,
26,li mondes fuſt en grief haire,3,l-303r-2-6,303r,2,
27,En ynfier manans.,3,l-303r-2-7,303r,2,
28,Bien nous refiſt par vraie ramembꝛanche.,4,l-303r-2-8,303r,2,
29,et par ſa moꝛt k'apꝛés en croiz ſenti.,4,l-303r-2-9,303r,2,
30,quant conſenti que /Longis de ſa lanche.,4,l-303r-2-10,303r,2,
31,N'avra ſon cuer et ſon coſté ouvri.,4,l-303r-2-11,303r,2,
32,puis ſeu rent treſtout li anemi.,4,l-303r-2-12,303r,2,
33,ke li roys de noble affaire.,4,l-303r-2-13,303r,2,
34,y roit et en moult bꝛief tans.,4,l-303r-2-14,303r,2,
35,tous ſes amis d'infer traire.,4,l-303r-2-15,303r,2,
36,comme tous poiſſanz.,4,l-303r-2-16,303r,2,
37,Dont ſeut deffi ſanz dou tanche.,5,l-303r-2-17,303r,2,
38,le benoite moꝛt les abati.,5,l-303r-2-18,303r,2,
39,Oꝛ li pꝛi jes. fleurs de toute honnourance,5,l-303r-2-19,303r,2,
40,pour tout le mont et pꝛopꝛement pour mi.,5,l-303r-2-20,303r,2,
41,Car vos doulz filz qui onques ne menti.,5,l-303r-2-21,303r,2,
42,diſt et che nous doit bien plaire.,5,l-303r-2-22,303r,2,
43,ke nus pechierres ſi grans,5,l-303r-2-23,303r,2,
44,n'eſt. k'il n'ait cuer debonnaire .,5,l-303r-2-24,303r,2,
45,d'i eſtre pardonnans.,5,l-303r-2-25,303r,2,
46,/Dame ki touz cuers eſclai re.,6,l-303r-2-26,303r,2,
47,touz les meſcreans,6,l-303r-2-27,303r,2,
48,welle a nostre loy atraire,6,l-303r-2-28,303r,2,
49,dieux ſans fin durans.,6,l-303r-2-29,303r,2,
50,Plaiſans deſirs et eſpoi rs de merchi,7,l-303v-1-1,303v,1,
51,et boi ne amours ki me tient compaignie,7,l-303v-1-2,303v,1,
52,me fait chanter et avoir cuer joli.,7,l-303v-1-3,303v,1,
53,et ſ'amours fait que da me ai choiſie.,7,l-303v-1-4,303v,1,
54,D'onnour de ſens ſi garnie,7,l-303v-1-5,303v,1,
55,et de ſi fai tich atour.,7,l-303v-1-6,303v,1,
56,ke tout ai mis ſanz retour,7,l-303v-1-7,303v,1,
57,cuer et coꝛs en ſa baillie.,7,l-303v-1-8,303v,1,
58,Amours ſet tant et puet et vaut de li,8,l-303v-1-9,303v,1,
59,k'e le ſeur touz a tele ſeig nourie,8,l-303v-1-10,303v,1,
60,c'un diuers cuer fait a .i. autre ouni.,8,l-303v-1-11,303v,1,
61,et d'un acoꝛt amer ſanz vilonnie.,8,l-303v-1-12,303v,1,
62,et ſa plus bele maiſtrie.,8,l-303v-1-13,303v,1,
63,Car toute amoꝛs ſanz ſejour,8,l-303v-1-14,303v,1,
64,eſt en chaſcun cuer d'onnour.,8,l-303v-1-15,303v,1,
65,et en touz a une fie.,8,l-303v-1-16,303v,1,
66,Ainz par ſervir amans ne deſervi,9,l-303v-1-17,303v,1,
67,par nul tra uail k'a li fuſt otroije.,9,l-303v-1-18,303v,1,
68,joie d'amours ſ'eſkiet il bien ain,9,l-303v-1-19,303v,1,
69,quant amours voit k'ele y eſt emploie.,9,l-303v-1-20,303v,1,
70,k'ele avoit li fait amie.,9,l-303v-1-21,303v,1,
71,ſanz plus de joie en .i. jour.,9,l-303v-1-22,303v,1,
72,k'il ne poꝛ roit de doulour,9,l-303v-1-23,303v,1,
73,endurer toute ſa vie,9,l-303v-1-24,303v,1,
74,Dont ont cil toꝛt de qui il eſt iehy.,10,l-303v-1-25,303v,1,
75,k'en amer ait angoiſſe ne haſcie.,10,l-303v-1-26,303v,1,
76,car tant ſont douz li mal a cuer d'ami.,10,l-303v-1-27,303v,1,
77,k'a l'endurer li joie mouteplie,10,l-303v-1-28,303v,1,
78,et com plus mercis d'etrie.,10,l-303v-1-29,303v,1,
79,tant avra joie greignour.,10,l-303v-2-1,303v,2,
80,Car plus poꝛte grant ſavoir.,10,l-303v-2-2,303v,2,
81,li dons quant dame l'otrie.,10,l-303v-2-3,303v,2,
82,Dame d'onnour lues ke pꝛemiers vous vi.,11,l-303v-2-4,303v,2,
83,Je piercich bien k'a moi n'a feroit mie.,11,l-303v-2-5,303v,2,
84,D'amer ſi haut k'a vous mais contre mi,11,l-303v-2-6,303v,2,
85,fu li miens cuers et fiſt pour lui partie.,11,l-303v-2-7,303v,2,
86,et diſt ke ſeroit folie,11,l-303v-2-8,303v,2,
87,de reſoignier vo valour.,11,l-303v-2-9,303v,2,
88,Car de ſervir boin ſeignour,11,l-303v-2-10,303v,2,
89,deſierte a double eſt merie.,11,l-303v-2-11,303v,2,
90,A me dame iert envoie.,12,l-303v-2-12,303v,2,
91,Mes chancons par boine a mour.,12,l-303v-2-13,303v,2,
92,Car je ſai bien de meillour,12,l-303v-2-14,303v,2,
93,de li ne puet eſtre oïe.,12,l-303v-2-15,303v,2,
94,Moult m'eſmerveil d'acuns k'ai oït di re.,13,l-303v-2-16,303v,2,
95,ki ont amet oꝛ ne pueent ſouffrir.,13,l-303v-2-17,303v,2,
96,ke nus cuers aint. ainz ne font foꝛs deſpire.,13,l-303v-2-18,303v,2,
97,Les a moureus Mais mes cuers aſſentir,13,l-303v-2-19,303v,2,
98,ne ſe poꝛroit nule ment,13,l-303v-2-20,303v,2,
99,c'onques de bien amer talent.,13,l-303v-2-21,303v,2,
100,cuers ki ſanz fin ne veult amours ſervir.,13,l-303v-2-22,303v,2,
101,Et ſes ſerjans amer en com,13,l-303v-2-23,303v,2,
102,De touz biens ſcet chius le meillour eſlire.,14,l-303v-2-24,303v,2,
103,a ſoi ki ſiert amours ch'eſt ſanz mentir.,14,l-303v-2-25,303v,2,
104,k'amours les ſiens d'onneſte ſi atyre.,14,l-304r-1-1,304r,1,
105,c'on les puet bien de touz autres coiſir.,14,l-304r-1-2,304r,1,
106,au parler courtoiſe ment.,14,l-304r-1-3,304r,1,
107,Et ſ'aucuns maint en ſi fol errement,14,l-304r-1-4,304r,1,
108,qu'il ne veille d'amours parler oir.,14,l-304r-1-5,304r,1,
109,S'en laiſt au mains vrais a mans conuenir,14,l-304r-1-6,304r,1,
110,Douche occoiſon de chanter et de rire,15,l-304r-1-7,304r,1,
111,a vrais amans et de li maintenir,15,l-304r-1-8,304r,1,
112,jo liement et ſ'aucuns eſt en yre.,15,l-304r-1-9,304r,1,
113,faute d'amours le fait en chou languir.,15,l-304r-1-10,304r,1,
114,Sen tans en folour deſpent.,15,l-304r-1-11,304r,1,
115,et chius en bien ki aimme Loiaument,15,l-304r-1-12,304r,1,
116,cuers ſanz amour ne puet joie ſentir.,15,l-304r-1-13,304r,1,
117,la ou amans ſ'a de quoi eſioir.,15,l-304r-1-14,304r,1,
118,Amours en li ſeruant nului n'empire,16,l-304r-1-15,304r,1,
119,tant ſoit k'aucuns ne puis mie avenir.,16,l-304r-1-16,304r,1,
120,a kiedefois a chou ke il deſire.,16,l-304r-1-17,304r,1,
121,ne doit il pas pour chou amours hair.,16,l-304r-1-18,304r,1,
122,ſ'il ſen plaint n'aimme il noient.,16,l-304r-1-19,304r,1,
123,Car ki n'aroit d'aie ſeulement.,16,l-304r-1-20,304r,1,
124,foꝛs ke de bonne et bele .i. ſouvenir.,16,l-304r-1-21,304r,1,
125,ſe doit teus biens a amant abelir.,16,l-304r-1-22,304r,1,
126,Ce me ſemont d'amer ſanz contredire.,17,l-304r-1-23,304r,1,
127,ſi loi aument ke ja n'en quier partir.,17,l-304r-1-24,304r,1,
128,Oꝛ veille amours que je puiſſe ſouffire,17,l-304r-1-25,304r,1,
129,a cheli qui par ſes vairs yex ſaiſir.,17,l-304r-1-26,304r,1,
130,me vint amoureu ſement.,17,l-304r-2-1,304r,2,
131,tres dont ke res gardai pꝛemierement,17,l-304r-2-2,304r,2,
132,Son douch maintien ſa ge pour en aſpꝛir,17,l-304r-2-3,304r,2,
133,cuer d'onnour faire et de viſſes fuir.,17,l-304r-2-4,304r,2,
134,A ce joli pui preſent fach de mon chant,18,l-304r-2-5,304r,2,
135,amours en ſon couvent,18,l-304r-2-6,304r,2,
136,ou non ma dame en qui amour queil lir,18,l-304r-2-7,304r,2,
137,me fait le ſens de ma chancon furnir.,18,l-304r-2-8,304r,2,
138,Pleüſt amours que li mondes fuſt teus.,19,l-304r-2-9,304r,2,
139,k'il fu jadis. quant je pꝛemiers amai.,19,l-304r-2-10,304r,2,
140,dont aroient boin tant li a moureus.,19,l-304r-2-11,304r,2,
141,oꝛ n'en ont point dont moult ſui en eſmai.,19,l-304r-2-12,304r,2,
142,Car il n'oſent hui eſt li jours amer.,19,l-304r-2-13,304r,2,
143,Et ſ'il aimment chaſcuns en veult parler.,19,l-304r-2-14,304r,2,
144,pour chou n'avra jamais ce m'eſt avis.,19,l-304r-2-15,304r,2,
145,ſaiſon a point amie ne amis.,19,l-304r-2-16,304r,2,
146,Oꝛ eſt beſoins que chas cuns ſoit ſi pꝛeuz,20,l-304r-2-17,304r,2,
147,qu'il puiſt tenir d'amour le chemin vrai.,20,l-304r-2-18,304r,2,
148,S'il ot par ler eſtre ne doit honteus.,20,l-304r-2-19,304r,2,
149,Ainz doit juer avec chiaus ſanz delai.,20,l-304r-2-20,304r,2,
150,ki ſe painnent de li a deſtouber.,20,l-304r-2-21,304r,2,
151,ainſſi puet on lui et autrui garder.,20,l-304r-2-22,304r,2,
152,Li ſages vit entre ſes anemis.,20,l-304v-1-1,304v,1,
153,Ou li ſos eſt en tre les ſiens mendis.,20,l-304v-1-2,304v,1,
154,Enſement va li mondes ki n'eſt pꝛeus.,21,l-304v-1-3,304v,1,
155,pour ce me ſui apenſez ke g'irai.,21,l-304v-1-4,304v,1,
156,en aucun lieu querre eur touz fins ſeus.,21,l-304v-1-5,304v,1,
157,S'il plaiſt a mour ſeruiche trouuerai.,21,l-304v-1-6,304v,1,
158,encoꝛe ſont amies a donner. C'eſt biaus miroirs poꝛ mi reconfoꝛter.,21,l-304v-1-7,304v,1,
159,Car teus eſt bien en ſon lieu eſcondis.,21,l-304v-1-8,304v,1,
160,ki eſt amez en eſtrange pays.,21,l-304v-1-9,304v,1,
161,Quant je venrai ou paus ſerai conneus,22,l-304v-1-10,304v,1,
162,[ſens] et honnour de maiſnie tenrai.,22,l-304v-1-11,304v,1,
163,Et ſe je voie k'aie pau en ces deuz.,22,l-304v-1-12,304v,1,
164,d'umi lite mon deſpenſier ferai.,22,l-304v-1-13,304v,1,
165,Ch'il troi poꝛront bien l'oſtel gouuerner.,22,l-304v-1-14,304v,1,
166,Servir amours et les ſiens oſteler.,22,l-304v-1-15,304v,1,
167,Et ſ'avec yaue vient deſcendꝛe mercis,22,l-304v-1-16,304v,1,
168,De joie iert touz li couuens raemplis.,22,l-304v-1-17,304v,1,
169,Frans cuers loez des ſa ges enuieus.,23,l-304v-1-18,304v,1,
170,Mais non pour quant boin cuer poꝛte vous ai,23,l-304v-1-19,304v,1,
171,en deſirrant que vous peuſſe anter.,23,l-304v-1-20,304v,1,
172,Et quant je truis doucheur ſi pꝛés d'amer.,23,l-304v-1-21,304v,1,
173,ke ne vous voi et ſi en ſui a dis.,23,l-304v-1-22,304v,1,
174,Dont ſeroit bien li ve oirs paradis.,23,l-304v-1-23,304v,1,
175,Amours veilliez moi de tant confoꝛter.,24,l-304v-1-24,304v,1,
176,ke j'aie lieu de ma da me eſgarder.,24,l-304v-1-25,304v,1,
177,Car je ſai bien ſe je voi ſon douc vis.,24,l-304v-1-26,304v,1,
178,Miex m'en ſera tant com je ſerai vis.,24,l-304v-1-27,304v,1,
179,Se li graſce d'amours n'enluminoit.,25,l-304v-2-1,304v,2,
180,cuer de dame plus que ſeruirs d'ami. Il m'eſt avis mains a mains periroit.,25,l-304v-2-2,304v,2,
181,car ainz nus homs ne deſervi merchi.,25,l-304v-2-3,304v,2,
182,Dont puis c'amours m'a d'enfanche garni.,25,l-304v-2-4,304v,2,
183,de che noble entendement.,25,l-304v-2-5,304v,2,
184,Servir le veul et pꝛoijer par fian che.,25,l-304v-2-6,304v,2,
185,k'en amourer puiſt bele et boine et franche.,25,l-304v-2-7,304v,2,
186,Dont je ſui pꝛis douchement.,25,l-304v-2-8,304v,2,
187,Car boine amours qui tout ſet et tout voit,26,l-304v-2-9,304v,2,
188,m'a bonnement par ſe graſſe noꝛ ri,26,l-304v-2-10,304v,2,
189,de ſe vertut folz eſt qui chou ne croit.,26,l-304v-2-11,304v,2,
190,Car tout a mant ſont ſoutenu par li.,26,l-304v-2-12,304v,2,
191,Il pert a chou qu'il ſont net et ioli,26,l-304v-2-13,304v,2,
192,par deſirs uiuent. dou che merchi,26,l-304v-2-14,304v,2,
193,ſi ke ja fole er ranche n'iert en ami,26,l-304v-2-15,304v,2,
194,car il vit en plaiſance.,26,l-304v-2-16,304v,2,
195,d'eſpoir ki merite rent.,26,l-304v-2-17,304v,2,
196,Dont en amer el ne conques,27,l-304v-2-18,304v,2,
197,foꝛs que l'eſpoir dont amant ſont hardi.,27,l-304v-2-19,304v,2,
198,en faire honnour doit on amer par dꝛoit.,27,l-304v-2-20,304v,2,
199,car ſans a mer ne ſont nul enrichi.,27,l-304v-2-21,304v,2,
200,de noble honnour ne de joie autreſſi.,27,l-304v-2-22,304v,2,
201,ki durer puiſt lon guement.,27,l-304v-2-23,304v,2,
202,Dont wel manoir en le noble franchiſe,27,l-305r-1-1,305r,1,
203,de bonne amour ki de douche ſubſtan,27,l-305r-1-2,305r,1,
204,me paiſt et tient en jouvent.,27,l-305r-1-3,305r,1,
205,Dame il n'eſt homs ki vo biauté verroit,28,l-305r-1-4,305r,1,
206,ki cuer et coꝛs m'a de joie eſbau di.,28,l-305r-1-5,305r,1,
207,Ce m'eſt avis qui tenir ſe poꝛroit.,28,l-305r-1-6,305r,1,
208,De vous ſervir ſanz plus demander i.,28,l-305r-1-7,305r,1,
209,pour moi le di ki n'ai voloir enmi.,28,l-305r-1-8,305r,1,
210,car amours ne le conſent,28,l-305r-1-9,305r,1,
211,de plus touuer ke j'ai car ſouffiſſan,28,l-305r-1-10,305r,1,
212,pꝛench en deſir et en dou che eſperanche.,28,l-305r-1-11,305r,1,
213,Dont amoꝛs ſouſtient ſe gent.,28,l-305r-1-12,305r,1,
214,Fleurs d'onneſte ou tous biens ſe conchoit.,29,l-305r-1-13,305r,1,
215,gens coꝛs parfais a boine eure naſqui.,29,l-305r-1-14,305r,1,
216,ki vos ſougis tout ſon vivant ſeroit,29,l-305r-1-15,305r,1,
217,car en vëoir vo coꝛs ke j'ai coiſi.,29,l-305r-1-16,305r,1,
218,ſont maint fol cuer de graſſe raempli.,29,l-305r-1-17,305r,1,
219,Si ke je doi liement,29,l-305r-1-18,305r,1,
220,ſervir amours par vous car pourueanche,29,l-305r-1-19,305r,1,
221,y pꝛent mes cuers de ſens et d'ouneranche,29,l-305r-1-20,305r,1,
222,pour courtoiſement.,29,l-305r-1-21,305r,1,
223,Oe pꝛi amous ke ja n'aie aleganche,30,l-305r-1-22,305r,1,
224,De ſen mal ke mes cuers ſent.,30,l-305r-1-23,305r,1,
225,Pour le reuiel que je vi demenet.,31,l-305r-2-1,305r,2,
226,De dame Euain awan en le cauchie.,31,l-305r-2-2,305r,2,
227,Me vint lancier amours ſi foꝛt hurter.,31,l-305r-2-3,305r,2,
228,k'il m'en connuint amer dame ſoufie.,31,l-305r-2-4,305r,2,
229,Dont li wi hais. ſachiez ne faurra mie.,31,l-305r-2-5,305r,2,
230,Mais ke ioir puiſſe de ſon gent coꝛs.,31,l-305r-2-6,305r,2,
231,Car d'un viez ſach li fera wardecoꝛs.,31,l-305r-2-7,305r,2,
232,Je li ai dit ſ'ele me veult amer.,32,l-305r-2-8,305r,2,
233,ke lues errant que l'arai fianchie,32,l-305r-2-9,305r,2,
234,ke moi et li fe rai je pour mener.,32,l-305r-2-10,305r,2,
235,ſeur .i. be niel et en no compaignie,32,l-305r-2-11,305r,2,
236,ara vieſtut mainte vieſe quirie,32,l-305r-2-12,305r,2,
237,Et maint flaſſart trainant par les coꝛs.,32,l-305r-2-13,305r,2,
238,Dont au huer ſe ra granz li depoꝛs.,32,l-305r-2-14,305r,2,
239,Je me douch moult chiertes de l'aſſoter.,33,l-305r-2-15,305r,2,
240,ainz ke l'amours ſoit de .ii. baſtie.,33,l-305r-2-16,305r,2,
241,car tres ier ſoir me vint on raconter.,33,l-305r-2-17,305r,2,
242,ke ma dame iert ſeur moi toute es ragie.,33,l-305r-2-18,305r,2,
243,et tout pou chou ke je deue une fie.,33,l-305r-2-19,305r,2,
244,Avoir eſcrit en ſen huis par dehoꝛs,33,l-305r-2-20,305r,2,
245,chaens n'entre hons k[e] ne crie ahoꝛs.,33,l-305r-2-21,305r,2,
246,Mais pour ſen chier .i. petit raſſeuſer.,34,l-305r-2-22,305r,2,
247,li dis oꝛains tres douce renuoiſie.,34,l-305r-2-23,305r,2,
248,C'oꝛ me laiſſiez .i. petit triſkoter.,34,l-305r-2-24,305r,2,
249,et je ferai trop pis une autre fie.,34,l-305r-2-25,305r,2,
250,Et ele diſt ienel te pardoins mie.,34,l-305r-2-26,305r,2,
251,Se ens ou lit n'en eſt fais li [r]acoꝛs.,34,l-305r-2-27,305r,2,
252,S'amaiſſe miex ke piecha fuſſe moꝛs.,34,l-305r-2-28,305r,2,
253,Diex ki poꝛroit vir ſans es poenter.,35,l-305r-2-29,305r,2,
254,le douche riens quant elle eſt deſloije.,35,l-305v-1-1,305v,1,
255,et d'un ſeul bꝛac douchement acoler.,35,l-305v-1-2,305v,1,
256,il avroit bien povreté eſſau cie. Dame pour ce dirai je a chiere lie,35,l-305v-1-3,305v,1,
257,ſouuentes fois en vo non ces recoꝛs.,35,l-305v-1-4,305v,1,
258,Qui chatif ſiert caitis eſt ſes apoꝛs.,35,l-305v-1-5,305v,1,
259,Je pꝛi amours ke me can chons muchie,36,l-305v-1-6,305v,1,
260,ſoit en .i. trou ou ne puiſt eſtre oïe.,36,l-305v-1-7,305v,1,
261,foꝛs de celui ki riſt comme uns butoꝛs.,36,l-305v-1-8,305v,1,
262,quant je li doins de mon gros fil retoꝛs.,36,l-305v-1-9,305v,1,
263,Talens me vint ceſte ſemaine.,37,l-305v-1-10,305v,1,
264,ſai miex montant que chiex ki fait les dez,37,l-305v-1-11,305v,1,
265,car boine amour a ſe dueur me mainne.,37,l-305v-1-12,305v,1,
266,Si c'on m'a dit. ke j'en ſui amendez.,37,l-305v-1-13,305v,1,
267,Et que j'ai ſens aſſez pour avoir dꝛue.,37,l-305v-1-14,305v,1,
268,et joie en croiſt en mon cuer ſi tres dꝛue.,37,l-305v-1-15,305v,1,
269,k'il ne ſi puet combiner nul cou rous,37,l-305v-1-16,305v,1,
270,fa ge dont ſens quant je ſui amourous.,37,l-305v-1-17,305v,1,
271,Se mes pourpos me puet durer quinſainne.,38,l-305v-1-18,305v,1,
272,entiers par quoi il ne ſoit eſchardez,38,l-305v-1-19,305v,1,
273,je ne poꝛrai mal emploier ma paine,38,l-305v-1-20,305v,1,
274,en parſervir celi dont rewardez,38,l-305v-1-21,305v,1,
275,ſui moult ſouvent ſi toſt que leur veue,38,l-305v-1-22,305v,1,
276,ele me diſt li douce de ve nue.,38,l-305v-2-1,305v,2,
277,hé biau jehan ke vous me ſanlez douz.,38,l-305v-2-2,305v,2,
278,Mais je ne puis amer ces vielz rodous.,38,l-305v-2-3,305v,2,
279,Et avec ce percui je a ſen alainne,39,l-305v-2-4,305v,2,
280,k'il couvenoit ke de li fuſſe amez,39,l-305v-2-5,305v,2,
281,car au pꝛijer le pꝛis en boine vainne.,39,l-305v-2-6,305v,2,
282,ſi n'en poꝛ rai par dꝛoit eſtre blaſmes,39,l-305v-2-7,305v,2,
283,Car on m'avoit ja conte en ſe rue.,39,l-305v-2-8,305v,2,
284,ke li dame trop volentiers mengue,39,l-305v-2-9,305v,2,
285,tar te rouchiaus. ſi j'en donnai du rous,39,l-305v-2-10,305v,2,
286,par chou me fu tous ſes penſers derous.,39,l-305v-2-11,305v,2,
287,Elle m'a dit et ſ'eſt choſe chertainne.,40,l-305v-2-12,305v,2,
288,c'uns cours varles ſ'a a non cau paſtez,40,l-305v-2-13,305v,2,
289,li a liuret tout c'eſt yuer fontainne.,40,l-305v-2-14,305v,2,
290,ſi l'en ama Mes il ſ'en eſt vantez,40,l-305v-2-15,305v,2,
291,ſarai l'amour et chuis l'ara perdue,40,l-305v-2-16,305v,2,
292,et avec ce iert ſe buire fendue.,40,l-305v-2-17,305v,2,
293,ſ'il vient jamais crier li mau uais glous.,40,l-305v-2-18,305v,2,
294,fontainne en lieu dont je ſoie jalous.,40,l-305v-2-19,305v,2,
295,Celle qui j'ame filoit a uant hier lainne.,41,l-305v-2-20,305v,2,
296,Qui miex valoit que ne fiſt li filez.,41,l-305v-2-21,305v,2,
297,Si li dis bas tres dou che caſtelainne,41,l-305v-2-22,305v,2,
298,laiſſieme aler ſi pau ke vous vo lez.,41,l-305v-2-23,305v,2,
299,Deſouz vos dꝛas pour ſentir vo char nue,41,l-305v-2-24,305v,2,
300,et elle dit j'ai eſté effondue.,41,l-305v-2-25,305v,2,
301,Si k'encoꝛ ai ſi tres mal la deſſouz.,41,l-305v-2-26,305v,2,
302,ke je ne puis chou la faire pour vous.,41,l-306r-1-1,306r,1,
303,Chancons fai tant que ſoies entendue,42,l-306r-1-2,306r,1,
304,de ma dame quant je t'arai perdue.,42,l-306r-1-3,306r,1,
305,fui t'ent muchier entre ſes .ii. genoulz,42,l-306r-1-4,306r,1,
306,lues que ſeras es chapee de nous.,42,l-306r-1-5,306r,1,
307,Le miex tumant de tout no riviere.,43,l-306r-1-6,306r,1,
308,me fiſt amours l'au tre jour enamer,43,l-306r-1-7,306r,1,
309,entours .iii. jours le laiſſai eſtraiere,43,l-306r-1-8,306r,1,
310,quant le reuinch n'en peuc mie trouver,43,l-306r-1-9,306r,1,
311,perdue l'eut ſe ne ſeuc ke penſer.,43,l-306r-1-10,306r,1,
312,Dont m'en alai a la maiſon no pꝛeſtre.,43,l-306r-1-11,306r,1,
313,la le trouvai ne ſai ke ce puet eſtre. Mais on peüſt leur kemiſes nouer.,43,l-306r-1-12,306r,1,
314,S'en l'eure fis no preſtre mate chiere.,44,l-306r-1-13,306r,1,
315,nus ne m'en doit ce m'eſt avis blas mer.,44,l-306r-1-14,306r,1,
316,car il ahierſt ma dame par derriere,44,l-306r-1-15,306r,1,
317,enſi ke il le voſiſt eſtranler.,44,l-306r-1-16,306r,1,
318,Dont m'eſtreuai moult foꝛment a plourer,44,l-306r-1-17,306r,1,
319,car je vic tout parmi une feneſtre,44,l-306r-1-18,306r,1,
320,Mais il tenoit .i. baſton de genieſte.,44,l-306r-1-19,306r,1,
321,pour chou n'oſai le paupiere lever.,44,l-306r-1-20,306r,1,
322,Un petit mis en reſpit me maniere.,45,l-306r-1-21,306r,1,
323,ſi m'en alai en no maiſon arriere.,45,l-306r-1-22,306r,1,
324,puis m'en reuinc de goutiere en gou tiere.,45,l-306r-1-23,306r,1,
325,moult bien warnis d'eſpee et de boucler.,45,l-306r-2-1,306r,2,
326,grant ſanlant fis de no pꝛeſtre tuer.,45,l-306r-2-2,306r,2,
327,mais il m'ahierſt errant par le poing dieſtre,45,l-306r-2-3,306r,2,
328,[puis] me bati a des tre et a ſeneſtre,45,l-306r-2-4,306r,2,
329,tant qu'il m'eſtuet en .i. van rapoꝛter.,45,l-306r-2-5,306r,2,
330,Ioians ſerai foy que je doi /ſaint pierre.,46,l-306r-2-6,306r,2,
331,S'enſi me puis a ma dame acoꝛder.,46,l-306r-2-7,306r,2,
332,Car je ſai bien que n'eſt pas couſtumiere,46,l-306r-2-8,306r,2,
333,d'autrui ami a dilaier ne haper,46,l-306r-2-9,306r,2,
334,Des dames doit la baniere poꝛter,46,l-306r-2-10,306r,2,
335,en a mour eſt boullans et ſaude et pieſtre,46,l-306r-2-11,306r,2,
336,plus ke ne ſoit une quaille campieſtre,46,l-306r-2-12,306r,2,
337,partant ne puis ſ'amour ſeur aca ter.,46,l-306r-2-13,306r,2,
338,De tel ieu ma iouet ma dame chiere.,47,l-306r-2-14,306r,2,
339,De quoi il n'a en moi que deſtourber,47,l-306r-2-15,306r,2,
340,Mais non pourquant une ſiene buiniere,47,l-306r-2-16,306r,2,
341,a tant bꝛaſſet pour le pis eſciuer,47,l-306r-2-17,306r,2,
342,que li pꝛeſtres doit madame apoꝛter,47,l-306r-2-18,306r,2,
343,par pais faiſant au coꝛon de no ieſtre.,47,l-306r-2-19,306r,2,
344,et ſ'eſt crokiet k'au plus pꝛés d'une dies tre,47,l-306r-2-20,306r,2,
345,ne puet jamais nul joꝛ a li parler.,47,l-306r-2-21,306r,2,
346,Dame veilliez me canchon Rekaner,48,l-306r-2-22,306r,2,
347,Je vous donrai .i. palefroy en deſtre.,48,l-306r-2-23,306r,2,
348,Car n'a fiert pas a dame de vo ieſtre,48,l-306r-2-24,306r,2,
349,ke voiſt a pié ſes aumoſnes rouuer.,48,l-306r-2-25,306r,2,
350,De toute honnour avoir et maintenir,49,l-306v-1-1,306v,1,
351,eſt boine amour li pꝛe miere rachine,49,l-306v-1-2,306v,1,
352,bien le mous tra Diex quant cha ius ve nir,49,l-306v-1-3,306v,1,
353,voult des haus chieux dont nature devine,49,l-306v-1-4,306v,1,
354,et vraie amours le fiſent remanoir,49,l-306v-1-5,306v,1,
355,en /le vierge ki ſi fiſt ſon de voir,49,l-306v-1-6,306v,1,
356,ke ſen vouloir fiſt du tout en Dieu traire,49,l-306v-1-7,306v,1,
357,par vni te de leur .ii. cuers .i. faire.,49,l-306v-1-8,306v,1,
358,Ainsi amours les ſiens ſet enrichir.,50,l-306v-1-9,306v,1,
359,Ses li cuers filz ke touz ne ſ'i acline.,50,l-306v-1-10,306v,1,
360,quant ſi bel fiſt /cele vierge obeir,50,l-306v-1-11,306v,1,
361,au vouloir Dieu ke des ciex eſt royne.,50,l-306v-1-12,306v,1,
362,Se hautement che doit chaſcuns ſavoir.,50,l-306v-1-13,306v,1,
363,que des chieuz a le ſouverain pooir.,50,l-306v-1-14,306v,1,
364,Autel que Diex che ne puet nuls retraire,50,l-306v-1-15,306v,1,
365,puis c'uns voloirs entr'aus .ii. les apaire.,50,l-306v-1-16,306v,1,
366,Car puis c'uns cuers ſe veult d'un departir,51,l-306v-1-17,306v,1,
367,Pour ieſtre en lui amours en lui decline.,51,l-306v-1-18,306v,1,
368,Car tout vient d'un la doit tout revenir.,51,l-306v-1-19,306v,1,
369,ki chou n'en ſuit folement adeuine.,51,l-306v-1-20,306v,1,
370,Car cuers ſanz lui puet en lui concheuoir.,51,l-306v-1-21,306v,1,
371,le saint eſpir ki ſe fait apparoir.,51,l-306v-1-22,306v,1,
372,lui tierch tout ſeul perſonne d'un afaire,51,l-306v-1-23,306v,1,
373,et de ces .iii. fait .i. Dieu chieus doit plaire.,51,l-306v-1-24,306v,1,
374,Amans qui veult dame et amours ſervir.,52,l-306v-2-1,306v,2,
375,touz jourz conuient ke de ſen cuer afine,52,l-306v-2-2,306v,2,
376,le bien du mal. lui deſplaire et hair,52,l-306v-2-3,306v,2,
377,et pꝛendꝛe en Dieu treſtoute ſe doctrine,52,l-306v-2-4,306v,2,
378,Car ki de li cuideroit riens avoir.,52,l-306v-2-5,306v,2,
379,riens ne feroit riens ne poꝛroit valoir.,52,l-306v-2-6,306v,2,
380,Mais chuis qui tient qu'il ſoit nieus ex emplaire,52,l-306v-2-7,306v,2,
381,a d'eſkiuer chou qui doit Dieu deſplaire.,52,l-306v-2-8,306v,2,
382,Bien ſeult amours lui laiſſant conuenir,53,l-306v-2-9,306v,2,
383,en /la Vierge faire oeu ure noble et fine.,53,l-306v-2-10,306v,2,
384,Quant en ſes flans fiſt deitez veſtir,53,l-306v-2-11,306v,2,
385,hu manite. vnitez l'en fiſt dig ne.,53,l-306v-2-12,306v,2,
386,Dont ne ſe puet pechier res decevoir.,53,l-306v-2-13,306v,2,
387,Se li ſervir met du tout ſon eſpir.,53,l-306v-2-14,306v,2,
388,d'avoir merchi de li le puet eſtraire.,53,l-306v-2-15,306v,2,
389,Ch'eſt uns en Dieu nus moi iens ni repaire,53,l-306v-2-16,306v,2,
390,Dame en penſant au pꝛis de vo viaire.,54,l-306v-2-17,306v,2,
391,me vint chis diz en vous loant me maire.,54,l-306v-2-18,306v,2,
392,Qui conques veult en haute honnour mon,55,l-306v-2-19,306v,2,
393,Metre ſe doit a la dame ſervir.,55,l-306v-2-20,306v,2,
394,en qui Diex voult pour le monde ſauver.,55,l-306v-2-21,306v,2,
395,D'umainne char ſa deité couvrir,55,l-306v-2-22,306v,2,
396,Et vint chauis aparoir com homs moꝛteuz,55,l-306v-2-23,306v,2,
397,che doit chaſcuns ſavoir.,55,l-307r-1-1,307r,1,
398,car en es flans de /le vierge Marie.,55,l-307r-1-2,307r,1,
399,dedens. nuef mois pꝛiſt char et ſanc et vie.,55,l-307r-1-3,307r,1,
400,Car pour ſes biens a tous les bons mouſtrer,56,l-307r-1-4,307r,1,
401,voult Diex ſon coꝛs en /la vierge nourrir,56,l-307r-1-5,307r,1,
