line_no,text,lg,l_id,folio,col,speaker
402,vierge au conchoiure et vierge au de liurer.,56,l-307r-1-6,307r,1,
403,et ce ne pot ne ſavoir ne veir.,56,l-307r-1-7,307r,1,
404,anemis pour ſon pooir.,56,l-307r-1-8,307r,1,
405,que femme en li peüſt fruit concheuoir.,56,l-307r-1-9,307r,1,
406,ki ains n'eüſt d'omme eut compaignie.,56,l-307r-1-10,307r,1,
407,mais Diex poꝛ ce l'avoit edefije,56,l-307r-1-11,307r,1,
408,Dont doit chaſcuns ſi loiaument ouvrer.,57,l-307r-1-12,307r,1,
409,k'il puiſt l'amour /le vierge deſervir.,57,l-307r-1-13,307r,1,
410,Qui touz nous puet vers celui racoꝛder.,57,l-307r-1-14,307r,1,
411,ki pour nous vouls ſon coꝛs en .iii. partir,57,l-307r-1-15,307r,1,
412,S'en fiſt en chiez re manoir le deité,57,l-307r-1-16,307r,1,
413,et chaius re ceuoir l'umanite,57,l-307r-1-17,307r,1,
414,moꝛt en crois a haſchie.,57,l-307r-1-18,307r,1,
415,li saint eſpirs fu la tierche partie.,57,l-307r-1-19,307r,1,
416,Tant vaut amours che puet on eſpꝛouuer.,58,l-307r-1-20,307r,1,
417,ke par amours veut Diex en crois moꝛir.,58,l-307r-1-21,307r,1,
418,ſ'il nous ama nous le devons amer.,58,l-307r-1-22,307r,1,
419,ne nous devons point de li retolir.,58,l-307r-1-23,307r,1,
420,quant de ſi tres chier avoir nous racheta,58,l-307r-1-24,307r,1,
421,quant il nous vout rauoir.,58,l-307r-1-25,307r,1,
422,ke de ſon coꝛs fu la debte paie.,58,l-307r-1-26,307r,1,
423,poꝛ aquiter tout humaine lignie.,58,l-307r-1-27,307r,1,
424,Coꝛs pour les cuers en touz biens doctriner.,59,l-307r-2-1,307r,2,
425,ki de vous ont vierge le ſou uenir.,59,l-307r-2-2,307r,2,
426,bien deüſt avoir le cuer amer.,59,l-307r-2-3,307r,2,
427,quant vo chier fil veiſtes moꝛt ſouffrir,59,l-307r-2-4,307r,2,
428,pour nous et par ſon vouloir.,59,l-307r-2-5,307r,2,
429,Oꝛ conſentez que chaſcuns ſen devoir,59,l-307r-2-6,307r,2,
430,fache ſi bien /vier ge mere et amie.,59,l-307r-2-7,307r,2,
431,a vo douch fil k'ame ne ſoit perie.,59,l-307r-2-8,307r,2,
432,/Vierge a vous pꝛi main et ſoir.,60,l-307r-2-9,307r,2,
433,ke vous veilliez m'ar me remanteuoir.,60,l-307r-2-10,307r,2,
434,au deſtroit jour ou elle iert mal bail lie,60,l-307r-2-11,307r,2,
435,ſe de vous n'a envers vo fil aie.,60,l-307r-2-12,307r,2,
436,Je pꝛi amours que touz jours me pourvoie,61,l-307r-2-13,307r,2,
437,du boin vouloir ke j'ai de lui ſervir,61,l-307r-2-14,307r,2,
438,car amours eſt cius ki nous rendi joie.,61,l-307r-2-15,307r,2,
439,c'/adans avoit fait par pechié perir.,61,l-307r-2-16,307r,2,
440,Et pour ce fuche ſachiez li Sainz eſpirs,61,l-307r-2-17,307r,2,
441,en /la Vierge envoijes.,61,l-307r-2-18,307r,2,
442,Mais au venir ne a la departie,61,l-307r-2-19,307r,2,
443,virginitez n'i fu point amenrie.,61,l-307r-2-20,307r,2,
444,De chou ſavoir a mis mon cuer en voie.,62,l-307r-2-21,307r,2,
445,li granz deſirs que j'ai de deservir,62,l-307r-2-22,307r,2,
446,l'amour celui qui pecheours ravoie.,62,l-307r-2-23,307r,2,
447,de qui chiex veult Sa deité couvrir,62,l-307r-2-24,307r,2,
448,ki del monde eſtoit li kies,62,l-307v-1-1,307v,1,
449,par chelui fu anemis enguignies.,62,l-307v-1-2,307v,1,
450,chou qu'il donna il ne retoli mie.,62,l-307v-1-3,307v,1,
451,Mais il le rent par l'umainne partie.,62,l-307v-1-4,307v,1,
452,Frans cuers gentilz ou touz biens mouteploie,63,l-307v-1-5,307v,1,
453,Il conueniſt la deité mentir,63,l-307v-1-6,307v,1,
454,Se l'anemi vouſiſt tolir ſa pꝛoie.,63,l-307v-1-7,307v,1,
455,Mais il le fiſt par ce lui reſaiſir.,63,l-307v-1-8,307v,1,
456,qui en vous fu herbergiez.,63,l-307v-1-9,307v,1,
457,Mais ainz en fu ſes coꝛs cruchefijes.,63,l-307v-1-10,307v,1,
458,K'aquitez fuſt vers le pere de vie.,63,l-307v-1-11,307v,1,
459,Li granz pechiez k'/adans fiſt par folie.,63,l-307v-1-12,307v,1,
460,Plus douche empꝛiſe em pꝛendꝛe ne poꝛroit.,64,l-307v-1-13,307v,1,
461,ke vous ſervir /mere du saint eſpir,64,l-307v-1-14,307v,1,
462,et /vo chier fil n'eſt dꝛois que j'en recroie.,64,l-307v-1-15,307v,1,
463,car pour nous voult ſon digne coꝛs offrir,64,l-307v-1-16,307v,1,
464,aus faus /Juys renoiez.,64,l-307v-1-17,307v,1,
465,et conſenti qu'en .v. lieus fu plaiez.,64,l-307v-1-18,307v,1,
466,ſi que du ſanc fu li pierre perchie,64,l-307v-1-19,307v,1,
467,et li ſolaus en ot luour cangie.,64,l-307v-1-20,307v,1,
468,/Dame d'amour ſage loiaus et coie,65,l-307v-1-21,307v,1,
469,pour pecheour. vot /vos filz eſtablir. le ſacrement,65,l-307v-1-22,307v,1,
470,car kiconques le croie.,65,l-307v-1-23,307v,1,
471,li ane mis n'a pooir du tenir.,65,l-307v-1-24,307v,1,
472,tant eſt de li deſuoijes.,65,l-307v-1-25,307v,1,
473,/vierge loiaus c'oꝛ vous pꝛengne pitiez,65,l-307v-1-26,307v,1,
474,de chiaus qui ſont en pechié par ueulie,65,l-307v-1-27,307v,1,
475,c'au deſtroit jour leur pꝛeſtez voſtre aie,65,l-307v-1-28,307v,1,
476,Se j'ai fait plus de pechiez,66,l-307v-2-1,307v,2,
477,ke je ne doi. /vierge ſi de pꝛiez,66,l-307v-2-2,307v,2,
478,/voſtre chier filz ke pe nanche kierkie,66,l-307v-2-3,307v,2,
479,me ſoit par quoi m'arme ne ſoit perie.,66,l-307v-2-4,307v,2,
480,De boine amour riens dire ne ſaroie.,67,l-307v-2-5,307v,2,
481,foꝛs que ch'eſt Diex ki pour nous fiſt pꝛeſent,67,l-307v-2-6,307v,2,
482,de /ſon douch fil /la Vierge ſimple et quoie,67,l-307v-2-7,307v,2,
483,et elle y voult obeir ſimplement.,67,l-307v-2-8,307v,2,
484,dont je croi bien treſtout certaine ment,67,l-307v-2-9,307v,2,
485,k'ele en conchuit fruit de vie.,67,l-307v-2-10,307v,2,
486,ki rachata /Adam et ſa lignie,67,l-307v-2-11,307v,2,
487,par ſen douch plaiſir.,67,l-307v-2-12,307v,2,
488,bien l'en de uons amer et conioir.,67,l-307v-2-13,307v,2,
489,Et iou d'amour partir ne me vauroie.,68,l-307v-2-14,307v,2,
490,Car a mours eſt Diex ki donne ſa gent,68,l-307v-2-15,307v,2,
491,voloir d'amer povres ki uet la voie.,68,l-307v-2-16,307v,2,
492,ki pecheours fait aler a tourment,68,l-307v-2-17,307v,2,
493,de coi je di que chius vit bonne ment.,68,l-307v-2-18,307v,2,
494,ki ſiert de volenté lie.,68,l-307v-2-19,307v,2,
495,/le mere au roy qui ſeur touz a baillie.,68,l-307v-2-20,307v,2,
496,Car Diex ſanz faillir,68,l-307v-2-21,307v,2,
497,veult ſes ſeruans loꝛ ſeruiche merir.,68,l-307v-2-22,307v,2,
498,Il eſt bien dꝛois que mes cuers ſi apoie.,69,l-307v-2-23,307v,2,
499,/vierge ke vous aidiez abondamment,69,l-307v-2-24,307v,2,
500,le pecheour ki par vous ſe ravoie.,69,l-307v-2-25,307v,2,
501,Car qui a vous de volenté ſe rent.,69,l-308r-1-1,308r,1,
502,/voerge roy aus il a bon ſentement.,69,l-308r-1-2,308r,1,
503,ke /vos filz n'oublie mie.,69,l-308r-1-3,308r,1,
504,chou k'amans fait pour vous,69,l-308r-1-4,308r,1,
505,/vierge Marie. Che doit on ſentir.,69,l-308r-1-5,308r,1,
506,Que c'eſt granz biens da me de vous ſervir.,69,l-308r-1-6,308r,1,
507,Amours ſ'autre bonté de vous n'avoie.,70,l-308r-1-7,308r,1,
508,foꝛs que le bien c'on pꝛent ou ſacre ment.,70,l-308r-1-8,308r,1,
509,S'eſt il raiſons que d'amer ne recroie.,70,l-308r-1-9,308r,1,
510,Dieu qui tout chou fiſt pour no ſau uement.,70,l-308r-1-10,308r,1,
511,car ainques nus n'ama ſi tenrement,70,l-308r-1-11,308r,1,
512,com Diex qui paiſt ſa maiſnie,70,l-308r-1-12,308r,1,
513,de ſen douch coꝛs et toudis moute plie.,70,l-308r-1-13,308r,1,
514,che doit on tenir.,70,l-308r-1-14,308r,1,
515,k'a tel ſeignour doit chaſcuns obeir,70,l-308r-1-15,308r,1,
516,/Dame qui touz les des uoiez ravoie.,71,l-308r-1-16,308r,1,
517,/vierge on vous doit ſervir deſirau ment.,71,l-308r-1-17,308r,1,
518,Car qui vous ſert il conchoit ſi grant joie.,71,l-308r-1-18,308r,1,
519,ke nus delis a cheli ne ſe pꝛent.,71,l-308r-1-19,308r,1,
520,car /li Filz Dieu qui ne faut ne ne ment,71,l-308r-1-20,308r,1,
521,a ſe gloire appareil lie,71,l-308r-1-21,308r,1,
522,pour recheuoir chiaus de voſtre partie.,71,l-308r-1-22,308r,1,
523,/vierge grant deſir,71,l-308r-1-23,308r,1,
524,doit chaſcuns cuers avoir pour la venir.,71,l-308r-1-24,308r,1,
525,/Vierge ſachans veillies ieſtre en m'aie.,72,l-308r-1-25,308r,1,
526,Si que maintenir,72,l-308r-1-26,308r,1,
527,me puiſſe en bien et touz pechiez fuir,72,l-308r-1-27,308r,1,
528,Je di ki veult en noble pꝛis monter.,73,l-308r-2-1,308r,2,
529,Il doit amours et ſa dame pri,73,l-308r-2-2,308r,2,
530,ki Dieu poꝛra ki tant fait a loer.,73,l-308r-2-3,308r,2,
531,com chius ki a tout le monde a jugier.,73,l-308r-2-4,308r,2,
532,C'eſt li roys puiſſanz,73,l-308r-2-5,308r,2,
533,de nous ſau uer fu engrans.,73,l-308r-2-6,308r,2,
534,quant des chieus vint humanite veſtir,73,l-308r-2-7,308r,2,
535,en /la Vierge ke chas cuns doit ſervir,73,l-308r-2-8,308r,2,
536,Che me ſemont de loi aument amer chou k'amours veut les ſiens ſeruans aidier.,74,l-308r-2-9,308r,2,
537,amours eſt Diex ce puet on eſpꝛou,74,l-308r-2-10,308r,2,
538,uer.,74,l-308r-2-11,308r,2,
539,car pour amour ſouf fri ſon coꝛs plaijer.,74,l-308r-2-12,308r,2,
540,dont li vermaus ſans,74,l-308r-2-13,308r,2,
541,iſſi hoꝛs ſi habondans,74,l-308r-2-14,308r,2,
542,ke les pier res en fiſt fraindꝛe et par tir,74,l-308r-2-15,308r,2,
543,et le ſouleil en connuint oſcurcir.,74,l-308r-2-16,308r,2,
544,Et pour ytant ſouffrir et endurer,75,l-308r-2-17,308r,2,
545,veul chou que Diex me voꝛroit envoier,75,l-308r-2-18,308r,2,
546,Car on ſe doit en lui bien affier,75,l-308r-2-19,308r,2,
547,car de ſon coꝛs vont no debte paier,75,l-308r-2-20,308r,2,
548,pour nous faire franz,75,l-308r-2-21,308r,2,
549,ſouffri les tourmens ſi granz,75,l-308r-2-22,308r,2,
550,en la crois qu'il convint ſon eſpir,75,l-308r-2-23,308r,2,
551,huers de ſon coꝛs des ſeurer et partir.,75,l-308r-2-24,308r,2,
552,Dame d'onnour pour tous cuers doctriner.,76,l-308r-2-25,308r,2,
553,/vier ge loiaus en vous n'ot que courchier.,76,l-308r-2-26,308r,2,
554,quant /vo chier filz viſtes a moꝛt liurer.,76,l-308v-1-1,308v,1,
555,car de ſi pꝛés le vouliez apꝛochier,76,l-308v-1-2,308v,1,
556,comme obeiſſans.,76,l-308v-1-3,308v,1,
557,ſe il n'eſtoit ſouffiſſanz,76,l-308v-1-4,308v,1,
558,de bien paier avec vouliez moꝛir.,76,l-308v-1-5,308v,1,
559,grant bonté fu bien fait a deſer uir.,76,l-308v-1-6,308v,1,
560,Qui bien voꝛroit a le bonte penſer.,77,l-308v-1-7,308v,1,
561,/vierge de vous ne ſe doit eſmaier.,77,l-308v-1-8,308v,1,
562,cuers ki vous ſert et veille reuuarder.,77,l-308v-1-9,308v,1,
563,les biens que vous voulez appareillier.,77,l-308v-1-10,308v,1,
564,les loiaus amans.,77,l-308v-1-11,308v,1,
565,E /dou che vierge ſachans.,77,l-308v-1-12,308v,1,
566,C'oꝛ conſentez que chaſcuns puiſt venir,77,l-308v-1-13,308v,1,
567,a le gloire qui dure ſanz faillir.,77,l-308v-1-14,308v,1,
568,Che ſeruentois doi je bien pꝛeſenter,78,l-308v-1-15,308v,1,
569,a vous /vierge pour nous le veilliez furnir,78,l-308v-1-16,308v,1,
570,oꝛ le veil liez en pité requeillir.,78,l-308v-1-17,308v,1,
571,S'amours n'eüſt on ques eſté en Dieu je quit,79,l-308v-1-18,308v,1,
572,ſavoir de fi k'il n'eüſt ja humanite priſe,79,l-308v-1-19,308v,1,
573,en femme en qui deſcendi.,79,l-308v-1-20,308v,1,
574,Et de li naſki.,79,l-308v-1-21,308v,1,
575,et pour la folie,79,l-308v-1-22,308v,1,
576,k'/adans fiſt par glouternie,79,l-308v-1-23,308v,1,
577,vout moꝛr en croiz reche voir,79,l-308v-1-24,308v,1,
578,/li dous roys iheſus.,79,l-308v-1-25,308v,1,
579,che fu pour les ſiens rauoir.,79,l-308v-1-26,308v,1,
580,qu'il avoit perdus.,79,l-308v-2-1,308v,2,
581,Et puis que Dieux nous a mouſtre,80,l-308v-2-2,308v,2,
582,comment il nous ama je di.,80,l-308v-2-3,308v,2,
583,ke nous devons ſanz fauſſeté,80,l-308v-2-4,308v,2,
584,lui amer et /ſa mere auſſi.,80,l-308v-2-5,308v,2,
585,a cui je m'otri. car ſa douce aie,80,l-308v-2-6,308v,2,
586,eſt a touz chiaus appareil lie,80,l-308v-2-7,308v,2,
587,ki font ſon vouloir.,80,l-308v-2-8,308v,2,
588,car devant Dieu de laſus,80,l-308v-2-9,308v,2,
589,fait les ſeruiches paroir,80,l-308v-2-10,308v,2,
590,de ſes loiaus dꝛus.,80,l-308v-2-11,308v,2,
591,Moult a chuis le cuer fourſene.,81,l-308v-2-12,308v,2,
592,ki la dame met en oubli.,81,l-308v-2-13,308v,2,
593,ki poꝛta le digne clarté.,81,l-308v-2-14,308v,2,
594,de coi tout cil ſont eſclarchi,81,l-308v-2-15,308v,2,
595,ki ſont Dieu ami.,81,l-308v-2-16,308v,2,
596,/la vierge Marie,81,l-308v-2-17,308v,2,
597,touz jourz pour ſes amis pꝛie.,81,l-308v-2-18,308v,2,
598,pour ce main et ſoir,81,l-308v-2-19,308v,2,
599,le doit ſervir plus et plus.,81,l-308v-2-20,308v,2,
600,caſcuns bien fait ſon devoir,81,l-308v-2-21,308v,2,
601,k'a li ſ'eſt rendus.,81,l-308v-2-22,308v,2,
602,Il ſont aucun cuer a ueule,82,l-308v-2-23,308v,2,
603,par temptation d'anemi.,82,l-308v-2-24,308v,2,
604,ſi qu'il ont Dieu entr'oublie.,82,l-308v-2-25,308v,2,
605,Mais bien poꝛront avoir merchi.,82,l-308v-2-26,308v,2,
606,ſ'il veulent cheli. ki /mere et amie,82,l-308v-2-27,308v,2,
607,eſt Dieu ſervir ſanz boiſdie.,82,l-308v-2-28,308v,2,
608,car d'iaus eſmou voir.,82,l-308v-2-29,308v,2,
609,fera ſi boines vertus,82,l-308v-2-30,308v,2,
610,k'anemis n'avra pooir,82,l-308v-2-31,308v,2,
611,d'iaus faire iraſcus.,82,l-308v-2-32,308v,2,
612,/Dame nourie en honnes te.,83,l-308v-2-33,308v,2,
613,/Douche vierge au coꝛs ſeignouri.,83,l-308v-2-34,308v,2,
614,veilliez a voir de moi pité,83,l-308v-2-35,308v,2,
615,/mere Dieu che ſeruentois chi,83,l-309r-1-1,309r,1,
616,ai pour vous furni.,83,l-309r-1-2,309r,1,
617,de volenté lie.,83,l-309r-1-3,309r,1,
618,l'ai fait bien a emploije,83,l-309r-1-4,309r,1,
619,tieng ma painne voir.,83,l-309r-1-5,309r,1,
620,oꝛ ſoit de vous retenus,83,l-309r-1-6,309r,1,
621,dame ſ'iere ſanz doloir,83,l-309r-1-7,309r,1,
622,de joie ueſtus,83,l-309r-1-8,309r,1,
623,/Vierge je vous pꝛi,84,l-309r-1-9,309r,1,
624,/mere Dieu pꝛoiſie.,84,l-309r-1-10,309r,1,
625,la ou Diex ve oir n'oſera en parlant nus,84,l-309r-1-11,309r,1,
626,deſtournez nous de,84,l-309r-1-12,309r,1,
627,Sour toute riens a amours ſeignourie,85,l-309r-1-13,309r,1,
628,Et tele amours eſt Diex ki ſe veſti.,85,l-309r-1-14,309r,1,
629,d'umanite en /la vierge Marie.,85,l-309r-1-15,309r,1,
630,ſi ſainte ment puis k'il en eut a li,85,l-309r-1-16,309r,1,
631,par /ſon angle le nouvele tramiſe,85,l-309r-1-17,309r,1,
632,c'onques de chou ne ſ'en fu entremiſe,85,l-309r-1-18,309r,1,
633,nature ainz ſ'en eſbahy.,85,l-309r-1-19,309r,1,
634,quant par li fait ne fu mie,85,l-309r-1-20,309r,1,
635,Amours de vous et de voſtre maiſtrie.,86,l-309r-1-21,309r,1,
636,nous devons bien loer car mal bailli.,86,l-309r-1-22,309r,1,
637,eſtiens et moꝛt quant pour nous rendꝛe vie,86,l-309r-1-23,309r,1,
638,vos dignes coꝛs en la crois moꝛt ſouffri.,86,l-309r-1-24,309r,1,
639,la endꝛoit fu tel /da me d'ire eſpꝛiſe.,86,l-309r-1-25,309r,1,
640,Se ne fuſt homs qui pites n'en fuſt pꝛi ſe.,86,l-309r-1-26,309r,1,
641,ki adont eüſt oÿ,86,l-309r-1-27,309r,1,
642,le duel de mere courchie.,86,l-309r-1-28,309r,1,
643,Amours je n'ai d'autre riens nule envie.,87,l-309r-1-29,309r,1,
644,foꝛs k'aie a vous del tout ſi obey.,87,l-309r-2-1,309r,2,
645,ke m'arme ſoit en vo gloire eſſauchie,87,l-309r-2-2,309r,2,
646,ou vo ſaint ſont et chele que je di.,87,l-309r-2-3,309r,2,
647,ke vous avez par dalez vous aſſiſe.,87,l-309r-2-4,309r,2,
648,a grant honnour ſes ſa ges chiex ki viſe.,87,l-309r-2-5,309r,2,
649,k'en fin ſe voie enrichi,87,l-309r-2-6,309r,2,
650,de ſi douche compaignie.,87,l-309r-2-7,309r,2,
651,/Dame d'onnour et de touz biens garnie,88,l-309r-2-8,309r,2,
652,en cui tou te virginité floꝛi.,88,l-309r-2-9,309r,2,
653,/coꝛs pꝛe cieus et de royaus lignie,88,l-309r-2-10,309r,2,
654,/medecine pour tout avoir gari,88,l-309r-2-11,309r,2,
655,.I. pecheour quant laiſt ſe fole empꝛiſe.,88,l-309r-2-12,309r,2,
656,pꝛiez /vo fil /vierge tres bien apꝛiſe.,88,l-309r-2-13,309r,2,
657,k'il ait de m'arme merchi.,88,l-309r-2-14,309r,2,
658,Si k'ele Ne ſoit perie,88,l-309r-2-15,309r,2,
659,Dame ſeur moi avez auoerie.,89,l-309r-2-16,309r,2,
660,et ſeur les sains /vo douc fil autreſſi.,89,l-309r-2-17,309r,2,
661,car quant tenra ſeur humaine lig nie.,89,l-309r-2-18,309r,2,
662,ſon jugement Diex et il iert ainſſi.,89,l-309r-2-19,309r,2,
663,ke toute s'iert en ſe pꝛeſence miſe,89,l-309r-2-20,309r,2,
664,tout tranſleront ſainte eglyſe deuiſe.,89,l-309r-2-21,309r,2,
665,k'il n'i avra ſi hardi.,89,l-309r-2-22,309r,2,
666,foꝛs Dieu et vous ki mot die.,89,l-309r-2-23,309r,2,
667,Dame veilliez e de vous ſoit oïe.,90,l-309r-2-24,309r,2,
668,cheſte canchons ſeruentoiſe k'auſſi,90,l-309r-2-25,309r,2,
669,me veilliez vous aidier. /Dame pꝛoiſie.,90,l-309r-2-26,309r,2,
670,k'en voſtre honnour l'ai apoꝛtee ci.,90,l-309r-2-27,309r,2,
671,Je croi k'amours ne ſera ja laſſee.,91,l-309v-1-1,309v,1,
672,ne nuit ne jour de men cuer traveillier.,91,l-309v-1-2,309v,1,
673,amer me fait trop eſcaufee,91,l-309v-1-3,309v,1,
674,dame ki n'a ne moi ne mon cant chier.,91,l-309v-1-4,309v,1,
675,je ne le ſeue onques tant a plakier.,91,l-309v-1-5,309v,1,
676,ke me voſiſt es couter.,91,l-309v-1-6,309v,1,
677,ainz fait adies quant le doi,91,l-309v-1-7,309v,1,
678,a parler de guignau.,91,l-309v-1-8,309v,1,
679,Tout ainſſi m'a penet mainte journee.,92,l-309v-1-9,309v,1,
680,k'ainc ne le poc de riens apꝛeuiſier.,92,l-309v-1-10,309v,1,
681,bien y parut ne ſai kele veſpꝛee.,92,l-309v-1-11,309v,1,
682,quant je cuidai a lui .i. pau luitier.,92,l-309v-1-12,309v,1,
683,Car ele lues comme ras de grenier,92,l-309v-1-13,309v,1,
684,ſali pour moi eſcuier,92,l-309v-1-14,309v,1,
685,ſi treſbucha ſi foꝛt k'au releuer.,92,l-309v-1-15,309v,1,
686,vit aſes pꝛés dou barbau,92,l-309v-1-16,309v,1,
687,On ne fu che meſchean che pꝛouvee.,93,l-309v-1-17,309v,1,
688,quant je le vi deuant moi treſbu chier.,93,l-309v-1-18,309v,1,
689,ke neuc .i. ſac ſe l'euſſe empoꝛtee,93,l-309v-1-19,309v,1,
690,ſ'euſſe fait le ſot a l'enkierkier,93,l-309v-1-20,309v,1,
691,et ſi eüſt moult dur oef a dokier.,93,l-309v-1-21,309v,1,
692,ſ'ele ſe voſiſt creter.,93,l-309v-1-22,309v,1,
693,elle oſaſt bien teus .xl. auuarder.,93,l-309v-1-23,309v,1,
694,ke je ſui touz a .i. trau.,93,l-309v-1-24,309v,1,
695,Mais ja pour ce n'iert de moi redoutee.,94,l-309v-1-25,309v,1,
696,car ſ'ele tout me devoit vif mengier,94,l-309v-1-26,309v,1,
697,ſe li ſera ma beſoingne com,94,l-309v-1-27,309v,1,
698,Dont vers les rains giſent li deſirier.,94,l-309v-1-28,309v,1,
699,Diex ki me tient ke ne li voiz pꝛoi ier,94,l-309v-1-29,309v,1,
700,k'elle me laiſſaſt hurter ainc c'oꝛe dont nel poꝛroit endurer,94,l-309v-2-1,309v,2,
701,poꝛ ſen clau,94,l-309v-2-2,309v,2,
702,Me dame eſt ſi de ſ'amour appꝛeſſee,95,l-309v-2-3,309v,2,
703,commen poꝛra aſſez toſt fourlouchier,95,l-309v-2-4,309v,2,
704,Car tantoſt eſt bele coſe hapee.,95,l-309v-2-5,309v,2,
705,mais je l'irai entre ſait a plaidier.,95,l-309v-2-6,309v,2,
706,et ſe je puis tangonner et bꝛoijer,95,l-309v-2-7,309v,2,
707,k'el le me veille enamer.,95,l-309v-2-8,309v,2,
708,Se ne li fach laijer le regiber.,95,l-309v-2-9,309v,2,
709,Dont n'a il kieure en hayn nau.,95,l-309v-2-10,309v,2,
710,Je ne ceſſai .ii. nuis a de veillier,96,l-309v-2-11,309v,2,
711,pour ceſte can chon trouver.,96,l-309v-2-12,309v,2,
712,Oꝛ le voꝛrai a chelui preſenter.,96,l-309v-2-13,309v,2,
713,poꝛ cui j'ai moult le cuer flau.,96,l-309v-2-14,309v,2,
714,Soit toꝛs ou dꝛoiz par faute de ſanté.,97,l-309v-2-15,309v,2,
715,ai moult lonc tans d'amours eſté deſpres.,97,l-309v-2-16,309v,2,
716,mais Dieu merchi j'ai le mal encante.,97,l-309v-2-17,309v,2,
717,tant que je ſui de dame amer eſpꝛis.,97,l-309v-2-18,309v,2,
718,ſi n'ai mie che m'eſt avis mes,97,l-309v-2-19,309v,2,
719,pꝛis.,97,l-309v-2-20,309v,2,
720,car je ſai bien k'en tres tout ſon viſnage,97,l-309v-2-21,309v,2,
721,n'a ſi tres bien tenchant ne ſi lunage.,97,l-309v-2-22,309v,2,
722,Pour che le ſai k'ai avec lui eſté. velle a maint biel cop donnet,98,l-309v-2-23,309v,2,
723,ke pris bou riel waingniet,98,l-309v-2-24,309v,2,
724,et bouriel conqueſte.,98,l-309v-2-25,309v,2,
725,amours merchi de chou k'ai entrepꝛis.,98,l-310r-1-1,310r,1,
726,Car quant je weil pour eſſauchier ſe pꝛis.,98,l-310r-1-2,310r,1,
727,amours mi fait traitier de mariage,98,l-310r-1-3,310r,1,
728,errant le va nonchier en ſon ruage,98,l-310r-1-4,310r,1,
729,Hé; Diex con j'ai tres bien men cuer plante.,99,l-310r-1-5,310r,1,
730,Si fuſt hiernus il fuſt tantoſt repꝛis.,99,l-310r-1-6,310r,1,
731,Mais yuier crient ke ne l'ait ſouſplante.,99,l-310r-1-7,310r,1,
732,avec tout chou ke ma dame a repꝛis,99,l-310r-1-8,310r,1,
733,ke j'ai mon cuer en ſon coſtet repꝛis.,99,l-310r-1-9,310r,1,
734,mais non ai voit ainz ne l'en fis dama ge.,99,l-310r-1-10,310r,1,
735,tres puis le jour ke je l'en fis hommage.,99,l-310r-1-11,310r,1,
736,Si m'ermerueill ki telle cruauté li diſt,100,l-310r-1-12,310r,1,
737,de moi par Dieu de paradis.,100,l-310r-1-13,310r,1,
738,ainz ne penſai vers lui deſloiauté.,100,l-310r-1-14,310r,1,
739,Mais boin voirs eſt quant l'acointai jadis,100,l-310r-1-15,310r,1,
740,couvent li euch ſens n'i ſeroit jadis,100,l-310r-1-16,310r,1,
741,pour ce le veul amer en ſon uſage.,100,l-310r-1-17,310r,1,
742,et li amer autant ſote ke ſage.,100,l-310r-1-18,310r,1,
743,Dame pour vous tenir ma loiauté,101,l-310r-1-19,310r,1,
744,vous veil pꝛoijer ke vos cuers ſoit touz fis.,101,l-310r-1-20,310r,1,
745,de chou ke vous en vo deſloiauté,101,l-310r-1-21,310r,1,
746,vous mainte nez car ch'eſt voſt granz pourfis,101,l-310r-1-22,310r,1,
747,et ſachies bien de chou ſui je touz fis.,101,l-310r-1-23,310r,1,
748,k'a che Noel arez vo noelage.,101,l-310r-1-24,310r,1,
749,S'il me devoit couſter mon puchelage.,101,l-310r-1-25,310r,1,
750,Marien mau coꝛs ſera chis caus tramis.,102,l-310r-2-1,310r,2,
751,car je ſui moult durement ſes amis,102,l-310r-2-2,310r,2,
752,et ſ'eſt bien voires plus des pierte,102,l-310r-2-3,310r,2,
753,/Gilles fachuel fai tes mi che meſage.,102,l-310r-2-4,310r,2,
754,Plourez amant car vraie amour[s] eſt moꝛte,103,l-310r-2-5,310r,2,
755,en cheſt pa is jamais ne le verrez.,103,l-310r-2-6,310r,2,
756,a nuit par nuit vint bus kant a no poꝛte.,103,l-310r-2-7,310r,2,
757,l'arme de li qu'enpoꝛtoit vns mauf fez.,103,l-310r-2-8,310r,2,
758,Mais tant me fiſt li dyables de bontez.,103,l-310r-2-9,310r,2,
759,l'ar me miſc jus tant qu'ele ot .iii. oes pus,103,l-310r-2-10,310r,2,
760,et par ces oes iert li mons retenus.,103,l-310r-2-11,310r,2,
761,che truis liſant en un kanebuſtin.,103,l-310r-2-12,310r,2,
762,ou je le mis en eſcrit ier matin.,103,l-310r-2-13,310r,2,
763,S'eſt bien raiſons ke chaſcuns me depoꝛte,104,l-310r-2-14,310r,2,
764,tant que dite vous ſoit li veritez.,104,l-310r-2-15,310r,2,
765,des nouveles que je vous chi apoꝛte.,104,l-310r-2-16,310r,2,
766,Moꝛte eſt amours enſi que vous oez.,104,l-310r-2-17,310r,2,
767,Mais em bꝛief tans ſachies les rauerez,104,l-310r-2-18,310r,2,
768,au departir le dyable diſt /bergilius,104,l-310r-2-19,310r,2,
769,quant il repꝛiſt l'arme qu'il ot mis jus.,104,l-310r-2-20,310r,2,
770,et le me miſt de roumant en latin. Si qu'il eſt chi eſcrit en par chemin.,104,l-310r-2-21,310r,2,
771,Accipite /li englais. ki ait toꝛte,105,l-310v-1-1,310v,1,
772,l'une des rains et ſe ſoit bien cou wes.,105,l-310v-1-2,310v,1,
773,celui querens qu'il ſoit de tele ſoꝛte,105,l-310v-1-3,310v,1,
774,et de .iii. oes couuer li pꝛieres.,105,l-310v-1-4,310v,1,
775,Et ſ'il les keuue eſkiepir les verrez,105,l-310v-1-5,310v,1,
776,dedenz .viii. iours et ſ'il y avoit plus.,105,l-310v-1-6,310v,1,
777,Ne pens ſez ja que li fruis ſoit per dus.,105,l-310v-1-7,310v,1,
778,Naitre en convient amours en .i. cretin,105,l-310v-1-8,310v,1,
779,l'es kierpe au col a loy de pe lerin.,105,l-310v-1-9,310v,1,
780,Et ſ'enſi eſt que foꝛ tune li foꝛte.,106,l-310v-1-10,310v,1,
781,ait fait amours naiſtre dou dies tre lez,106,l-310v-1-11,310v,1,
782,a cheſt /engleſke qui en che ſe depoꝛte.,106,l-310v-1-12,310v,1,
783,je vous dirai ſeigneur que vous ferez,106,l-310v-1-13,310v,1,
784,encontre amours tout enſaule en yrez.,106,l-310v-1-14,310v,1,
785,Se li donra chaſcuns .ii. croſle cus.,106,l-310v-1-15,310v,1,
786,loꝛs li verrez demoustrer ſes vertus,106,l-310v-1-16,310v,1,
787,a le maiſon raſſet ou au defrin.,106,l-310v-1-17,310v,1,
788,pour le grant feu et le flair du foꝛt vin.,106,l-310v-1-18,310v,1,
789,Cheſte choſe foꝛment me reconfoꝛte.,107,l-310v-1-19,310v,1,
790,Se vous dirai pourquoi ſe vous[ volez].,107,l-310v-1-20,310v,1,
791,onques ne fui de paſſion eſcoꝛte.,107,l-310v-1-21,310v,1,
792,Si bien te nus es bꝛas ne es coſtez,107,l-310v-1-22,310v,1,
793,que je ſerai d'amours c'eſt veritez,107,l-310v-1-23,310v,1,
794,de quelle eure que ſoie reueſtus.,107,l-310v-1-24,310v,1,
795,Mais vous veés bien. que je ſui tres touz nus.,107,l-310v-2-1,310v,2,
796,Se diroit toſt amours va ton chemin,107,l-310v-2-2,310v,2,
797,Car qui m'agai bon a pa rent ne couſin.,107,l-310v-2-3,310v,2,
798,Par lonc tans ai eſté triſtes et mus.,108,l-310v-2-4,310v,2,
799,Mais boine amours de cui ſui raueſtus.,108,l-310v-2-5,310v,2,
800,me fait can ter pour dame de haut liu.,108,l-310v-2-6,310v,2,
801,que j'en amai awan a /.ſaint Quentin.,108,l-310v-2-7,310v,2,
