line_no,text,lg,l_id,folio,col,speaker
1,Compains vois tu ce que je uoy,1,l-13v-1-4,13v,1,FirstLiving
2,Par pou que je ne m'en desroy,1,l-13v-1-5,13v,1,FirstLiving
3,De grant paour le cueꝛ me tranble,1,l-13v-1-6,13v,1,FirstLiving
4,Vois tu la ces .iii. moꝛs enſemble,1,l-13v-1-7,13v,1,FirstLiving
5,comme il ſont hideus et diveꝛs,1,l-13v-1-8,13v,1,FirstLiving
6,Et pourri et mangie de veꝛs,1,l-13v-1-9,13v,1,FirstLiving
7,Tel devendꝛont nostre iouuente,1,l-13v-1-10,13v,1,FirstLiving
8,De tel marchié avrons tel ventes,1,l-13v-1-11,13v,1,FirstLiving
9,Qu'il nous vint de no premieꝛ peꝛe,1,l-13v-1-12,13v,1,FirstLiving
10,Quar chaſcun qui naiſt le compeꝛe,1,l-13v-1-13,13v,1,FirstLiving
11,Que tuit en ſuffrent la moꝛt ſure,1,l-13v-1-14,13v,1,FirstLiving
12,Et aprés des veꝛs la moꝛſure,1,l-13v-1-15,13v,1,FirstLiving
13,Qui alame ne met conroi,1,l-13v-1-16,13v,1,FirstLiving
14,Prince ne duc conte ne roy,1,l-13v-2-1,13v,2,FirstLiving
15,Nauront de poꝛt ne que ribaut,1,l-13v-2-2,13v,2,FirstLiving
16,Qui jamés ne feꝛont ris baut,1,l-13v-2-3,13v,2,FirstLiving
17,Puisques tenebꝛes ſeꝛont uns,1,l-13v-2-4,13v,2,FirstLiving
18,Denfeꝛ ou tout bien ſont remis,1,l-13v-2-5,13v,2,FirstLiving
19,Li ſecons vis diſt je envie,2,l-13v-2-6,13v,2,SecondLiving
20,Biaus compains damender ma vie,2,l-13v-2-7,13v,2,SecondLiving
21,Trop ai fait de mes voulentes,2,l-13v-2-8,13v,2,SecondLiving
22,Oꝛ eſt mes cueꝛs entalentes,2,l-13v-2-9,13v,2,SecondLiving
23,De faire tant que mame acoꝛde,2,l-13v-2-10,13v,2,SecondLiving
24,Au dous roy de miſeꝛicoꝛde,2,l-13v-2-11,13v,2,SecondLiving
25,Que mes coꝛs neſt que une faille,2,l-13v-2-12,13v,2,SecondLiving
26,Ce puis je bien vëoir ſans faille,2,l-13v-2-13,13v,2,SecondLiving
27,Par ces mouſtres la aparans,2,l-13v-2-14,13v,2,SecondLiving
28,Quen tel point ſeꝛe je par tans,2,l-13v-2-15,13v,2,SecondLiving
29,Car moꝛt me feꝛra de ſa faus,2,l-13v-2-16,13v,2,SecondLiving
30,Faucons ne chiens oſtoirs geꝛfaus,2,l-13v-2-17,13v,2,SecondLiving
31,Les grans ſales ne les grans tours,2,l-13v-2-18,13v,2,SecondLiving
32,Ne puet la moꝛt tolir ſes tours,2,l-13v-2-19,13v,2,SecondLiving
33,Que ne pꝛeingne tout a delivre,2,l-13v-2-20,13v,2,SecondLiving
34,Lomme quant il cuide miex vivre,2,l-13v-2-21,13v,2,SecondLiving
35,Ne ne puet nus le joꝛ ſavoir,2,l-13v-2-22,13v,2,SecondLiving
36,quant la moꝛt le voudꝛa avoir,2,l-13v-2-23,13v,2,SecondLiving
37,Li tieꝛs vis qui eſtraint ſes mains,3,l-13v-2-24,13v,2,ThirdLiving
38,Diſt pourquoi fu fais homs humains,3,l-13v-2-25,13v,2,ThirdLiving
39,Puis qu'il doit recevoir tel peꝛte,3,l-13v-2-26,13v,2,ThirdLiving
40,Ce fu folie trop apeꝛte,3,l-13v-2-27,13v,2,ThirdLiving
41,Se folie fut onques Diex,3,l-13v-2-28,13v,2,ThirdLiving
42,Contre joies eſt ſi grans Diex,3,l-13v-2-29,13v,2,ThirdLiving
43,En ce chetif monde para,3,l-13v-2-30,13v,2,ThirdLiving
44,Foꝛs ſeullement que Diex para,3,l-13v-2-31,13v,2,ThirdLiving
45,Homme ſur toute creature,3,l-13v-2-32,13v,2,ThirdLiving
46,quant le foꝛma a ſa figure,3,l-13v-2-33,13v,2,ThirdLiving
47,Si que il puet faire ſans plait,3,l-13v-2-34,13v,2,ThirdLiving
48,Buen ou mal lequel qui li pleſt,3,l-13v-2-35,13v,2,ThirdLiving
49,Oꝛ ſe gart moult bien a lempꝛiſſe,3,l-13v-2-36,13v,2,ThirdLiving
50,Que tel voie ſoit par li pꝛiſſe,3,l-14r-1-1,14r,1,ThirdLiving
51,Que devant Dieu ne ſoit repꝛis,3,l-14r-1-2,14r,1,ThirdLiving
52,Que ſil eſt amal faire pꝛis,3,l-14r-1-3,14r,1,ThirdLiving
53,Sans repantance au jugement,3,l-14r-1-4,14r,1,ThirdLiving
54,Ieꝛt juges ne ment,3,l-14r-1-5,14r,1,ThirdLiving
55,Li premieꝛs moꝛs diſt damoiſel,4,l-14r-1-6,14r,1,FirstDead
56,Ne leſſiez pas por vostre oiſſel,4,l-14r-1-7,14r,1,FirstDead
57,Ne pour vos robes a oꝛfrois,4,l-14r-1-8,14r,1,FirstDead
58,Qu'an terre geꝛra chaſcun frois,4,l-14r-1-9,14r,1,FirstDead
59,Et pourrira vo char humaine,4,l-14r-1-10,14r,1,FirstDead
60,Oꝛ gardes bien que ne vous maine,4,l-14r-1-11,14r,1,FirstDead
61,Vos grans deduis ne vos ſolas,4,l-14r-1-12,14r,1,FirstDead
62,Ou on pꝛent les ames au las,4,l-14r-1-13,14r,1,FirstDead
63,Ou grief toꝛment qui tous joꝛs dure,4,l-14r-1-14,14r,1,FirstDead
64,Por vos coꝛs qui neſt foꝛs oꝛdure,4,l-14r-1-15,14r,1,FirstDead
65,Ce povez vous par nous vëoir,4,l-14r-1-16,14r,1,FirstDead
66,Oꝛ vous doint Diex bien poꝛueoir,4,l-14r-1-17,14r,1,FirstDead
67,Car par nous avez bien veü,4,l-14r-1-18,14r,1,FirstDead
68,Que vos coꝛs ſeꝛont poꝛveu,4,l-14r-1-19,14r,1,FirstDead
69,En oꝛde et en puant priſon,4,l-14r-1-20,14r,1,FirstDead
70,Et ſi ni fu onques pꝛis hon,4,l-14r-1-21,14r,1,FirstDead
71,Com truiſſe qui en fuſt delivres,4,l-14r-1-22,14r,1,FirstDead
72,En quanquauez veü de livres,4,l-14r-1-23,14r,1,FirstDead
73,Seigneurs ce dit li ſecons moꝛs,5,l-14r-1-24,14r,1,SecondDead
74,Il eſt ueꝛites que la moꝛt,5,l-14r-1-25,14r,1,SecondDead
75,Nous a fais tiex comme nous ſommes,5,l-14r-1-26,14r,1,SecondDead
76,En la fin poꝛteꝛez tiex ſommes,5,l-14r-1-27,14r,1,SecondDead
77,Ni avra ſi pur ne ſi fin,5,l-14r-1-28,14r,1,SecondDead
78,Oꝛ pouruees devant la fin,5,l-14r-1-29,14r,1,SecondDead
79,Que les anmes aient repos,5,l-14r-1-30,14r,1,SecondDead
80,quant en terre ſeꝛes repos,5,l-14r-1-31,14r,1,SecondDead
81,Navez ami tant vous ait chieꝛ,5,l-14r-1-32,14r,1,SecondDead
82,Qui jamés vous daigne atouchier,5,l-14r-1-33,14r,1,SecondDead
83,Nempoꝛteꝛes foꝛs que bien fait,5,l-14r-1-34,14r,1,SecondDead
84,De quanquauez au monde fait,5,l-14r-1-35,14r,1,SecondDead
85,Se bien vous voulez regardeꝛ,5,l-14r-1-36,14r,1,SecondDead
86,Doꝛgueil vous deuriez gardeꝛ,5,l-14r-2-1,14r,2,SecondDead
87,En nous povez pꝛendꝛe eſſemplaire,5,l-14r-2-2,14r,2,SecondDead
88,Qui durement vous devroit pleire,5,l-14r-2-3,14r,2,SecondDead
89,Dont vous vaudꝛiez miex a lame,5,l-14r-2-4,14r,2,SecondDead
90,Car li coꝛs poꝛrira ſans ame,5,l-14r-2-5,14r,2,SecondDead
91,Li tieꝛs moꝛs diſt qui eſt ſechiez,6,l-14r-2-6,14r,2,ThirdDead
92,Je fui de mon lingnage chiez,6,l-14r-2-7,14r,2,ThirdDead
93,Rois et pꝛinces et conneſtables,6,l-14r-2-8,14r,2,ThirdDead
94,Riches et biax joians metables,6,l-14r-2-9,14r,2,ThirdDead
95,Oꝛ ſui ſi povres et ſi nus,6,l-14r-2-10,14r,2,ThirdDead
96,Que vëoir ne me daingne mis,6,l-14r-2-11,14r,2,ThirdDead
97,Qu'il ne meſt remes que les os,6,l-14r-2-12,14r,2,ThirdDead
98,Et pour itant dire vous os,6,l-14r-2-13,14r,2,ThirdDead
99,Que mar vit li homs en ceſt monde,6,l-14r-2-14,14r,2,ThirdDead
100,S'il ne fait ſame nete et pure,6,l-14r-2-15,14r,2,ThirdDead
101,Coꝛs eſt au monde li deduis,6,l-14r-2-16,14r,2,ThirdDead
102,Dont on eſt en enfeꝛ conduis,6,l-14r-2-17,14r,2,ThirdDead
103,Sa alentree grant apꝛeſſe,6,l-14r-2-18,14r,2,ThirdDead
104,Et aliſſue grant triſteſce,6,l-14r-2-19,14r,2,ThirdDead
105,Je ne vous ſai miex pꝛeſchieꝛ,6,l-14r-2-20,14r,2,ThirdDead
106,Mouſtre chaſcun comme il ſa chier,6,l-14r-2-21,14r,2,ThirdDead
107,Cui il ſouuendꝛa bien dameꝛ,6,l-14r-2-22,14r,2,ThirdDead
108,Pechiez nel poꝛra entameꝛ,6,l-14r-2-23,14r,2,ThirdDead
