line_no,text,lg,l_id,folio,col,speaker
1484,Se n'obeis a moy,215,l-181r-1-4,181r,1,
1485,Poꝛ ce que chargiez ez,215,l-181r-1-5,181r,1,
1486,Et que poꝛtes grans fez,215,l-181r-1-6,181r,1,
1487,Ceſte foys ſoufferrai,215,l-181r-1-7,181r,1,
1488,Sire moult de mercis,216,l-181r-1-13,181r,1,
1489,Bien ſai que j'ai meſpꝛis,216,l-181r-1-14,181r,1,
1490,Jamais ne m'auendꝛa.,216,l-181r-1-15,181r,1,
1491,Quant venir vous verrai,216,l-181r-1-16,181r,1,
1492,[...],216,l-181r-1-17,181r,1,
1493,Ja fai ne me tendꝛa,216,l-181r-1-18,181r,1,
1494,Ains que paſſe le mois,217,l-181r-1-19,181r,1,
1495,Fu le cheval redois,217,l-181r-1-20,181r,1,
1496,Chetif et mal mene,217,l-181r-1-21,181r,1,
1497,av fieus poꝛter fu mis,217,l-181r-1-22,181r,1,
1498,Deſcharne et chetis,217,l-181r-1-23,181r,1,
1499,Et poi[n]t ne fu ame,217,l-181r-1-24,181r,1,
1500,L'aſne ſi l'a veü,218,l-181r-1-25,181r,1,
1501,Qui bien l'a congneu,218,l-181r-1-26,181r,1,
1502,Pris l'a a rampoſner,218,l-181r-1-27,181r,1,
1503,Ou ſont oꝛ vos loꝛains,218,l-181r-1-28,181r,1,
1504,Vos ſeles et vos frains,218,l-181r-1-29,181r,1,
1505,Que ſoliez poꝛter,218,l-181r-1-30,181r,1,
1506,Bien poꝛroie oꝛe aler,219,l-181r-1-31,181r,1,
1507,Delez vous et paſſer,219,l-181r-1-32,181r,1,
1508,Venus eſtes au bas.,219,l-181r-1-33,181r,1,
1509,Pris avez mon meſtier,219,l-181r-1-34,181r,1,
1510,Dont je me ſoy aidier,219,l-181r-1-35,181r,1,
1511,Si devez dire hé las,219,l-181r-1-36,181r,1,
1512,Oꝛgueil ne vault nëant,220,l-181r-1-37,181r,1,
1513,Ce n'eſt c'un po de vant,220,l-181r-1-38,181r,1,
1514,Qui toſt eſt cheus jus,220,l-181r-1-39,181r,1,
1515,Le roy de majesté,220,l-181r-1-40,181r,1,
1516,Eſſance humilité,220,l-181r-1-41,181r,1,
1517,Qui tout voit de laſſus,220,l-181r-1-42,181r,1,
1518,Lez une grant fontaine,221,l-181r-1-43,181r,1,
1519,Sus gravier clere et ſainne,221,l-181r-1-44,181r,1,
1520,S'eſt .i. cerf arreſte,221,l-181r-1-45,181r,1,
1521,En l'yaue ſe mira,221,l-181r-2-1,181r,2,
1522,Ses coꝛnes eſgarda,221,l-181r-2-2,181r,2,
1523,Ou moult ot de biauté,221,l-181r-2-3,181r,2,
1524,Tant li plurent foꝛment,222,l-181r-2-4,181r,2,
1525,Qu'il ne pꝛiſoit noient,222,l-181r-2-5,181r,2,
1526,Membꝛe que il eüſt,222,l-181r-2-6,181r,2,
1527,Mais domage li firent,222,l-181r-2-7,181r,2,
1528,Car a la moꝛt le mirent,222,l-181r-2-8,181r,2,
1529,Ains que .v. ans eüſt.,222,l-181r-2-9,181r,2,
1530,Les jambes a veues,223,l-181r-2-10,181r,2,
1531,Grelles loialment oſſues,223,l-181r-2-11,181r,2,
1532,Si les pꝛiſt a blanmer,223,l-181r-2-12,181r,2,
1533,Mon foꝛps fait il eſt grant,223,l-181r-2-13,181r,2,
1534,Et charneus et peſant,223,l-181r-2-14,181r,2,
1535,Si n'es poꝛront poꝛter,223,l-181r-2-15,181r,2,
1536,Les veneurs les virent,224,l-181r-2-16,181r,2,
1537,Qui foꝛment l'aſſaillirent,224,l-181r-2-17,181r,2,
1538,Et il pꝛiſt a fouir,224,l-181r-2-18,181r,2,
1539,Plus toſt c'un olifant,224,l-181r-2-19,181r,2,
1540,Il n'eſt deſtrier courant,224,l-181r-2-20,181r,2,
1541,Qui le poiſt conſuiure,224,l-181r-2-21,181r,2,
1542,En .i. bois eſt entre,225,l-181r-2-22,181r,2,
1543,Mal l'en eſt encontre,225,l-181r-2-23,181r,2,
1544,Si vous dirai comment,225,l-181r-2-24,181r,2,
1545,Ses coꝛnes l'arreſterent,225,l-181r-2-25,181r,2,
1546,Aus bꝛanches ou hurterent,225,l-181r-2-26,181r,2,
1547,Si le pꝛiſtrent la gent,225,l-181r-2-27,181r,2,
1548,Les jambes deſpꝛiſoit,226,l-181r-2-28,181r,2,
1549,Et petit les amoit,226,l-181r-2-29,181r,2,
1550,Dont bien eüſt confoꝛt,226,l-181r-2-30,181r,2,
1551,Ses coꝛnes trop amoit,226,l-181r-2-31,181r,2,
1552,Et iooit et pꝛiſoit,226,l-181r-2-32,181r,2,
1553,Poꝛ ce ot il la moꝛt,226,l-181r-2-33,181r,2,
1554,Une maniere avon,227,l-181r-2-34,181r,2,
1555,Que loons et amon,227,l-181r-2-35,181r,2,
1556,Souvent nostre domage,227,l-181r-2-36,181r,2,
1557,Et nostre pꝛeu heon,227,l-181r-2-37,181r,2,
1558,De ce grant toꝛt avon.,227,l-181r-2-38,181r,2,
1559,Eſpꝛouuon ce langage,227,l-181v-1-1,181v,1,
1560,Les veneurs chacoient,228,l-181v-1-2,181v,1,
1561,Aus chiens que il avoient,228,l-181v-1-3,181v,1,
1562,Les lieures par les champs,228,l-181v-1-4,181v,1,
1563,Les lieures ſi fouirent,228,l-181v-1-5,181v,1,
1564,Devant les chiens qu'il virent,228,l-181v-1-6,181v,1,
1565,Tous de paoꝛ tramblans,228,l-181v-1-7,181v,1,
1566,Un flueue ont aviſé,229,l-181v-1-8,181v,1,
1567,Si ſe ſont aviſé,229,l-181v-1-9,181v,1,
1568,Que noier ſi yront,229,l-181v-1-10,181v,1,
1569,Si ne les aront mie,229,l-181v-1-11,181v,1,
1570,Les chiens faus plains d'envie,229,l-181v-1-12,181v,1,
1571,Ne ja n'en mengeront,229,l-181v-1-13,181v,1,
1572,Quant pres du flueue vindꝛent,230,l-181v-1-14,181v,1,
1573,Et les rainnes oyrent,230,l-181v-1-15,181v,1,
1574,Q ſus la riue eſtoient,230,l-181v-1-16,181v,1,
1575,En l'yaue ſont ſaillies,230,l-181v-1-17,181v,1,
1576,Mais ne ſont pas noies,230,l-181v-1-18,181v,1,
1577,Que bien noer ſavoient.,230,l-181v-1-19,181v,1,
1578,Un des lieures les vit,231,l-181v-1-20,181v,1,
1579,A ſes compaignons dit,231,l-181v-1-21,181v,1,
1580,Ne nous occions mie,231,l-181v-1-22,181v,1,
1581,Comme ces beſtes cy,231,l-181v-1-23,181v,1,
1582,Qui mais n'aront merci,231,l-181v-1-24,181v,1,
1583,Car perdue ont leur vie,231,l-181v-1-25,181v,1,
1584,Plus foꝛt de vous cremon,232,l-181v-1-26,181v,1,
1585,Et c'eſt dꝛois et raiſon,232,l-181v-1-27,181v,1,
1586,Auſſi ſomes doutez,232,l-181v-1-28,181v,1,
1587,De plus foibles de nous,232,l-181v-1-29,181v,1,
1588,Si ne leur volons nous,232,l-181v-1-30,181v,1,
1589,Ne mal n'aduerſitez,232,l-181v-1-31,181v,1,
1590,Oꝛ treſtous retoꝛnon,233,l-181v-1-32,181v,1,
1591,Ja .i. ſeul ne verron,233,l-181v-1-33,181v,1,
1592,De cele gent dernee,233,l-181v-1-34,181v,1,
1593,Encoꝛ poꝛron avoir,233,l-181v-1-35,181v,1,
1594,Ce me dit mon eſpoir,233,l-181v-1-36,181v,1,
1595,Mainte bone joꝛnee,233,l-181v-1-37,181v,1,
1596,Apres le temps pluie,234,l-181v-1-38,181v,1,
1597,Et let et ennui,234,l-181v-1-39,181v,1,
1598,Vient le bel ce ſavez,234,l-181v-1-40,181v,1,
1599,Apres les grans coꝛrous,234,l-181v-2-1,181v,2,
1600,Et les duelz et les plours,234,l-181v-2-2,181v,2,
1601,Rauron joies aſſez,234,l-181v-2-3,181v,2,
1602,L'en ſe doit confoꝛter,235,l-181v-2-4,181v,2,
1603,Et nient deſconfoꝛter,235,l-181v-2-5,181v,2,
1604,Poꝛ choſe qui aviengne,235,l-181v-2-6,181v,2,
1605,Chaſcuns ſe doit pener,235,l-181v-2-7,181v,2,
1606,Du mal entr'oublier,235,l-181v-2-8,181v,2,
1607,Et que bien ſe maintiegne,235,l-181v-2-9,181v,2,
1608,Un chaſtel grant et bel,236,l-181v-2-10,181v,2,
1609,Fu fonde de nouvel,236,l-181v-2-11,181v,2,
1610,En une grant valee,236,l-181v-2-12,181v,2,
1611,Lez une grant montaingne,236,l-181v-2-13,181v,2,
1612,Haute et moult griffaigne,236,l-181v-2-14,181v,2,
1613,Dont ſouvent neſt fumee.,236,l-181v-2-15,181v,2,
1614,Ceulz du chaſtel oyrent,237,l-181v-2-16,181v,2,
1615,Dont foꝛment ſ'eſbahirent,237,l-181v-2-17,181v,2,
1616,La montaingne uller,237,l-181v-2-18,181v,2,
1617,Et hault crier et bꝛaire,237,l-181v-2-19,181v,2,
1618,Auſſi com fuſt tonnairre,237,l-181v-2-20,181v,2,
1619,Et treſtoute croller,237,l-181v-2-21,181v,2,
1620,De grant paour tramblerent,238,l-181v-2-22,181v,2,
1621,car l'eure ne garderent,238,l-181v-2-23,181v,2,
1622,Que le mont tourmentaſt,238,l-181v-2-24,181v,2,
1623,Sus eulz et ſus la ville,238,l-181v-2-25,181v,2,
1624,Ou de gent ot bien mile,238,l-181v-2-26,181v,2,
1625,Dont ja .i. n'eſchapaſt,238,l-181v-2-27,181v,2,
1626,Quant ce temps fu paſſe,239,l-181v-2-28,181v,2,
1627,Si ſe ſont apenſe,239,l-181v-2-29,181v,2,
1628,Que eulz vëoir yront,239,l-181v-2-30,181v,2,
1629,Qu'a on en la montaigne,239,l-181v-2-31,181v,2,
1630,De coi choſe ſe ſaigne,239,l-181v-2-32,181v,2,
1631,Et que tout en chairont,239,l-181v-2-33,181v,2,
1632,Un moqueur ſi vit,240,l-181v-2-34,181v,2,
1633,Une ſoꝛis ſi dit,240,l-181v-2-35,181v,2,
1634,Bien ſai que c'a eſté,240,l-181v-2-36,181v,2,
1635,La montaigne eſtoit pꝛains,240,l-181v-2-37,181v,2,
1636,Si a gete grans plains,240,l-181v-2-38,181v,2,
1637,Et puis a enfante.,240,l-181v-2-39,181v,2,
1638,Une laſſe ſoꝛis,241,l-182r-1-1,182r,1,
1639,En queurt par ce larris,241,l-182r-1-2,182r,1,
1640,Bien la poez vëoir,241,l-182r-1-3,182r,1,
1641,Poꝛ petit d'achoiſon,241,l-182r-1-4,182r,1,
1642,A moult grande tencon,241,l-182r-1-5,182r,1,
1643,Bien ſe doit a pooir,241,l-182r-1-6,182r,1,
1644,Chaſcun commence a dꝛe,242,l-182r-1-7,182r,1,
1645,Et affermer et dire,242,l-182r-1-8,182r,1,
1646,C'onques mais tel paoꝛ,242,l-182r-1-9,182r,1,
1647,N'oꝛent joꝛ qu'il veſquiſt,242,l-182r-1-10,182r,1,
1648,Poꝛ choſe qu'il veïſt,242,l-182r-1-11,182r,1,
1649,Ne par nuit ne par joꝛ.,242,l-182r-1-12,182r,1,
1650,Tel menace moult foꝛt,243,l-182r-1-13,182r,1,
1651,De mehaing ou de moꝛt,243,l-182r-1-14,182r,1,
1652,Qui petit pueent faire,243,l-182r-1-15,182r,1,
1653,Qui bien les connoiſtroit,243,l-182r-1-16,182r,1,
1654,Leurs moes ne craindꝛont,243,l-182r-1-17,182r,1,
1655,Une poꝛrie poire,243,l-182r-1-18,182r,1,
1656,Un taon ſi ſ'aſſiſt.,244,l-182r-1-19,182r,1,
1657,Sus .i. Mulet qu'il vit,244,l-182r-1-20,182r,1,
1658,Aler par mi la voie,244,l-182r-1-21,182r,1,
1659,Qui moult chargie eſtoit,244,l-182r-1-22,182r,1,
1660,D'un grant fais qu'il poꝛtoit,244,l-182r-1-23,182r,1,
1661,Ou de cyre ou de ſoye,244,l-182r-1-24,182r,1,
1662,Quant vi[n]t a la veſpꝛer,245,l-182r-1-25,182r,1,
1663,Si ſe pꝛiſt a penſer,245,l-182r-1-26,182r,1,
1664,Le taon et a dire,245,l-182r-1-27,182r,1,
1665,Ahy ſire mules,245,l-182r-1-28,182r,1,
1666,Vous poꝛtez trop grant fez,245,l-182r-1-29,182r,1,
1667,Je ne vous veil plus nuire,245,l-182r-1-30,182r,1,
1668,[I]l eſt volez arriere,246,l-182r-1-31,182r,1,
1669,Oꝛ eſtes plus legiere,246,l-182r-1-32,182r,1,
1670,Fait il ſire mulet,246,l-182r-1-33,182r,1,
1671,Poꝛte m'as longuement,246,l-182r-1-34,182r,1,
1672,Je t'ai moult malement,246,l-182r-1-35,182r,1,
1673,Greue et trop meffait,246,l-182r-1-36,182r,1,
1674,Le mulet li reſpont,247,l-182r-1-37,182r,1,
1675,Tu ne poiſes pas mont,247,l-182r-1-38,182r,1,
1676,Gueres ne m'as greue,247,l-182r-1-39,182r,1,
1677,Mon fais poiſe autretant,247,l-182r-1-40,182r,1,
1678,Com il faiſoit devant,247,l-182r-1-41,182r,1,
1679,Que tu fuſſes leue.,247,l-182r-1-42,182r,1,
1680,Avcun cuident crever,248,l-182r-2-1,182r,2,
1681,Plus foꝛt d'eulz ou tuer,248,l-182r-2-2,182r,2,
1682,Mais ment ne leur meſfont,248,l-182r-2-3,182r,2,
1683,Car gens de grant pooir,248,l-182r-2-4,182r,2,
1684,Et plains de grant avoir,248,l-182r-2-5,182r,2,
1685,De po grevez ne ſont,248,l-182r-2-6,182r,2,
1686,Mes membꝛes rampoſnerent,249,l-182r-2-7,182r,2,
1687,Le ventre et ſe tennerent,249,l-182r-2-8,182r,2,
1688,Que il li ont tant fait,249,l-182r-2-9,182r,2,
1689,Jamais ne le peſtront,249,l-182r-2-10,182r,2,
1690,Ne bien ne li feront,249,l-182r-2-11,182r,2,
1691,Ainſi ſe ſont retrait,249,l-182r-2-12,182r,2,
1692,Pourquoi avona griement,250,l-182r-2-13,182r,2,
1693,Painne et trauaillement,250,l-182r-2-14,182r,2,
1694,Ce li ont dit les membꝛes,250,l-182r-2-15,182r,2,
1695,[.]III. fois au mains le joꝛ,250,l-182r-2-16,182r,2,
1696,Te peſſent a ſejoꝛ,250,l-182r-2-17,182r,2,
1697,Bien en que tu te membꝛes,250,l-182r-2-18,182r,2,
1698,Nous te ſeruons nous te poꝛtons,251,l-182r-2-19,182r,2,
1699,Nous te veons nous te loons,251,l-182r-2-20,182r,2,
1700,Et te faiſons baignier,251,l-182r-2-21,182r,2,
1701,Nous te querons char et poiſſon,251,l-182r-2-22,182r,2,
1702,Connins perdꝛis volille oiſon,251,l-182r-2-23,182r,2,
1703,Et ſi eſt tout poꝛ ton mengier,251,l-182r-2-24,182r,2,
1704,Tel demaine tourment,252,l-182r-2-25,182r,2,
1705,Entre la bone gent,252,l-182r-2-26,182r,2,
1706,Qui puis avra aſſez,252,l-182r-2-27,182r,2,
1707,Comme ſeigneur et meſtre,252,l-182r-2-28,182r,2,
1708,De toi tenir et peſtre,252,l-182r-2-29,182r,2,
1709,Nous ſommes moult penez,252,l-182r-2-30,182r,2,
1710,Tu ne fais riens poꝛ nous,253,l-182r-2-31,182r,2,
1711,Et nous nous ſomes tous,253,l-182r-2-32,182r,2,
1712,Poꝛ toy mis a la moꝛt,253,l-182r-2-33,182r,2,
1713,Oꝛ ai ce que poꝛras,253,l-182r-2-34,182r,2,
1714,Jamais ne nous n'avras,253,l-182r-2-35,182r,2,
1715,Ayde ne confoꝛt,253,l-182r-2-36,182r,2,
1716,Le ventre leur reſpont,254,l-182r-2-37,182r,2,
1717,Qu'il ne ſceuent qu'il font,254,l-182r-2-38,182r,2,
1718,Qui ſi le contralient,254,l-182r-2-39,182r,2,
1719,Ne ſui pas vo ſeignoꝛ,254,l-182r-2-40,182r,2,
1720,Ains vous ſerf nuit et joꝛ.,254,l-182r-2-41,182r,2,
1721,Et pes quelque nulz dient,254,l-182v-1-1,182v,1,
1722,De tout ce que menius,255,l-182v-1-2,182v,1,
1723,Je vous envoie le jus,255,l-182v-1-3,182v,1,
1724,A chaſcun ſa partie,255,l-182v-1-4,182v,1,
1725,Dont vous eſtes noꝛris,255,l-182v-1-5,182v,1,
1726,Et levez et furnis,255,l-182v-1-6,182v,1,
1727,Et ſouſtenous en vie,255,l-182v-1-7,182v,1,
1728,Les membꝛes ont deſpit,256,l-182v-1-8,182v,1,
1729,De ce que il leur dit,256,l-182v-1-9,182v,1,
1730,Et ſont tous d'un acoꝛt,256,l-182v-1-10,182v,1,
1731,Que jamais a nul joꝛ,256,l-182v-1-11,182v,1,
1732,A li n'arons amoꝛ,256,l-182v-1-12,182v,1,
1733,Et qu'il n'ont mie toꝛt,256,l-182v-1-13,182v,1,
1734,Grant piece ſe ceſſerent,257,l-182v-1-14,182v,1,
1735,Qu'encoꝛ n'ameniſtrerent,257,l-182v-1-15,182v,1,
1736,Que il peüſt mengier,257,l-182v-1-16,182v,1,
1737,Foibles furent foꝛment,257,l-182v-1-17,182v,1,
1738,Car ſans ſouſtenement,257,l-182v-1-18,182v,1,
1739,Ne ſe poꝛent aidier.,257,l-182v-1-19,182v,1,
1740,Aperceus ſe ſont,258,l-182v-1-20,182v,1,
1741,Que grant folie font,258,l-182v-1-21,182v,1,
1742,Et de ce me recoꝛt,258,l-182v-1-22,182v,1,
1743,Des oꝛ mais aideront,258,l-182v-1-23,182v,1,
1744,Au coꝛps et le peſtront,258,l-182v-1-24,182v,1,
1745,Et ſeront d'un acoꝛt,258,l-182v-1-25,182v,1,
1746,Il eſt aſſez de tez,259,l-182v-1-26,182v,1,
1747,A qui l'en fait bontez,259,l-182v-1-27,182v,1,
1748,Et plus et folement,259,l-182v-1-28,182v,1,
1749,Qui ja gré n'en ſaront,259,l-182v-1-29,182v,1,
1750,Ne ſamblant n'en feront,259,l-182v-1-30,182v,1,
1751,Iel vous di loiaument,259,l-182v-1-31,182v,1,
1752,Dont il ont povreté,260,l-182v-1-32,182v,1,
1753,Et ſouffrete et late,260,l-182v-1-33,182v,1,
1754,Veu ay l'eſamplaire,260,l-182v-1-34,182v,1,
1755,Qui ſont obeiſſans,260,l-182v-1-35,182v,1,
1756,Et humbles et ſeruans.,260,l-182v-1-36,182v,1,
1757,De quanqu'il pueent faire,260,l-182v-1-37,182v,1,
1758,Un leu vit en ſa voie,261,l-182v-1-38,182v,1,
1759,Un grant chien qu'abaioit,261,l-182v-1-39,182v,1,
1760,Gras et roſne et gros,261,l-182v-1-40,182v,1,
1761,.I. po a toy parlaſſe,261,l-182v-1-41,182v,1,
1762,Dit le chien ſe j'oſaſſe.,261,l-182v-1-42,182v,1,
1763,Mais toſt m'aroies moꝛt,261,l-182v-2-1,182v,2,
1764,La mal ne te feray,262,l-182v-2-2,182v,2,
1765,Dit le chien par ma foy,262,l-182v-2-3,182v,2,
1766,Di ce que tu voudꝛas,262,l-182v-2-4,182v,2,
1767,Trop volentiers ſceuſſe,262,l-182v-2-5,182v,2,
1768,Dit le leu ſe peuſe,262,l-182v-2-6,182v,2,
1769,Comme tu es ſi gras,262,l-182v-2-7,182v,2,
1770,J'ai aſſez a mengier,263,l-182v-2-8,182v,2,
1771,Comme je ay meſtier,263,l-182v-2-9,182v,2,
1772,Ne je n'ay fain ne ſoy,263,l-182v-2-10,182v,2,
1773,Et ſi ne fais nëant,263,l-182v-2-11,182v,2,
1774,Foꝛs qu'abaie foꝛment,263,l-182v-2-12,182v,2,
1775,Tous ceus que par nuit oÿ,263,l-182v-2-13,182v,2,
1776,Tu as entour ton col,264,l-182v-2-14,182v,2,
1777,Qui eſt et gras et mol,264,l-182v-2-15,182v,2,
1778,De cuir .i. grant loyen,264,l-182v-2-16,182v,2,
1779,Di moy que ſenefie,264,l-182v-2-17,182v,2,
1780,Eſt ce par moquerie,264,l-182v-2-18,182v,2,
1781,Je li vi des antan,264,l-182v-2-19,182v,2,
1782,L'en me lye par jour,265,l-182v-2-20,182v,2,
1783,Et met en .i. deſtour,265,l-182v-2-21,182v,2,
1784,Dit le chien biaus amis,265,l-182v-2-22,182v,2,
1785,Que n'aie congnoiſſance,265,l-182v-2-23,182v,2,
1786,N'ayde n'aliance,265,l-182v-2-24,182v,2,
1787,A nul de ce pays,265,l-182v-2-25,182v,2,
1788,Miex vouldꝛoie moꝛir,266,l-182v-2-26,182v,2,
1789,Que pour mon ventre emplir,266,l-182v-2-27,182v,2,
1790,Fuſſe lie par jour,266,l-182v-2-28,182v,2,
1791,J'ai petit a mengier,266,l-182v-2-29,182v,2,
1792,Mais hoꝛs ſui de dangier,266,l-182v-2-30,182v,2,
1793,De meſtre et de ſeigneur,266,l-182v-2-31,182v,2,
1794,Qui ſe jut en ſervage,267,l-182v-2-32,182v,2,
1795,Foꝛt et grief et hontage,267,l-182v-2-33,182v,2,
1796,Poꝛ ſon ventre engreſſier,267,l-182v-2-34,182v,2,
1797,Il n'eſt mie aſſez ſage,267,l-182v-2-35,182v,2,
1798,Qui ſe tient ſon aage,267,l-182v-2-36,182v,2,
1799,En las poꝛ ſon mengier,267,l-182v-2-37,182v,2,
1800,Un lyon ſe giſoit,268,l-182v-2-38,182v,2,
1801,En .i. bois et doꝛmoit,268,l-182v-2-39,182v,2,
1802,Deſſous .i. abꝛiſſel,268,l-182v-2-40,182v,2,
1803,Et une ſoꝛiſſele,268,l-182v-2-41,182v,2,
1804,Si l'aſſault et trepelle,268,l-182v-2-42,182v,2,
1805,Et mainne grant revel,268,l-183r-1-1,183r,1,
1806,Le lyon l'engoula,269,l-183r-1-2,183r,1,
1807,Mais pas ne l'auala,269,l-183r-1-3,183r,1,
1808,Ains l'encloſt en ſa gueule,269,l-183r-1-4,183r,1,
1809,La ſoꝛis li requil,269,l-183r-1-5,183r,1,
1810,Que il ne l'occeiſt,269,l-183r-1-6,183r,1,
1811,Ainſi n'en ſi po d'eure,269,l-183r-1-7,183r,1,
1812,Ainſiques li fera,270,l-183r-1-8,183r,1,
1813,En .i. temps qui vendꝛa,270,l-183r-1-9,183r,1,
1814,Et ſeuice et bonté,270,l-183r-1-10,183r,1,
1815,Le lyon ſi ſ'en rit,270,l-183r-1-11,183r,1,
1816,Qui le pꝛiſe petit,270,l-183r-1-12,183r,1,
1817,Et tient en grant vilté,270,l-183r-1-13,183r,1,
1818,Va la ou tu vaudꝛas,271,l-183r-1-14,183r,1,
1819,Plus mal par moy n'aras,271,l-183r-1-15,183r,1,
1820,Ce reſpont le lyon,271,l-183r-1-16,183r,1,
1821,Ja ne me greueras,271,l-183r-1-17,183r,1,
1822,Ne bonté ne feras,271,l-183r-1-18,183r,1,
1823,Ne te pꝛiſe .i. bouton,271,l-183r-1-19,183r,1,
1824,Le lyon ſi fu pꝛis,272,l-183r-1-20,183r,1,
1825,A .i. ſeul las coulis,272,l-183r-1-21,183r,1,
1826,Ains qu'il paſſaſt le mois,272,l-183r-1-22,183r,1,
1827,Dont jamais n'eſchapaſt,272,l-183r-1-23,183r,1,
1828,Car quant plus foꝛt tiraſt,272,l-183r-1-24,183r,1,
1829,Et tant fuſt plus deſtrois,272,l-183r-1-25,183r,1,
1830,Quant ne ſot plus que faire,273,l-183r-1-26,183r,1,
1831,En hault commence a bꝛaire,273,l-183r-1-27,183r,1,
1832,Si l'oÿ la ſoꝛis,273,l-183r-1-28,183r,1,
1833,Tantoſt y eſt venue,273,l-183r-1-29,183r,1,
1834,Au lacon eſt coꝛue,273,l-183r-1-30,183r,1,
1835,Si y a ſes dens mis,273,l-183r-1-31,183r,1,
1836,Aſſez toſt fu cope,274,l-183r-1-32,183r,1,
1837,Et cil eſt eſchape,274,l-183r-1-33,183r,1,
1838,Qui eſtoit a la moꝛt,274,l-183r-1-34,183r,1,
1839,Par ce poez ſavoir,274,l-183r-1-35,183r,1,
1840,Que grant meſtier avoir,274,l-183r-1-36,183r,1,
1841,Puet bien le foible au foꝛt,274,l-183r-1-37,183r,1,
1842,Un rouſſignol eſtoit,275,l-183r-1-38,183r,1,
1843,En .i. arbꝛe chantoit,275,l-183r-2-1,183r,2,
1844,Melodieuſement,275,l-183r-2-2,183r,2,
1845,.I. paon l'eſcoutoit,275,l-183r-2-3,183r,2,
1846,Grant duel de li avoit,275,l-183r-2-4,183r,2,
1847,Qu'il li auenoit tant,275,l-183r-2-5,183r,2,
1848,Une oc pꝛiſt a dire,276,l-183r-2-6,183r,2,
1849,Par coꝛrous et par ire,276,l-183r-2-7,183r,2,
1850,Que gré ſavoir ne doi,276,l-183r-2-8,183r,2,
1851,A celi qui le fiſt,276,l-183r-2-9,183r,2,
1852,Car po de cure y miſt,276,l-183r-2-10,183r,2,
1853,Quant miex chanter ne ſoy,276,l-183r-2-11,183r,2,
1854,Un petit oiſelet,277,l-183r-2-12,183r,2,
1855,Povre chetif et let,277,l-183r-2-13,183r,2,
1856,Chante ſi noblement,277,l-183r-2-14,183r,2,
1857,Et je ne ſai chanter,277,l-183r-2-15,183r,2,
1858,Tant m'en puiſſe pener,277,l-183r-2-16,183r,2,
1859,Foꝛs trop hideuſement,277,l-183r-2-17,183r,2,
1860,Oꝛ entent ma raiſon,278,l-183r-2-18,183r,2,
1861,Dit /juno au paon,278,l-183r-2-19,183r,2,
1862,Et ſi te reconfoꝛte,278,l-183r-2-20,183r,2,
1863,Plus t'a done nature,278,l-183r-2-21,183r,2,
1864,Qu'a nule creature,278,l-183r-2-22,183r,2,
1865,Tant ſoit foible ne foꝛte,278,l-183r-2-23,183r,2,
1866,Tu es ſi oꝛiant,279,l-183r-2-24,183r,2,
1867,Si bel et ſi plaiſant,279,l-183r-2-25,183r,2,
1868,Comme l'en puet penſer,279,l-183r-2-26,183r,2,
1869,Il n'a ſous ciel oiſel,279,l-183r-2-27,183r,2,
1870,Qui plus de toy ſoit bel,279,l-183r-2-28,183r,2,
1871,De ce te pues vanter,279,l-183r-2-29,183r,2,
1872,Quant nature te fiſt.,280,l-183r-2-30,183r,2,
1873,Moult grant entente y miſt,280,l-183r-2-31,183r,2,
1874,Et te donna biauté,280,l-183r-2-32,183r,2,
1875,Au rouſſeignol dous chant,280,l-183r-2-33,183r,2,
1876,De biauté tant ne quant,280,l-183r-2-34,183r,2,
1877,N'ai je d'autre bonte.,280,l-183r-2-35,183r,2,
1878,Le coc fait le matin,281,l-183r-2-36,183r,2,
1879,Congnoiſtre en ſon latin,281,l-183r-2-37,183r,2,
1880,Et chante hautement.,281,l-183r-2-38,183r,2,
1881,Cil aront trop a faire,281,l-183v-1-1,183v,1,
1882,Qui tout voudꝛoit retraire,281,l-183v-1-2,183v,1,
1883,De beſtes et de gent,281,l-183v-1-3,183v,1,
1884,Nature a oꝛdenees,282,l-183v-1-4,183v,1,
1885,Ses vertus et donnees,282,l-183v-1-5,183v,1,
1886,Et ſi n'a nulz le tout,282,l-183v-1-6,183v,1,
1887,Se tu veus tout avoir,282,l-183v-1-7,183v,1,
1888,Chaſcuns puet bien ſavoir,282,l-183v-1-8,183v,1,
1889,Que tu es fol et glout,282,l-183v-1-9,183v,1,
1890,Celi qui a envie,283,l-183v-1-10,183v,1,
1891,D'autrui fait grant folie,283,l-183v-1-11,183v,1,
1892,Et ſi vit a doleur,283,l-183v-1-12,183v,1,
1893,Tout doit a chaſcun plere,283,l-183v-1-13,183v,1,
1894,Que /Jhesucriſt veult faire,283,l-183v-1-14,183v,1,
1895,Qui eſt vrai createur,283,l-183v-1-15,183v,1,
1896,Les riches conteront,284,l-183v-1-16,183v,1,
1897,Des biens que il aront,284,l-183v-1-17,183v,1,
1898,En ce ſiecle poꝛquis,284,l-183v-1-18,183v,1,
1899,Coꝛps que petit ara,284,l-183v-1-19,183v,1,
1900,De petit contera,284,l-183v-1-20,183v,1,
1901,Au roy de paradis.,284,l-183v-1-21,183v,1,
1902,Qui vit en pouerte,285,l-183v-1-22,183v,1,
1903,Sans point d'iniquite,285,l-183v-1-23,183v,1,
1904,Moult ara grant richece,285,l-183v-1-24,183v,1,
1905,Es ciex en paradis,285,l-183v-1-25,183v,1,
1906,O Dieu et ſes amis,285,l-183v-1-26,183v,1,
1907,Seront joians et aaiſe,285,l-183v-1-27,183v,1,
1908,Une chieure ſ'eſtoit,286,l-183v-1-28,183v,1,
1909,Qui .i. faon avoit,286,l-183v-1-29,183v,1,
1910,Quele amoit trop foꝛment,286,l-183v-1-30,183v,1,
1911,Aus champs nel leſſe aler,286,l-183v-1-31,183v,1,
1912,Giber ne paſturer,286,l-183v-1-32,183v,1,
1913,Poꝛ le froit qu'il faiſoit,286,l-183v-1-33,183v,1,
1914,Ains l'alaite en l'eſtable,287,l-183v-1-34,183v,1,
1915,Et la peſt et li baille,287,l-183v-1-35,183v,1,
1916,Ce dont il a meſtier,287,l-183v-1-36,183v,1,
1917,Et ſ'en va peſtre as champs,287,l-183v-1-37,183v,1,
1918,Tant quele a plains ſes flans,287,l-183v-1-38,183v,1,
1919,Puis ſ'en reuient arriere,287,l-183v-1-39,183v,1,
1920,Moult ſouvent le chaſtie,288,l-183v-1-40,183v,1,
1921,Que il ne croie mie,288,l-183v-2-1,183v,2,
1922,Le leu ſ'il vait a l'uis,288,l-183v-2-2,183v,2,
1923,Mais li enferme tiegne,288,l-183v-2-3,183v,2,
1924,Qu'il ne l'en meſauiengne,288,l-183v-2-4,183v,2,
1925,Regart par .i. pertuis,288,l-183v-2-5,183v,2,
1926,Le leu ſi vient a l'us,289,l-183v-2-6,183v,2,
1927,Oꝛ ſus diſt il oꝛ ſus,289,l-183v-2-7,183v,2,
1928,Oevre l'uis a ta mere,289,l-183v-2-8,183v,2,
1929,Je t'apoꝛt a mengier,289,l-183v-2-9,183v,2,
1930,Trop miex que ne fis yer,289,l-183v-2-10,183v,2,
1931,Miex te fai que ton pere,289,l-183v-2-11,183v,2,
1932,Quant le cheurel l'oÿ,290,l-183v-2-12,183v,2,
1933,Durement ſ'eſjoy,290,l-183v-2-13,183v,2,
1934,Poꝛ avoir a mengier,290,l-183v-2-14,183v,2,
1935,Car avis li eſtoit,290,l-183v-2-15,183v,2,
1936,De la fain qu'il avoit,290,l-183v-2-16,183v,2,
1937,Qu'il deüſt erragier,290,l-183v-2-17,183v,2,
1938,A l'uis ſ'en eſt venu,291,l-183v-2-18,183v,2,
1939,Ferme l'a et tenu,291,l-183v-2-19,183v,2,
1940,Car ſa mere li diſt,291,l-183v-2-20,183v,2,
1941,Il voit par .i. pertuis,291,l-183v-2-21,183v,2,
1942,Le leu qui fu a l'uis,291,l-183v-2-22,183v,2,
1943,Si ſ'en moqua et riſt.,291,l-183v-2-23,183v,2,
1944,La dehoꝛs vous tenez,292,l-183v-2-24,183v,2,
1945,Ja ceens n'enterrez,292,l-183v-2-25,183v,2,
1946,Foy que je doi mon pere,292,l-183v-2-26,183v,2,
1947,Se vous y entriez,292,l-183v-2-27,183v,2,
1948,Vous me mengeriez,292,l-183v-2-28,183v,2,
1949,Si comme diſt ma mere,292,l-183v-2-29,183v,2,
1950,Et croire et honoꝛer,293,l-183v-2-30,183v,2,
1951,Et ſervir et amer,293,l-183v-2-31,183v,2,
1952,Du cuer entierement,293,l-183v-2-32,183v,2,
1953,Doit chaſcuns pere et mere,293,l-183v-2-33,183v,2,
1954,A bon dꝛoit le compere,293,l-183v-2-34,183v,2,
1955,Qui le fait autrement,293,l-183v-2-35,183v,2,
1956,Cilz qui ceſt romans fiſt.,294,l-184r-1-1,184r,1,
1957,Moult de ſa paine y miſt,294,l-184r-1-2,184r,1,
1958,De quoy il ſe repent,294,l-184r-1-3,184r,1,
1959,Car les folz qui l'oꝛront,294,l-184r-1-4,184r,1,
1960,Communement diront,294,l-184r-1-5,184r,1,
1961,Que il ne vault nëant,294,l-184r-1-6,184r,1,
1962,S'uns ſage hons fait l'eüſt,295,l-184r-1-7,184r,1,
1963,A chierté tenu fuſt,295,l-184r-1-8,184r,1,
1964,Et en auctoꝛite,295,l-184r-1-9,184r,1,
1965,L'en ſcet bien qui le fiſt,295,l-184r-1-10,184r,1,
1966,Poꝛ ce l'ont en deſpit,295,l-184r-1-11,184r,1,
1967,Les folz et en vilté,295,l-184r-1-12,184r,1,
1968,Un clerc de grant ſcience,296,l-184r-1-13,184r,1,
1969,Et de grant ſapience,296,l-184r-1-14,184r,1,
1970,Le fiſt pꝛemierement,296,l-184r-1-15,184r,1,
1971,Et jel mis en rommans,296,l-184r-1-16,184r,1,
1972,Poꝛ entendꝛe aus enfans,296,l-184r-1-17,184r,1,
1973,Et a la laye gent,296,l-184r-1-18,184r,1,
1974,Diex doinſt beneicon,297,l-184r-1-19,184r,1,
1975,Au clerc ou au clercon,297,l-184r-1-20,184r,1,
1976,Qui lira ceſt eſcript,297,l-184r-1-21,184r,1,
1977,Se il dit poꝛ mon pere,297,l-184r-1-22,184r,1,
