line_no,text,lg,l_id,folio,col,speaker
986,Fiſt li arbaleſtiers,133,l-177v-2-8,177v,2,
987,Il toꝛna par dela,133,l-177v-2-9,177v,2,
988,Si toſt com devala,133,l-177v-2-10,177v,2,
989,Ce reſpont le bouuier,133,l-177v-2-11,177v,2,
990,Et puis leur a gaignie,134,l-177v-2-12,177v,2,
991,La ou il ert mucie,134,l-177v-2-13,177v,2,
992,Mais pas ne l'entendirent,134,l-177v-2-14,177v,2,
993,Oultre ſ'en ſont paſſez,134,l-177v-2-15,177v,2,
994,Plus n'i ſont arreſtez,134,l-177v-2-16,177v,2,
995,N'onques puis n'y revindꝛent,134,l-177v-2-17,177v,2,
996,Sire dit le bouuier,135,l-177v-2-18,177v,2,
997,Bien poez deſbouchier,135,l-177v-2-19,177v,2,
998,Vous eſtes eſchape,135,l-177v-2-20,177v,2,
999,Se ne fuſt m'aye,135,l-177v-2-21,177v,2,
1000,Vous fuſſiez hoꝛs de vie,135,l-177v-2-22,177v,2,
1001,Et pꝛis et atrape,135,l-177v-2-23,177v,2,
1002,La langue ſoit ſauvee,136,l-177v-2-24,177v,2,
1003,Et de Dieu honoꝛee,136,l-177v-2-25,177v,2,
1004,Dit le leu biaus amis,136,l-177v-2-26,177v,2,
1005,Les ex ſoient creuez,136,l-177v-2-27,177v,2,
1006,Et tous eſbourbelez,136,l-177v-2-28,177v,2,
1007,Qu'en la teſte as aſſis,136,l-177v-2-29,177v,2,
1008,Encuſe me cuidas,137,l-177v-2-30,177v,2,
1009,Quant tu guignas en bas,137,l-177v-2-31,177v,2,
1010,Si feis meſpꝛoiſon,137,l-177v-2-32,177v,2,
1011,Autre choſe penſoies,137,l-177v-2-33,177v,2,
1012,Que tu ne leur diſoies,137,l-177v-2-34,177v,2,
1013,Si eſtoit traiſon.,137,l-177v-2-35,177v,2,
1014,Qui pꝛomet a la gent,138,l-177v-2-36,177v,2,
1015,Ou bonté ou argent,138,l-177v-2-37,177v,2,
1016,Que faire ne puet mie,138,l-177v-2-38,177v,2,
1017,Apres regaingne en bas,138,l-177v-2-39,177v,2,
1018,Que n'en nel face pas.,138,l-178r-1-1,178r,1,
1019,Li fait grant vilennie,138,l-178r-1-2,178r,1,
1020,[G]oupillez nouuiaus nez,139,l-178r-1-3,178r,1,
1021,Furent pꝛis et poꝛtez,139,l-178r-1-4,178r,1,
1022,D'un aigle a ſes faons,139,l-178r-1-5,178r,1,
1023,Penſa qu'il leur donroit,139,l-178r-1-6,178r,1,
1024,Et leur deſpeceroit,139,l-178r-1-7,178r,1,
1025,Tous par menus lardons,139,l-178r-1-8,178r,1,
1026,Le gourpill ſi requiſt,140,l-178r-1-9,178r,1,
1027,L'aigle qu'il li rendiſt,140,l-178r-1-10,178r,1,
1028,Poꝛ Dieu ſes gourpilles,140,l-178r-1-11,178r,1,
1029,Puis diſt que non feroit,140,l-178r-1-12,178r,1,
1030,Et que il en donroit,140,l-178r-1-13,178r,1,
1031,La char a ſes aiglo[n]s,140,l-178r-1-14,178r,1,
1032,Le goꝛpil fu dolant,141,l-178r-1-15,178r,1,
1033,Quant ne pot autremant,141,l-178r-1-16,178r,1,
1034,Grant feu a alume,141,l-178r-1-17,178r,1,
1035,Deſſous le ny a l'aigle,141,l-178r-1-18,178r,1,
1036,Malement l'apareille,141,l-178r-1-19,178r,1,
1037,De paour eſt paume,141,l-178r-1-20,178r,1,
1038,Les aigles baillierent,142,l-178r-1-21,178r,1,
1039,Du grant chaut qu'il ſenterent,142,l-178r-1-22,178r,1,
1040,Mais ne poꝛent foir,142,l-178r-1-23,178r,1,
1041,L'aicle ne ſcet que faire,142,l-178r-1-24,178r,1,
1042,En hault commence a bꝛaire,142,l-178r-1-25,178r,1,
1043,Et bien cuide moꝛir,142,l-178r-1-26,178r,1,
1044,Rendez rendez lairon,143,l-178r-1-27,178r,1,
1045,Ou ycy vous pendꝛon,143,l-178r-1-28,178r,1,
1046,Dit le pere au gourpil,143,l-178r-1-29,178r,1,
1047,Treſtous les te rendꝛai,143,l-178r-1-30,178r,1,
1048,Diſt l'aygle par ma fay,143,l-178r-1-31,178r,1,
1049,Si m'oſte le peril.,143,l-178r-1-32,178r,1,
1050,Le goꝛpil par ſon art,144,l-178r-1-33,178r,1,
1051,Si fiſt l'aigle couart,144,l-178r-1-34,178r,1,
1052,St li rendi ſa parte,144,l-178r-1-35,178r,1,
1053,Onques ſon biau prier,144,l-178r-1-36,178r,1,
1054,N'i pot avoir meſtier,144,l-178r-1-37,178r,1,
1055,Ne de batre ſa teſte,144,l-178r-1-38,178r,1,
1056,Par ce poez ſavoir,145,l-178r-1-39,178r,1,
1057,Que qui ne puet auoi,145,l-178r-2-1,178r,2,
1058,Le ſien puet depꝛoier,145,l-178r-2-2,178r,2,
1059,Aucun art doit penſer,145,l-178r-2-3,178r,2,
1060,Et faire et aviſer,145,l-178r-2-4,178r,2,
1061,Dont il ſe puiſt aidier,145,l-178r-2-5,178r,2,
1062,Un cheval ſi ſe vit,146,l-178r-2-6,178r,2,
1063,En .i. pꝛe ou peſſoit,146,l-178r-2-7,178r,2,
1064,A li vint .i. lyon,146,l-178r-2-8,178r,2,
1065,Et li diſt qu'il eſtoit,146,l-178r-2-9,178r,2,
1066,Bon mire et qu'il ſavoit,146,l-178r-2-10,178r,2,
1067,De tous mauls gueriſon,146,l-178r-2-11,178r,2,
1068,Sire dit le cheval,147,l-178r-2-12,178r,2,
1069,Lonc temps a que j'ai mal,147,l-178r-2-13,178r,2,
1070,En .i. des piez derriere,147,l-178r-2-14,178r,2,
1071,Se me poez guerir,147,l-178r-2-15,178r,2,
1072,Bien le vous puis merir,147,l-178r-2-16,178r,2,
1073,En aucune maniere,147,l-178r-2-17,178r,2,
1074,Frere dit le lyon,148,l-178r-2-18,178r,2,
1075,Couche toy ſi verron,148,l-178r-2-19,178r,2,
1076,Le mal apertement,148,l-178r-2-20,178r,2,
1077,Je ne me puis couchier,148,l-178r-2-21,178r,2,
1078,Ce reſpont le deſtrier,148,l-178r-2-22,178r,2,
1079,Si en ſui moult dolent,148,l-178r-2-23,178r,2,
1080,Souffrez dit le lyon,149,l-178r-2-24,178r,2,
1081,Quanque nous vous feron,149,l-178r-2-25,178r,2,
1082,Et ne regibez mie,149,l-178r-2-26,178r,2,
1083,Le cheval bien ſavoit,149,l-178r-2-27,178r,2,
1084,Que le lyon penſoit,149,l-178r-2-28,178r,2,
1085,A tolir li la vie,149,l-178r-2-29,178r,2,
1086,Baiſſiez vous ſire miere,150,l-178r-2-30,178r,2,
1087,Si verrez par derriere,150,l-178r-2-31,178r,2,
1088,Dit le cheval le mal,150,l-178r-2-32,178r,2,
1089,Bien vit que li lyons,150,l-178r-2-33,178r,2,
1090,Le voult pꝛendꝛe au talon,150,l-178r-2-34,178r,2,
1091,Oꝛ oez du cheval,150,l-178r-2-35,178r,2,
1092,De ſes .ii. piez arriere,151,l-178r-2-36,178r,2,
1093,A ſi frape le miere.,151,l-178r-2-37,178r,2,
1094,Que il l'a afronte,151,l-178r-2-38,178r,2,
1095,Mire diſt le cheval,151,l-178r-2-39,178r,2,
1096,I cuit que de ce mal.,151,l-178v-1-1,178v,1,
1097,N'avrez jamais ſanté,151,l-178v-1-2,178v,1,
1098,Folz eſtoit le lyon,152,l-178v-1-3,178v,1,
1099,Quant volt par traiſon,152,l-178v-1-4,178v,1,
1100,Decoivre le cheval,152,l-178v-1-5,178v,1,
1101,Car ſe il bien vouſſiſt,152,l-178v-1-6,178v,1,
1102,Tex .xiiii. en vainquiſt.,152,l-178v-1-7,178v,1,
1103,Et leur rendiſt eſtal.,152,l-178v-1-8,178v,1,
1104,Qui veult par traiſon,153,l-178v-1-9,178v,1,
1105,Ouurer bien eſt raiſon.,153,l-178v-1-10,178v,1,
1106,Que il en ait hontage,153,l-178v-1-11,178v,1,
1107,S'il ſe puet autrement,153,l-178v-1-12,178v,1,
1108,Deliurer de tourment,153,l-178v-1-13,178v,1,
1109,De mal et de domage,153,l-178v-1-14,178v,1,
1110,Li coulon ſi cremirent,154,l-178v-1-15,178v,1,
1111,L'oiſelierre qu'il virent,154,l-178v-1-16,178v,1,
1112,Prenant leur compaignons,154,l-178v-1-17,178v,1,
1113,Il parlerent enſamble,154,l-178v-1-18,178v,1,
1114,Ca dit l'un ce me ſamble,154,l-178v-1-19,178v,1,
1115,Comme oiſeleurs felons,154,l-178v-1-20,178v,1,
1116,Deſtruit nostre lignage,155,l-178v-1-21,178v,1,
1117,Et nous fait grant domage,155,l-178v-1-22,178v,1,
1118,Treſtous nous occira.,155,l-178v-1-23,178v,1,
1119,Se n'avona .i. garant,155,l-178v-1-24,178v,1,
1120,Sage pꝛeu et parlant,155,l-178v-1-25,178v,1,
1121,Qui nous garantira,155,l-178v-1-26,178v,1,
1122,Il ont de l'eſpeurier,156,l-178v-1-27,178v,1,
1123,Fait leur gonfanonnier,156,l-178v-1-28,178v,1,
1124,Leur juge et leur ſeigneur,156,l-178v-1-29,178v,1,
1125,Qui .i. et .i. le pꝛent,156,l-178v-1-30,178v,1,
1126,Et le va deuourant,156,l-178v-1-31,178v,1,
1127,Treſtous de joꝛ en joꝛ.,156,l-178v-1-32,178v,1,
1128,Trop mauvais juge auon,157,l-178v-1-33,178v,1,
1129,En l'eſpeurier felon,157,l-178v-1-34,178v,1,
1130,Ce dit .i. qui le vit,157,l-178v-1-35,178v,1,
1131,Ja ne nous deffendꝛa,157,l-178v-1-36,178v,1,
1132,Mais tous joꝛs mengera,157,l-178v-1-37,178v,1,
1133,Car de nos ſans ſe vit,157,l-178v-1-38,178v,1,
1134,Il nous eſt plus nuiſant,158,l-178v-2-1,178v,2,
1135,Que l'oiſeleur devant,158,l-178v-2-2,178v,2,
1136,Chaſcuns le puet vëoir,158,l-178v-2-3,178v,2,
1137,Quant juge le feiſmes,158,l-178v-2-4,178v,2,
1138,Et ſus nous le meiſmes,158,l-178v-2-5,178v,2,
1139,Ce fu par non ſavoir,158,l-178v-2-6,178v,2,
1140,Il crient plus l'oiſelier,159,l-178v-2-7,178v,2,
1141,Qui l'aloe eſpeurier,159,l-178v-2-8,178v,2,
1142,Mal nous en deffendꝛa,159,l-178v-2-9,178v,2,
1143,Quant les verra venir,159,l-178v-2-10,178v,2,
1144,Poꝛ nous pꝛendꝛe et murtrir,159,l-178v-2-11,178v,2,
1145,D'eſpeurier ſ'en fuira,159,l-178v-2-12,178v,2,
1146,A peril eſchiuer,160,l-178v-2-13,178v,2,
1147,Se doit on bien garder,160,l-178v-2-14,178v,2,
1148,De chëoir en greignour,160,l-178v-2-15,178v,2,
1149,Comme les coulons furent,160,l-178v-2-16,178v,2,
1150,Qui abandon moꝛurent,160,l-178v-2-17,178v,2,
1151,Poꝛ leur mauvais ſeigneur,160,l-178v-2-18,178v,2,
1152,Un fol cheval heoit,161,l-178v-2-19,178v,2,
1153,.I. cerf qui li avoit,161,l-178v-2-20,178v,2,
1154,Trop malement meffait,161,l-178v-2-21,178v,2,
1155,Aſſaudꝛe ne l'oſoit,161,l-178v-2-22,178v,2,
1156,Car ſes coꝛnes doutoit,161,l-178v-2-23,178v,2,
1157,Que poignantes voit,161,l-178v-2-24,178v,2,
1158,Un veneeur requiſt,162,l-178v-2-25,178v,2,
1159,Qu'aide li feïſt,162,l-178v-2-26,178v,2,
1160,Du cerf metre a la moꝛt,162,l-178v-2-27,178v,2,
1161,Et il le ſeruiroit,162,l-178v-2-28,178v,2,
1162,Tous les joꝛs qu'il viuroit,162,l-178v-2-29,178v,2,
1163,Car moult ſe ſentoit foꝛt,162,l-178v-2-30,178v,2,
1164,Le veneur l'a pꝛis,163,l-178v-2-31,178v,2,
1165,Qui tantoſt li a mis,163,l-178v-2-32,178v,2,
1166,Et le frain et la ſele,163,l-178v-2-33,178v,2,
1167,Bien eſtoit le cengla,163,l-178v-2-34,178v,2,
1168,Uns eſperons chauca,163,l-178v-2-35,178v,2,
1169,Qui oꝛent grant roelle,163,l-178v-2-36,178v,2,
1170,Sus le cheval ſailli,164,l-178v-2-37,178v,2,
1171,Et le cerf acailli,164,l-178v-2-38,178v,2,
1172,Qui moult eſtoit courant,164,l-179r-1-1,179r,1,
1173,Et par mons et par vaus,164,l-179r-1-2,179r,1,
1174,Et par plains et par gaus,164,l-179r-1-3,179r,1,
1175,L'ala foꝛment chacant,164,l-179r-1-4,179r,1,
1176,Le cerf riens ne poꝛtoit,165,l-179r-1-5,179r,1,
1177,Qui moult legier eſtoit,165,l-179r-1-6,179r,1,
1178,Poꝛ noiant le chacoient,165,l-179r-1-7,179r,1,
1179,Jamais ne le preiſſent,165,l-179r-1-8,179r,1,
1180,Poꝛ coꝛre qu'il feiſſent,165,l-179r-1-9,179r,1,
1181,Grant folie faiſoient,165,l-179r-1-10,179r,1,
1182,Le cheyal ſ'ert ſaillant,166,l-179r-1-11,179r,1,
1183,Et traveillie foꝛmant,166,l-179r-1-12,179r,1,
1184,Ce n'ert mi merveille,166,l-179r-1-13,179r,1,
1185,Grans cops le va ferant,166,l-179r-1-14,179r,1,
1186,Et derriere et devant,166,l-179r-1-15,179r,1,
1187,Et trop mal l'apareille,166,l-179r-1-16,179r,1,
1188,Le venerres felons,167,l-179r-1-17,179r,1,
1189,Si fiert des eſperons,167,l-179r-1-18,179r,1,
1190,Si que li ſans en ſault,167,l-179r-1-19,179r,1,
1191,Mais le cheval avant,167,l-179r-1-20,179r,1,
1192,Ne puet ne tant ne quant,167,l-179r-1-21,179r,1,
1193,Car le cuer ſi li fault,167,l-179r-1-22,179r,1,
1194,Il a l'omme requis,168,l-179r-1-23,179r,1,
1195,Qui ſus li eſt aſſis,168,l-179r-1-24,179r,1,
1196,Que il ſe ſueffre atant,168,l-179r-1-25,179r,1,
1197,Et qu'il le lait aler,168,l-179r-1-26,179r,1,
1198,Par les champs paſturer,168,l-179r-1-27,179r,1,
1199,Comme il faiſoit devant,168,l-179r-1-28,179r,1,
1200,Aler ne te lairai,169,l-179r-1-29,179r,1,
1201,Diſt li hons par ma fay,169,l-179r-1-30,179r,1,
1202,Car a moy t'ez ſouſmis,169,l-179r-1-31,179r,1,
1203,Mais tant com tu vivras,169,l-179r-1-32,179r,1,
1204,Tous joꝛs me ſeruiras.,169,l-179r-1-33,179r,1,
1205,De gré ou a enuis,169,l-179r-1-34,179r,1,
1206,Le cerf ſ'out onques mal,170,l-179r-1-35,179r,1,
1207,Mais moꝛt fu le cheval,170,l-179r-1-36,179r,1,
1208,Par ſi grant felonnie,170,l-179r-1-37,179r,1,
1209,Qui tuer le cuidoit,170,l-179r-1-38,179r,1,
1210,Poꝛ ce que il avoit,170,l-179r-2-1,179r,2,
1211,Le veneur en aye,170,l-179r-2-2,179r,2,
1212,Par qui fu derompu,171,l-179r-2-3,179r,2,
1213,A moꝛt et confundu,171,l-179r-2-4,179r,2,
1214,Si comm oÿ avez,171,l-179r-2-5,179r,2,
1215,Par ſon outrecuidance,171,l-179r-2-6,179r,2,
1216,Fu il mis a outrance,171,l-179r-2-7,179r,2,
1217,Et a la moꝛt alez,171,l-179r-2-8,179r,2,
1218,L'en a ſouvent fiance,172,l-179r-2-9,179r,2,
1219,En tel dont grant nuiſance,172,l-179r-2-10,179r,2,
1220,Vient puis bien le ſavez,172,l-179r-2-11,179r,2,
1221,Poꝛ ce ſe fait trop mal,172,l-179r-2-12,179r,2,
1222,Qui ſe ſouſmet a mal,172,l-179r-2-13,179r,2,
1223,Poꝛ faire autrui grietez,172,l-179r-2-14,179r,2,
1224,Il avient moult ſouvent,173,l-179r-2-15,179r,2,
1225,Que l'en veult grant toꝛment,173,l-179r-2-16,179r,2,
1226,Faire a ſon contraire,173,l-179r-2-17,179r,2,
1227,L'en ſe met a la moꝛt,173,l-179r-2-18,179r,2,
1228,Ou en grant deſconfoꝛt,173,l-179r-2-19,179r,2,
1229,Bien l'e oÿ retraire,173,l-179r-2-20,179r,2,
1230,Un coꝛbel ſi eſtoit,174,l-179r-2-21,179r,2,
1231,En .i. arbꝛe et menioit,174,l-179r-2-22,179r,2,
1232,.I. petit de fromage,174,l-179r-2-23,179r,2,
1233,Renart l'a aviſé,174,l-179r-2-24,179r,2,
1234,Qui toſt fu aviſé,174,l-179r-2-25,179r,2,
1235,De faire li domage,174,l-179r-2-26,179r,2,
1236,Diſt renart par ma foy,175,l-179r-2-27,179r,2,
1237,En tout le mont ne ſoy,175,l-179r-2-28,179r,2,
1238,Nule ſi bele beſte,175,l-179r-2-29,179r,2,
1239,Comme vous dant coꝛbel,175,l-179r-2-30,179r,2,
1240,Car fuſſent auſſi bel,175,l-179r-2-31,179r,2,
1241,Et de coꝛps et de teſte,175,l-179r-2-32,179r,2,
1242,Il n'eſt oiſel volans,176,l-179r-2-33,179r,2,
1243,Plus de vous ſoit plaiſant,176,l-179r-2-34,179r,2,
1244,Qui vous verroit eſtendꝛe,176,l-179r-2-35,179r,2,
1245,Trop groſſe vois avez,176,l-179r-2-36,179r,2,
1246,Quant vous chanter volez,176,l-179r-2-37,179r,2,
1247,Plus n'y a que repꝛendꝛe.,176,l-179r-2-38,179r,2,
1248,Le coꝛbel l'a oÿ,176,l-179v-1-1,179v,1,
1249,Moult ſ'en eſt eſjoy,176,l-179v-1-2,179v,1,
1250,Si ſ'eſt dont effoꝛcie,176,l-179v-1-3,179v,1,
1251,De cler chanter et hault,176,l-179v-1-4,179v,1,
1252,Car lie eſtoit et baut,176,l-179v-1-5,179v,1,
1253,Contre mont ſ'eſt dꝛecie,176,l-179v-1-6,179v,1,
1254,Si com ſon bec ouvri,177,l-179v-1-7,179v,1,
1255,Poꝛ eſclarcir ſon cri,177,l-179v-1-8,179v,1,
1256,Li chay le fromage,177,l-179v-1-9,179v,1,
1257,Renart deſſous eſtoit,177,l-179v-1-10,179v,1,
1258,Qui riens plus n'atendoit,177,l-179v-1-11,179v,1,
1259,Si le pꝛiſt comme ſage,177,l-179v-1-12,179v,1,
1260,Le coꝛbel ſ'eſt moquie,178,l-179v-1-13,179v,1,
1261,Qu'il avoit engignie,178,l-179v-1-14,179v,1,
1262,Si diſt en ſon langage,178,l-179v-1-15,179v,1,
1263,Par foy ſire coꝛbel,178,l-179v-1-16,179v,1,
1264,Vous chantez oꝛ moult bel,178,l-179v-1-17,179v,1,
1265,Se n'avez le fromage,178,l-179v-1-18,179v,1,
1266,Qui croit quanque il ot,179,l-179v-1-19,179v,1,
1267,Il eſt muſart et ſot,179,l-179v-1-20,179v,1,
1268,Il eſt ſouvent dolant,179,l-179v-1-21,179v,1,
1269,Trop eſt de mencongiers,179,l-179v-1-22,179v,1,
1270,Et de faus loſengiers,179,l-179v-1-23,179v,1,
1271,Poꝛ decoivre la gent,179,l-179v-1-24,179v,1,
1272,Une chieure pꝛenant,180,l-179v-1-25,179v,1,
1273,Vit une autre geſant,180,l-179v-1-26,179v,1,
1274,Son lit li a requis,180,l-179v-1-27,179v,1,
1275,oꝛ Dieu qu'il li preſtaſt,180,l-179v-1-28,179v,1,
1276,Tant qu'il les chaaillaſt,180,l-179v-1-29,179v,1,
1277,Ses chaaillos petis,180,l-179v-1-30,179v,1,
1278,Cele en ot grant pitié,181,l-179v-1-31,179v,1,
1279,Son lit li a leſſie,181,l-179v-1-32,179v,1,
1280,Et cele y faonna,181,l-179v-1-33,179v,1,
1281,Et quant elle requiſt,181,l-179v-1-34,179v,1,
1282,Que ſon lit li rendiſt,181,l-179v-1-35,179v,1,
1283,Cele le rampoſna,181,l-179v-1-36,179v,1,
1284,Po d'amoꝛ m'avez fet,182,l-179v-1-37,179v,1,
1285,Encoꝛ nului ne vet,182,l-179v-1-38,179v,1,
1286,De mes petis faons,182,l-179v-2-1,179v,2,
1287,Oꝛ m'en volez chacier,182,l-179v-2-2,179v,2,
1288,Certes po m'avez cher,182,l-179v-2-3,179v,2,
1289,Le ſejoꝛ n'eſt pas lons,182,l-179v-2-4,179v,2,
1290,Quant je le vous preſtay,183,l-179v-2-5,179v,2,
1291,Diſt l'autre par ma fay,183,l-179v-2-6,179v,2,
1292,Ce ne fu qu'a une heure,183,l-179v-2-7,179v,2,
1293,Oꝛ y avez eſté,183,l-179v-2-8,179v,2,
1294,[.]IIII. lons joꝛs d'eſté,183,l-179v-2-9,179v,2,
1295,N'eſt ce pas grant domage,183,l-179v-2-10,179v,2,
1296,Puis que je n'en ay grez,184,l-179v-2-11,179v,2,
1297,Plus n'y demoꝛerez,184,l-179v-2-12,179v,2,
1298,Par la foy que vous doy,184,l-179v-2-13,179v,2,
1299,Oꝛ toſt voidiez mon lit,184,l-179v-2-14,179v,2,
1300,Vous n'i gerrez ennuit,184,l-179v-2-15,179v,2,
1301,Si aiſt Diex a moy,184,l-179v-2-16,179v,2,
1302,Certes ſe fuſſent grant,185,l-179v-2-17,179v,2,
1303,Diſt l'autre mi enfant,185,l-179v-2-18,179v,2,
1304,Poꝛ toy ne m'en partiſſe,185,l-179v-2-19,179v,2,
1305,Mais oꝛ m'en partirai,185,l-179v-2-20,179v,2,
1306,Et ſi te merirai,185,l-179v-2-21,179v,2,
1307,Encoꝛ ceſte franchiſe,185,l-179v-2-22,179v,2,
1308,Gardez vous de preſter,186,l-179v-2-23,179v,2,
1309,Et du uostre liurer,186,l-179v-2-24,179v,2,
1310,A gent de male foy,186,l-179v-2-25,179v,2,
1311,Car ja gré n'en ſaront,186,l-179v-2-26,179v,2,
1312,Et rendꝛe nel voudꝛont,186,l-179v-2-27,179v,2,
1313,Pieca qu'eſpꝛouue l'oÿ,186,l-179v-2-28,179v,2,
1314,Le criquet ot diſete,187,l-179v-2-29,179v,2,
1315,En [yver ]et pouerte,187,l-179v-2-30,179v,2,
1316,Au fourmi eſt venu,187,l-179v-2-31,179v,2,
1317,En ploꝛant li requiſt,187,l-179v-2-32,179v,2,
1318,Que bonté li feïſt,187,l-179v-2-33,179v,2,
1319,D'un po de blé menu,187,l-179v-2-34,179v,2,
1320,Et qu'il moꝛroit de fain,188,l-179v-2-35,179v,2,
1321,Ja n'en avroit demain,188,l-179v-2-36,179v,2,
1322,Se il n'avoit aye,188,l-179v-2-37,179v,2,
1323,Oez ſire criquet,188,l-179v-2-38,179v,2,
1324,Se malement vous vet,188,l-180r-1-1,180r,1,
1325,C'eſt par vostre folie,188,l-180r-1-2,180r,1,
1326,Quant je me pourchacoie,189,l-180r-1-3,180r,1,
1327,Du blé et garniſſoie,189,l-180r-1-4,180r,1,
1328,De coi ſeruoies tu,189,l-180r-1-5,180r,1,
1329,Il reſpont je chantoie,189,l-180r-1-6,180r,1,
1330,Et grant joie menoie,189,l-180r-1-7,180r,1,
1331,Mais oꝛ ſui abatu,189,l-180r-1-8,180r,1,
1332,Sire empres je chanter,190,l-180r-1-9,180r,1,
1333,Deuſſiez bien baler,190,l-180r-1-10,180r,1,
1334,Le fremi li a dit,190,l-180r-1-11,180r,1,
1335,Ja ne vous aiderai,190,l-180r-1-12,180r,1,
1336,Ne bien ne vous ferai,190,l-180r-1-13,180r,1,
1337,Certes tant ſoit petis,190,l-180r-1-14,180r,1,
1338,Gueres ne m'ameroit,191,l-180r-1-15,180r,1,
1339,Cil qui me loeroit,191,l-180r-1-16,180r,1,
1340,Que le mien vous donnaſſe,191,l-180r-1-17,180r,1,
1341,Et quant j'aroie fain,191,l-180r-1-18,180r,1,
1342,Ou en nuit ou demain,191,l-180r-1-19,180r,1,
1343,Au bois querre l'alaſſe,191,l-180r-1-20,180r,1,
1344,On doit en ſa jonece,192,l-180r-1-21,180r,1,
1345,Gaaignier la richece,192,l-180r-1-22,180r,1,
1346,Dont ſon vivre en avant,192,l-180r-1-23,180r,1,
1347,Et cil qui ce ne fet,192,l-180r-1-24,180r,1,
1348,Povre et chetif ſ'en vait,192,l-180r-1-25,180r,1,
1349,Droit eſt par /saint amant,192,l-180r-1-26,180r,1,
1350,Il ot en une lande,193,l-180r-1-27,180r,1,
1351,Une beſt moult grande,193,l-180r-1-28,180r,1,
1352,Qui avoit lon la viſte,193,l-180r-1-29,180r,1,
1353,El menioit les toꝛiaus,193,l-180r-1-30,180r,1,
1354,Les cers et les cheuriaus,193,l-180r-1-31,180r,1,
1355,Et li dain et la biche,193,l-180r-1-32,180r,1,
1356,Tant qu'il n'ot riens leſſie,194,l-180r-1-33,180r,1,
1357,Que treſtout n'ot mengie,194,l-180r-1-34,180r,1,
1358,C'un treſtout ſeul toꝛel.,194,l-180r-1-35,180r,1,
1359,Il diſt en ſon langage,194,l-180r-1-36,180r,1,
1360,Ce n'eſt pas grant domage,194,l-180r-1-37,180r,1,
1361,Se de moy as la pel.,194,l-180r-1-38,180r,1,
1362,A bon dꝛoit nous as moꝛs,195,l-180r-2-1,180r,2,
1363,Treſtous foibles et foꝛs,195,l-180r-2-2,180r,2,
1364,Car nulz n'y ot aye,195,l-180r-2-3,180r,2,
1365,S'au primier d'un acoꝛt,195,l-180r-2-4,180r,2,
1366,Fuiſſions et d'un reſſoꝛt,195,l-180r-2-5,180r,2,
1367,Ne fuſſes oꝛ en vie,195,l-180r-2-6,180r,2,
1368,Se toutes t'euſſon,196,l-180r-2-7,180r,2,
1369,Hurtees d'un randon,196,l-180r-2-8,180r,2,
1370,Tu fuſſes deuouree,196,l-180r-2-9,180r,2,
1371,L'une a l'autre n'aida,196,l-180r-2-10,180r,2,
1372,Car chaſcune cuida,196,l-180r-2-11,180r,2,
1373,Eſtre plus depoꝛtee,196,l-180r-2-12,180r,2,
1374,L'un doit l'autre garder,197,l-180r-2-13,180r,2,
1375,Et deffendꝛe et tenſer,197,l-180r-2-14,180r,2,
1376,Auſſi com ſoy meiſme,197,l-180r-2-15,180r,2,
1377,Qui ainſi le feroit,197,l-180r-2-16,180r,2,
1378,Partout ſeur ſeroit,197,l-180r-2-17,180r,2,
1379,Mais ycy fault la rime,197,l-180r-2-18,180r,2,
1380,Dela la mer griffaingne,198,l-180r-2-19,180r,2,
1381,Oultre une grant montaigne,198,l-180r-2-20,180r,2,
1382,Ot jadis .i. royaume,198,l-180r-2-21,180r,2,
1383,Dont le roy eſtoit ſinge,198,l-180r-2-22,180r,2,
1384,Chaſcune choſe et nice,198,l-180r-2-23,180r,2,
1385,Si ot de taigne hyaume,198,l-180r-2-24,180r,2,
1386,Deux bachelers erroient,199,l-180r-2-25,180r,2,
1387,Qui par le mont queroient,199,l-180r-2-26,180r,2,
1388,Auentures diverses,199,l-180r-2-27,180r,2,
1389,En ce royaume entrerent,199,l-180r-2-28,180r,2,
1390,Grant plenté y trouverent,199,l-180r-2-29,180r,2,
1391,Singes et autres beſtes,199,l-180r-2-30,180r,2,
1392,Devant loy les manda,200,l-180r-2-31,180r,2,
1393,Le roy et commanda,200,l-180r-2-32,180r,2,
1394,Qu'il dient verité,200,l-180r-2-33,180r,2,
1395,De ce qu'il requerra,200,l-180r-2-34,180r,2,
1396,Ou moꝛir les fera,200,l-180r-2-35,180r,2,
1397,A duel et a vilté,200,l-180r-2-36,180r,2,
1398,Dit l'un je vous dirai,201,l-180v-1-4,180r,2,
1399,Sire ce que ſarai,201,l-180v-1-5,180r,2,
1400,[...],201,l-180v-1-6,180r,2,
1401,Oꝛe dont dit le roy,201,l-180v-1-7,180v,1,
1402,Que te ſamble de moy,201,l-180v-1-8,180v,1,
1403,Et de mes chevaliers,201,l-180v-1-9,180v,1,
1404,Sire il n'a roy en terre,202,l-180v-1-10,180v,1,
1405,Qui peüſt tenir guerre,202,l-180v-1-11,180v,1,
1406,A vous ne a vos gens,202,l-180v-1-12,180v,1,
1407,Vous eſtes plus puiſſans,202,l-180v-1-13,180v,1,
1408,Et bel et auenans,202,l-180v-1-14,180v,1,
1409,Et plus c'uns autres gens,202,l-180v-1-15,180v,1,
1410,Vous eſtes plus grant ſire,203,l-180v-1-16,180v,1,
1411,Et plus large com ſans ire,203,l-180v-1-17,180v,1,
1412,Et plain de coꝛtoiſie,203,l-180v-1-18,180v,1,
1413,Qu'/alixandꝛes n'eſtoit,203,l-180v-1-19,180v,1,
1414,Ou temps que il vivoit,203,l-180v-1-20,180v,1,
1415,De ce ne dout je mie,203,l-180v-1-21,180v,1,
1416,Uoſtre chevalerie,204,l-180v-1-22,180v,1,
1417,Eſt de biauté garnie,204,l-180v-1-23,180v,1,
1418,De bonté et de ſens,204,l-180v-1-24,180v,1,
1419,Chaſcun a courtoiſie,204,l-180v-1-25,180v,1,
1420,En ſon cuer herbergie,204,l-180v-1-26,180v,1,
1421,Qui y maindꝛa tous temps,204,l-180v-1-27,180v,1,
1422,Li roys ſ'en eſjoy,205,l-180v-1-28,180v,1,
1423,Quant ſi loer l'oÿ,205,l-180v-1-29,180v,1,
1424,Grant don li a donne,205,l-180v-1-30,180v,1,
1425,Chaſcun de ſa meſnie,205,l-180v-1-31,180v,1,
1426,Quanqu'il a en baillie,205,l-180v-1-32,180v,1,
1427,Li a habandonne,205,l-180v-1-33,180v,1,
1428,Li roys .i. compaignon,206,l-180v-1-34,180v,1,
1429,L'avoit mis a raiſon,206,l-180v-1-35,180v,1,
1430,Et requiert qu'il li die,206,l-180v-1-36,180v,1,
1431,Qui li eſtoit avis,206,l-180v-1-37,180v,1,
1432,De li et du pays,206,l-180v-1-38,180v,1,
1433,Et de ſa baronnie,206,l-180v-1-39,180v,1,
1434,Si penſa qu'il aroit,207,l-180v-1-40,180v,1,
1435,Trop plus ſe voir diſoit,207,l-180v-1-41,180v,1,
1436,Que n'ot ſon compaignon.,207,l-180v-1-42,180v,1,
1437,Qui mencongier eſtoit,207,l-180v-1-43,180v,1,
1438,De quanqu'il li diſoit,207,l-180v-1-44,180v,1,
1439,Et ſi ot maint bel don,207,l-180v-1-45,180v,1,
1440,Sire roys eſcoutez,208,l-180v-1-46,180v,1,
1441,Fait il et ſi oꝛrez,208,l-180v-2-1,180v,2,
1442,Ce qu'il m'en eſt avis,208,l-180v-2-2,180v,2,
1443,Singe lait et pele,208,l-180v-2-3,180v,2,
1444,Deuez eſtre apele,208,l-180v-2-4,180v,2,
1445,Vous et tous vos amis,208,l-180v-2-5,180v,2,
1446,Vous n'eſtes mie gens,209,l-180v-2-6,180v,2,
1447,Mais ſinges oꝛs pullens,209,l-180v-2-7,180v,2,
1448,Et plain de cruauté,209,l-180v-2-8,180v,2,
1449,Et tout vostre pays,209,l-180v-2-9,180v,2,
1450,Mauvés eſt ce m'eſt vis,209,l-180v-2-10,180v,2,
1451,Riens n'y a de bonte,209,l-180v-2-11,180v,2,
1452,Les beſtes l'aſſaillirent,210,l-180v-2-12,180v,2,
1453,Quant leſdengier l'oirent,210,l-180v-2-13,180v,2,
1454,Et tout l'ont deuoure,210,l-180v-2-14,180v,2,
1455,Fol fu de dire voir,210,l-180v-2-15,180v,2,
1456,Car bien pooit ſavoir,210,l-180v-2-16,180v,2,
1457,Qui en aroit mal gré,210,l-180v-2-17,180v,2,
1458,Mentir pour gré avoir,211,l-180v-2-18,180v,2,
1459,Vault miex que dire voir,211,l-180v-2-19,180v,2,
1460,Et perdꝛe coꝛps et vie,211,l-180v-2-20,180v,2,
1461,Voir dire ſans domage,211,l-180v-2-21,180v,2,
1462,Deuroit tout home ſage,211,l-180v-2-22,180v,2,
1463,Car mentir eſt folie,211,l-180v-2-23,180v,2,
1464,Un biau cheval de pris,212,l-180v-2-29,180v,2,
1465,Poignot vers .i. larris,212,l-180v-2-30,180v,2,
1466,Par une eſtroite ſente,212,l-180v-2-31,180v,2,
1467,[Un Aſnes a encontre],212,l-180v-2-32,180v,2,
1468,Qui y eſtoit entre,212,l-180v-2-33,180v,2,
1469,De gaus poꝛtoit bien .xxx.,212,l-180v-2-34,180v,2,
1470,Quant le cheval le vit,213,l-180v-2-35,180v,2,
1471,De li ot grant deſpit,213,l-180v-2-36,180v,2,
1472,Et foꝛment ſe deſroie,213,l-180v-2-37,180v,2,
1473,Il li diſt par ayr,213,l-180v-2-38,180v,2,
1474,A moy dois obeir,213,l-180v-2-39,180v,2,
1475,Et leſſier moi la voie,213,l-180v-2-40,180v,2,
1476,Moult ay heu grant los,214,l-180v-2-41,180v,2,
1477,Es tournois et es os,214,l-180v-2-42,180v,2,
1478,De maint vaillant baron,214,l-180v-2-43,180v,2,
1479,Et tu chetis puans,214,l-180v-2-44,180v,2,
1480,N'ez pas obeiſſans,214,l-180v-2-45,180v,2,
1481,A ma noble facon.,214,l-181r-1-1,181r,1,
1482,Se jamais t'encontroie,215,l-181r-1-2,181r,1,
1483,Certes je t'occirroie,215,l-181r-1-3,181r,1,
