line_no,text,lg,l_id,folio,col,speaker
471,Qⁱ ne poiſſe pas demi once,28,l-45r-2-2,45r,2,
472,Cilz qui de felōnie gronce,28,l-45r-2-3,45r,2,
473,Ceſtez vous dites voir,28,l-45r-2-4,45r,2,
474,Vilains oꝛpues tu bn̄ ſauoir,28,l-45r-2-5,45r,2,
475,Q՚ de la pieꝛre tai menti,28,l-45r-2-6,45r,2,
476,Ce ſai ie bn̄ dit il deſi,28,l-45r-2-7,45r,2,
477,Mes deuāt ceꝛtes lecuidai,28,l-45r-2-8,45r,2,
478,Vilains oꝛendꝛoit ˞pueꝛai(t),28,l-45r-2-9,45r,2,
479,Des .iij. cens q՚ pas ne ſauoies,28,l-45r-2-10,45r,2,
480,⁊ de ce que tu me diſſoies,28,l-45r-2-11,45r,2,
481,Nus neſt ſifolz nonq՚s ne fu,28,l-45r-2-12,45r,2,
482,Qⁱl pleuraſt ce qĩns n'ot eü,28,l-45r-2-13,45r,2,
483,Maintenant cemeſt vis ploꝛas,28,l-45r-2-14,45r,2,
484,Ce qĩns neus nauraz,28,l-45r-2-15,45r,2,
485,Des .iij. ſens eſtez aboſmes,28,l-45r-2-16,45r,2,
486,Biaus amis oꝛles map՚nez,28,l-45r-2-17,45r,2,
487,Il fet bon apñdꝛe bō mot,28,l-45r-2-18,45r,2,
488,Lendit q՚ cil nētāt qͥl n'ot,28,l-45r-2-19,45r,2,
489,⁊ celle parolle agñt ſens,28,l-45r-2-20,45r,2,
490,Qⁱ en apou de pourpens,28,l-45r-2-21,45r,2,
491,Tel ꝑole de courtoiſſie,28,l-45r-2-22,45r,2,
492,Qⁱ ne le ſaroit faire mie,28,l-45r-2-23,45r,2,
493,Et tel cuite (ci) eſtre bn̄ ſenez,28,l-45r-2-24,45r,2,
494,Qⁱ afolie eſt aſſenez,28,l-45r-2-25,45r,2,
495,Qñt ce ot dit ſi ſen vola,29,l-45r-2-26,45r,2,
496,⁊ entelle heure ſen ala,29,l-45r-2-27,45r,2,
497,Q˜inz pꝰ arrieꝛe reuint,29,l-45r-2-28,45r,2,
498,Ne nen ne ſet q՚ il deuint,29,l-45r-2-29,45r,2,
499,Les fueilles ſecheꝛēt dupin,29,l-45r-2-30,45r,2,
500,Ne fu plꝰ veꝛt ſoit ne matin,29,l-45r-2-31,45r,2,
501,Li veꝛgieꝛs failli ⁊ ſecha,29,l-45r-2-32,45r,2,
502,⁊ la fontaine ceſtancha,29,l-45r-2-33,45r,2,
503,Le vilain peꝛdi ſonde duit,29,l-45r-2-34,45r,2,
504,⁊ bn̄ ſachent toutes ⁊ tuit,29,l-45r-2-35,45r,2,
505,Le ˞pueꝛbe dit ē apeꝛt,29,l-45r-2-36,45r,2,
506,Cilz qͥ tout couoite tout ꝑt,29,l-45r-2-37,45r,2,
