line_no,text,lg,l_id,folio,col,speaker
477,Et richement ſ'aꝑeillaſt,1,l-244v-1-1,244v,1,
478,Iſſi auint aieſſont,1,l-244v-1-2,244v,1,
479,Mes il ne ſeuent ou il uont,1,l-244v-1-3,244v,1,
480,Mes enſemble oeus vint .i. meſchī,1,l-244v-1-4,244v,1,
481,Qⁱl amenoit adꝛoit chemin,1,l-244v-1-5,244v,1,
482,Tant q՚ uindꝛent a vn chaſtel,1,l-244v-1-6,244v,1,
483,Entout leſiecle n'ot plu bel,1,l-244v-1-7,244v,1,
484,Vne abeie auoit dedens,1,l-244v-1-8,244v,1,
485,Deml՚t religioſes gens,1,l-244v-1-9,244v,1,
486,Li uarles les iherberia,1,l-244v-1-10,244v,1,
487,Qui ala feſte lemena,1,l-244v-1-11,244v,1,
488,Enlachambꝛe qui fu l'abé,1,l-244v-1-12,244v,1,
489,Bn̄ ſunt ſerui et enuoia,1,l-244v-1-13,244v,1,
490,Eldemain uont lameſſe oir,1,l-244v-1-14,244v,1,
491,Puis ſ'enuoloient deꝑtir,1,l-244v-1-15,244v,1,
492,L'abes ala eulz parler,1,l-244v-1-16,244v,1,
493,Mout les pꝛia deſeioꝛner,1,l-244v-1-17,244v,1,
494,Si loꝛ moꝛſt՚ra doꝛtoir,1,l-244v-1-18,244v,1,
495,Senchapitre ſen refectoꝛ,1,l-244v-1-19,244v,1,
496,⁊ com il ſunt bn̄ h՚bergie,1,l-244v-1-20,244v,1,
497,Li ſires leur a otrie,1,l-244v-1-21,244v,1,
498,Leioꝛ quant il oꝛent diſne,1,l-244v-1-22,244v,1,
499,Es officines ſunt alé,1,l-244v-1-23,244v,1,
500,El chapitre entrent auant,1,l-244v-1-24,244v,1,
501,Vne tombe itrouu՚ent gñt,1,l-244v-1-25,244v,1,
502,Couu՚te d'un paile roe,1,l-244v-1-26,244v,1,
503,D'un chier oꝛ ffroy ꝑmi bēde,1,l-244v-1-27,244v,1,
504,Auchief aspiez et as coſtez,1,l-244v-1-28,244v,1,
505,Auoit uint cierges alumez,1,l-244v-1-29,244v,1,
506,D'oꝛfin oꝛent lichandelier,1,l-244v-1-30,244v,1,
507,Dame triſtes li entenſier,1,l-244v-1-31,244v,1,
508,Dont il entenſeront leioꝛ,1,l-244v-1-32,244v,1,
509,Cele tombe ꝑ grant ennoꝛ,1,l-244v-1-33,244v,1,
510,Il ont demande et ēquis,1,l-244v-1-34,244v,1,
511,A ceus qui erent du pais,1,l-244v-1-35,244v,1,
512,De la tombe qui elle eſtoit,1,l-244v-1-36,244v,1,
513,⁊ q՚lz hons fu qui igeſoit,1,l-244v-1-37,244v,1,
514,Cil coum̄cerent aplourer,1,l-244v-1-38,244v,1,
515,Et emploꝛant areconter,1,l-244v-2-1,244v,2,
516,Q՚ c'ert li miendꝛes chr՚s,1,l-244v-2-2,244v,2,
517,⁊ li plus foꝛs et li plus fiers,1,l-244v-2-3,244v,2,
518,Li plus biaus et li plus ames,1,l-244v-2-4,244v,2,
519,Qui iamés ſoit elſiecle nes,1,l-244v-2-5,244v,2,
520,Deceſte terre ot eſté roys,1,l-244v-2-6,244v,2,
521,Onques ne fu nus ſi coꝛtois,1,l-244v-2-7,244v,2,
522,A /dacarnen fu entrepꝛis,1,l-244v-2-8,244v,2,
523,Pour l'amoꝛ d'une dame ocis,1,l-244v-2-9,244v,2,
524,Onq՚s puis n'euſmes ſeignoꝛ,1,l-244v-2-10,244v,2,
525,Ainz auons atendu mains ioꝛ,1,l-244v-2-11,244v,2,
526,Vn filz qn̄ la dame engendꝛa,1,l-244v-2-12,244v,2,
527,Si com il dit et coumanda,1,l-244v-2-13,244v,2,
528,Quant la dame oÿ la nouele,1,l-244v-2-14,244v,2,
529,A haute uois ſon filz apele,1,l-244v-2-15,244v,2,
530,Biaus fiz fet elle auez oÿ,1,l-244v-2-16,244v,2,
531,Q՚ diex uous a amenez ci,1,l-244v-2-17,244v,2,
532,C'eſt ur՚es peres qui ci giſt,1,l-244v-2-18,244v,2,
533,Q՚ ciſt uiellars atoꝛt occiſt,1,l-244v-2-19,244v,2,
534,Oꝛ uos coum̄t et rent m'eſpee,1,l-244v-2-20,244v,2,
535,Q՚ i'e aſſez lonc tans gardee,1,l-244v-2-21,244v,2,
536,Oiant tous li conneü,1,l-244v-2-22,244v,2,
537,Qⁱl l'engendꝛa et ſes fiz fu,1,l-244v-2-23,244v,2,
538,Com il ſouloit uenir alui,1,l-244v-2-24,244v,2,
539,Et ſes ſires letrai,1,l-244v-2-25,244v,2,
540,Lau՚ite li a contee,1,l-244v-2-26,244v,2,
541,Soꝛ la tombe cheï paſmee,1,l-244v-2-27,244v,2,
542,Enla paſmoiſon deuia,1,l-244v-2-28,244v,2,
543,Ainc puis ahōme n'i ꝑla,1,l-244v-2-29,244v,2,
544,Quant ſes fiz uit q՚ moꝛe fu,1,l-244v-2-30,244v,2,
545,Son parraſtre a le chief tolu,1,l-244v-2-31,244v,2,
546,Del'eſpee qui fu ſon pere,1,l-244v-2-32,244v,2,
547,Auoit uengie lui et ſamere,1,l-244v-2-33,244v,2,
548,Puis c'ainſi eſtoit auenu,1,l-244v-2-34,244v,2,
549,Et par la cité fu ſeu,1,l-244v-2-35,244v,2,
550,A gñt ennoꝛ la dame ont pͥſe,1,l-244v-2-36,244v,2,
551,⁊ elſarqueu poſee et miſe,1,l-244v-2-37,244v,2,
552,Delez lecoꝛs deſon ami,1,l-244v-2-38,244v,2,
553,Diex leur face bonne m՚ci,1,l-245r-1-1,245r,1,
554,Leur ſeingneur firent d'yonec,1,l-245r-1-2,245r,1,
555,Ains que il deꝑtiſt d'ilec,1,l-245r-1-3,245r,1,
556,Ciſt qui ceſte auanture oꝛrent,1,l-245r-1-4,245r,1,
557,Lonc tans ap՚s vn lai en firent,1,l-245r-1-5,245r,1,
558,De la plainte et de la douloꝛ,1,l-245r-1-6,245r,1,
559,Q՚ ciſt ſouffrirent poꝛ amoꝛ,1,l-245r-1-7,245r,1,
