line_no,text,lg,l_id,folio,col,speaker
984,Fiſt li arbaleſtiers,132,l-177v-2-8,177v,2,
985,Il toꝛna ꝑ dela,132,l-177v-2-9,177v,2,
986,Si toſt cō deuala,132,l-177v-2-10,177v,2,
987,Ce reſpont le bouuier,132,l-177v-2-11,177v,2,
988,OT puis leur a gaignie,133,l-177v-2-12,177v,2,
989,La ou il ert mucie,133,l-177v-2-13,177v,2,
990,Mais pas ne l'ētēdirēt,133,l-177v-2-14,177v,2,
991,Oultre ſ'en ſont paſſez,133,l-177v-2-15,177v,2,
992,Plus n'i ſont arreſtez,133,l-177v-2-16,177v,2,
993,N'ōq՚s pꝰ n'y reuīdꝛent,133,l-177v-2-17,177v,2,
994,Sire dit le bouuier,134,l-177v-2-18,177v,2,
995,Biē poez de ſbouchier,134,l-177v-2-19,177v,2,
996,Vꝰ eſtes eſchape,134,l-177v-2-20,177v,2,
997,Se ne fuſt m'aye,134,l-177v-2-21,177v,2,
998,Vꝰ fuſſiez hoꝛs de vie,134,l-177v-2-22,177v,2,
999,Et pꝛis ⁊ atrape,134,l-177v-2-23,177v,2,
1000,La lāgue ſoit ſauuee,135,l-177v-2-24,177v,2,
1001,Et de dieu honoꝛee,135,l-177v-2-25,177v,2,
1002,Dit le leu biaus amis,135,l-177v-2-26,177v,2,
1003,Les ex ſoient creuez,135,l-177v-2-27,177v,2,
1004,Et tous eſbourbelez,135,l-177v-2-28,177v,2,
1005,Qu'ē la teſte as aſſis,135,l-177v-2-29,177v,2,
1006,Encuſe me cuidas,136,l-177v-2-30,177v,2,
1007,Qñt tu guignas en bas,136,l-177v-2-31,177v,2,
1008,Si feis meſpꝛoiſon,136,l-177v-2-32,177v,2,
1009,Autre choſe pēſoies,136,l-177v-2-33,177v,2,
1010,Q՚ tu ne leur diſoies,136,l-177v-2-34,177v,2,
1011,Si eſtoit traiſon.,136,l-177v-2-35,177v,2,
1012,Qvi pꝛomet ala gent,137,l-177v-2-36,177v,2,
1013,Ou bonté ou argent,137,l-177v-2-37,177v,2,
1014,Q՚ faire ne puet mie,137,l-177v-2-38,177v,2,
1015,Ap՚s regaīgne ē bas,137,l-177v-2-39,177v,2,
1016,Q՚ n'ē nel face pas.,137,l-178r-1-1,178r,1,
1017,Li fait gñt vilēnie,137,l-178r-1-2,178r,1,
1018,oupillez nouuiaꝰ nez,138,l-178r-1-3,178r,1,
1019,Furent pꝛis ⁊ poꝛtez,138,l-178r-1-4,178r,1,
1020,D'un aigle a ſes faons,138,l-178r-1-5,178r,1,
1021,Pēſa qu'il leur dōroit,138,l-178r-1-6,178r,1,
1022,Et leur deſpeceroit,138,l-178r-1-7,178r,1,
1023,Tous ꝑ menus lardōs,138,l-178r-1-8,178r,1,
1024,Ie gourpill ſi reqⁱſt,139,l-178r-1-9,178r,1,
1025,L'aigle qu'il li rendiſt,139,l-178r-1-10,178r,1,
1026,Poꝛ dieu ſes gourpilles,139,l-178r-1-11,178r,1,
1027,Pꝰ diſt q՚ nō feroit,139,l-178r-1-12,178r,1,
1028,Et q՚ il en dōroit,139,l-178r-1-13,178r,1,
1029,La char a ſes aiglos,139,l-178r-1-14,178r,1,
1030,Le goꝛpil fu dolant,140,l-178r-1-15,178r,1,
1031,Qñt ne pot autremāt,140,l-178r-1-16,178r,1,
1032,Gñt feu a alume,140,l-178r-1-17,178r,1,
1033,Deſſoꝰ le ny a l'aigle,140,l-178r-1-18,178r,1,
1034,Malem̄t l'aꝑeille,140,l-178r-1-19,178r,1,
1035,De paour eſt paume,140,l-178r-1-20,178r,1,
1036,Les aigles baaillierēt,141,l-178r-1-21,178r,1,
1037,Du gñt chaut qu'il ſenterent,141,l-178r-1-22,178r,1,
1038,Mais ne poꝛent foir,141,l-178r-1-23,178r,1,
1039,L'aicle ne ſcet q՚ faire,141,l-178r-1-24,178r,1,
1040,En hault cōmēce a bꝛaire,141,l-178r-1-25,178r,1,
1041,Et biē cuide moꝛir,141,l-178r-1-26,178r,1,
1042,Rendez rendez lairon,142,l-178r-1-27,178r,1,
1043,Ou ycy voꝰ pēdꝛon,142,l-178r-1-28,178r,1,
1044,Dit le pere au gourpil,142,l-178r-1-29,178r,1,
1045,Treſtoꝰ les terendꝛai,142,l-178r-1-30,178r,1,
1046,Diſt l'aygle ꝑ ma fay,142,l-178r-1-31,178r,1,
1047,Si m'oſte le ꝑil.,142,l-178r-1-32,178r,1,
1048,Le goꝛpil ꝑ ſon art,143,l-178r-1-33,178r,1,
1049,Si fiſt l'aigle couart,143,l-178r-1-34,178r,1,
1050,St li rendi ſa ꝑte,143,l-178r-1-35,178r,1,
1051,Onq՚s ſon biau pͥer,143,l-178r-1-36,178r,1,
1052,N'i pot auoir meſtier,143,l-178r-1-37,178r,1,
1053,Ne de batre ſa teſte,143,l-178r-1-38,178r,1,
1054,Par ce poez ſauoir,144,l-178r-1-39,178r,1,
1055,Q՚ qui ne puet auoi,144,l-178r-2-1,178r,2,
1056,Le ſien puet depꝛoier,144,l-178r-2-2,178r,2,
1057,Aucun art doit pēſer,144,l-178r-2-3,178r,2,
1058,Et faire ⁊ auiſer,144,l-178r-2-4,178r,2,
1059,Dōt il ſe puiſt aidier,144,l-178r-2-5,178r,2,
1060,UN cheual ſi ſe vit,145,l-178r-2-6,178r,2,
1061,En .i. pꝛe ou peſſoit,145,l-178r-2-7,178r,2,
1062,A li vint .i. lyon,145,l-178r-2-8,178r,2,
1063,Et li diſt qⁱl eſtoit,145,l-178r-2-9,178r,2,
1064,Bō mire ⁊ qⁱl ſauoit,145,l-178r-2-10,178r,2,
1065,De toꝰ mauls gueriſon,145,l-178r-2-11,178r,2,
1066,Sire dit le cheual,146,l-178r-2-12,178r,2,
1067,Lonc tēps a q՚ i'ai mal,146,l-178r-2-13,178r,2,
1068,En .i. des piez derriere,146,l-178r-2-14,178r,2,
1069,Se me poez guerir,146,l-178r-2-15,178r,2,
1070,Biē le voꝰ puis merir,146,l-178r-2-16,178r,2,
1071,En aucune maniere,146,l-178r-2-17,178r,2,
1072,Frere dit le lyon,147,l-178r-2-18,178r,2,
1073,Couche toy ſi verron,147,l-178r-2-19,178r,2,
1074,Le mal aꝑtem̄t,147,l-178r-2-20,178r,2,
1075,Ie ne me pꝰ couch՚,147,l-178r-2-21,178r,2,
1076,Ce reſpōt le deſtrier,147,l-178r-2-22,178r,2,
1077,Si en ſui moult dolent,147,l-178r-2-23,178r,2,
1078,Souffrez dit le lyon,148,l-178r-2-24,178r,2,
1079,Quāq՚ noꝰ voꝰ feron,148,l-178r-2-25,178r,2,
1080,Et ne regibez mie,148,l-178r-2-26,178r,2,
1081,Le cheual biē ſauoit,148,l-178r-2-27,178r,2,
1082,Q՚ le lyon pēſoit,148,l-178r-2-28,178r,2,
1083,A tolir li la vie,148,l-178r-2-29,178r,2,
1084,Daiſſiez voꝰ ſire miere,149,l-178r-2-30,178r,2,
1085,Si verrez ꝑ derriere,149,l-178r-2-31,178r,2,
1086,Dit le cheual le mal,149,l-178r-2-32,178r,2,
1087,Biē vit q՚ li lyons,149,l-178r-2-33,178r,2,
1088,Le voult pꝛēdꝛe au talon,149,l-178r-2-34,178r,2,
1089,Oꝛ oez du cheual,149,l-178r-2-35,178r,2,
1090,De ſes .ii. piez arriere,150,l-178r-2-36,178r,2,
1091,A ſi frape le miere.,150,l-178r-2-37,178r,2,
1092,Q՚ il l'a a frōte,150,l-178r-2-38,178r,2,
1093,Mire diſt le cheual,150,l-178r-2-39,178r,2,
1094,I cuit q՚ de ce mal.,150,l-178v-1-1,178v,1,
1095,N'aurez iamais ſanté,150,l-178v-1-2,178v,1,
1096,Folz eſtoit le lyon,151,l-178v-1-3,178v,1,
1097,Qñt volt ꝑ traiſon,151,l-178v-1-4,178v,1,
1098,Decoiure le cheual,151,l-178v-1-5,178v,1,
1099,Car ſe il biē vouſſiſt,151,l-178v-1-6,178v,1,
1100,Tex .xiiii. en vainquiſt.,151,l-178v-1-7,178v,1,
1101,Et leur rendiſt eſtal.,151,l-178v-1-8,178v,1,
1102,Qvi veult ꝑ traiſon,152,l-178v-1-9,178v,1,
1103,Ouurer biē eſt raiſon.,152,l-178v-1-10,178v,1,
1104,Q՚ il en ait hōtāge,152,l-178v-1-11,178v,1,
1105,S'il ſe puet autrem̄t,152,l-178v-1-12,178v,1,
1106,Deliurer de tourm̄t,152,l-178v-1-13,178v,1,
1107,De mal ⁊ de domage,152,l-178v-1-14,178v,1,
1108,LI coulon ſi cremirent,153,l-178v-1-15,178v,1,
1109,L'oiſelierre qu'il virent,153,l-178v-1-16,178v,1,
1110,Prenāt leur cōpaignōs,153,l-178v-1-17,178v,1,
1111,Il ꝑlerent enſamble,153,l-178v-1-18,178v,1,
1112,Ca dit l'un ce me sāble,153,l-178v-1-19,178v,1,
1113,Cōme oiſeleurs felōs,153,l-178v-1-20,178v,1,
1114,Deſtruit nr՚e lignage,154,l-178v-1-21,178v,1,
1115,Et noꝰ fait gñt domage,154,l-178v-1-22,178v,1,
1116,Treſtoꝰ noꝰ occira.,154,l-178v-1-23,178v,1,
1117,Se n'auōs .i. garant,154,l-178v-1-24,178v,1,
1118,Sage pꝛeu et ꝑlant,154,l-178v-1-25,178v,1,
1119,Qⁱ noꝰ garātira,154,l-178v-1-26,178v,1,
1120,Il ont de l'eſpeurier,155,l-178v-1-27,178v,1,
1121,Fait leur gonfanōnier,155,l-178v-1-28,178v,1,
1122,Leur iuge ⁊ leur ſeigneur,155,l-178v-1-29,178v,1,
1123,Qⁱ .i. ⁊ .i. le pꝛent,155,l-178v-1-30,178v,1,
1124,Et le va deuourant,155,l-178v-1-31,178v,1,
1125,Treſtoꝰ de ioꝛ en ioꝛ.,155,l-178v-1-32,178v,1,
1126,Trop mauuais iuge auō,156,l-178v-1-33,178v,1,
1127,En l'eſpeurier felon,156,l-178v-1-34,178v,1,
1128,Ce dit .i. qⁱ le vit,156,l-178v-1-35,178v,1,
1129,Ia ne noꝰ deffendꝛa,156,l-178v-1-36,178v,1,
1130,Mais toꝰ ioꝛs mēgera,156,l-178v-1-37,178v,1,
1131,Car de nos ſans ſe vit,156,l-178v-1-38,178v,1,
1132,Il noꝰ eſt plus nuiſant,157,l-178v-2-1,178v,2,
1133,Q՚ l'oiſeleur deuant,157,l-178v-2-2,178v,2,
1134,Chaſcuns le puet vëoir,157,l-178v-2-3,178v,2,
1135,Qñt iuge le feiſmes,157,l-178v-2-4,178v,2,
1136,Et ſus noꝰ le meiſmes,157,l-178v-2-5,178v,2,
1137,Ce fu ꝑ nō ſauoir,157,l-178v-2-6,178v,2,
1138,Il crient plus l'oiſelier,158,l-178v-2-7,178v,2,
1139,Qⁱ l'aloe eſpeurier,158,l-178v-2-8,178v,2,
1140,Mal noꝰ en deffendꝛa,158,l-178v-2-9,178v,2,
1141,Qñt les verra venir,158,l-178v-2-10,178v,2,
1142,Poꝛ noꝰ pꝛēdꝛe ⁊ murtrir,158,l-178v-2-11,178v,2,
1143,D'eſpeurier ſ'en fuira,158,l-178v-2-12,178v,2,
1144,A peril eſchiu՚,159,l-178v-2-13,178v,2,
1145,Se doit on biē garder,159,l-178v-2-14,178v,2,
1146,De chëoir en greignour,159,l-178v-2-15,178v,2,
1147,Cōme les coulons furēt,159,l-178v-2-16,178v,2,
1148,Qⁱ abandō moꝛurent,159,l-178v-2-17,178v,2,
1149,Poꝛ leur mauuais ſeigneur,159,l-178v-2-18,178v,2,
1150,UN fol cheual heoit,160,l-178v-2-19,178v,2,
1151,.I. cerf qui li auoit,160,l-178v-2-20,178v,2,
1152,Trop malem̄t meffait,160,l-178v-2-21,178v,2,
1153,Aſſaudꝛe ne l'oſoit,160,l-178v-2-22,178v,2,
1154,Car ſes coꝛnes doutoit,160,l-178v-2-23,178v,2,
1155,Q՚( [...]) poignātes voit,160,l-178v-2-24,178v,2,
1156,UN veneeur requiſt,161,l-178v-2-25,178v,2,
1157,Qu'aide li feïſt,161,l-178v-2-26,178v,2,
1158,Du cerf metre ala moꝛt,161,l-178v-2-27,178v,2,
1159,Et il le ſeruiroit,161,l-178v-2-28,178v,2,
1160,Toꝰ les ioꝛs qu'il viuroit,161,l-178v-2-29,178v,2,
1161,Car moult ſe sētoit foꝛt,161,l-178v-2-30,178v,2,
1162,Le veneur l'a pꝛis,162,l-178v-2-31,178v,2,
1163,Qⁱ tantoſt li a mis,162,l-178v-2-32,178v,2,
1164,Et le frain et la ſele,162,l-178v-2-33,178v,2,
1165,Biē eſtoit le cengla,162,l-178v-2-34,178v,2,
1166,Vns esꝑōs chauca,162,l-178v-2-35,178v,2,
1167,Qⁱ oꝛent gñt roelle,162,l-178v-2-36,178v,2,
1168,Sus le cheual ſailli,163,l-178v-2-37,178v,2,
1169,Et le cerf acailli,163,l-178v-2-38,178v,2,
1170,Qⁱ moult eſtoit courant,163,l-179r-1-1,179r,1,
1171,Et ꝑ mons ⁊ ꝑ vaus,163,l-179r-1-2,179r,1,
1172,Et ꝑ plains et ꝑ gaus,163,l-179r-1-3,179r,1,
1173,L'ala foꝛm̄t chacant,163,l-179r-1-4,179r,1,
1174,Le cerf riens ne poꝛtoit,164,l-179r-1-5,179r,1,
1175,Qⁱ ml՚t legier eſtoit,164,l-179r-1-6,179r,1,
1176,Poꝛ noiant le chacoiēt,164,l-179r-1-7,179r,1,
1177,Iamais ne le ꝑiſſent,164,l-179r-1-8,179r,1,
1178,Poꝛ coꝛre qⁱl feiſſēt,164,l-179r-1-9,179r,1,
1179,Gñt folie faiſoiēt,164,l-179r-1-10,179r,1,
1180,Le cheyal ſ'ert ſaillāt,165,l-179r-1-11,179r,1,
1181,Et traueillie foꝛmāt,165,l-179r-1-12,179r,1,
1182,Ce n'ert mi m՚ueille,165,l-179r-1-13,179r,1,
1183,Gñs cops le va ferāt,165,l-179r-1-14,179r,1,
1184,Et derriere ⁊ deuant,165,l-179r-1-15,179r,1,
1185,Et trop mal l'aꝑeille,165,l-179r-1-16,179r,1,
1186,Le venerres felons,166,l-179r-1-17,179r,1,
1187,Si fiert des esꝑons,166,l-179r-1-18,179r,1,
1188,Si q՚ li ſans en ſault,166,l-179r-1-19,179r,1,
1189,Mais le cheual auāt,166,l-179r-1-20,179r,1,
1190,Ne puet ne tāt ne qñt,166,l-179r-1-21,179r,1,
1191,Car le cuer ſi li fault,166,l-179r-1-22,179r,1,
1192,Il a l'ōme reqⁱs,167,l-179r-1-23,179r,1,
1193,Qⁱ ſus lieſt aſſis,167,l-179r-1-24,179r,1,
1194,Q՚ il ſe ſueffre atāt,167,l-179r-1-25,179r,1,
1195,Et qⁱl le lait aler,167,l-179r-1-26,179r,1,
1196,Ꝑ les chāps paſturer,167,l-179r-1-27,179r,1,
1197,Cōme il faiſoit deuāt,167,l-179r-1-28,179r,1,
1198,Aler ne te lairai,168,l-179r-1-29,179r,1,
1199,Diſt li hōs ꝑ ma fay,168,l-179r-1-30,179r,1,
1200,Car a moy t'ez ſouſmis,168,l-179r-1-31,179r,1,
1201,Mais tāt ꝯ tu viuras,168,l-179r-1-32,179r,1,
1202,Toꝰ ioꝛs me ſeruiras.,168,l-179r-1-33,179r,1,
1203,De gré ou a ēuis,168,l-179r-1-34,179r,1,
1204,Le cerf ſ'out onq՚s mal,169,l-179r-1-35,179r,1,
1205,Mais moꝛt fu le cheual,169,l-179r-1-36,179r,1,
1206,Ꝑ ſi gñt felōnie,169,l-179r-1-37,179r,1,
1207,Qⁱ tuer le cuidoit,169,l-179r-1-38,179r,1,
1208,Poꝛ ce q՚ il auoit,169,l-179r-2-1,179r,2,
1209,Le veneur en aye,169,l-179r-2-2,179r,2,
1210,Ꝑ qui fu derōpu,170,l-179r-2-3,179r,2,
1211,A moꝛt ⁊ ꝯ fundu,170,l-179r-2-4,179r,2,
1212,Si cōm oÿ auez,170,l-179r-2-5,179r,2,
1213,Ꝑ ſon outrecuidāce,170,l-179r-2-6,179r,2,
1214,Fu il mis a outrāce,170,l-179r-2-7,179r,2,
1215,Et a la moꝛt alez,170,l-179r-2-8,179r,2,
1216,L'en a ſouuēt fiāce,171,l-179r-2-9,179r,2,
1217,En tel dont gñt nuisāce,171,l-179r-2-10,179r,2,
1218,Viēt pꝰ bien le ſauez,171,l-179r-2-11,179r,2,
1219,Poꝛ ce ſe fait trop mal,171,l-179r-2-12,179r,2,
1220,Qⁱ ſe ſouſmet a mal,171,l-179r-2-13,179r,2,
1221,Poꝛ faire autrui gⁱetez,171,l-179r-2-14,179r,2,
1222,Il auient ml՚t ſouuent,172,l-179r-2-15,179r,2,
1223,Q՚ l'en veult gñt toꝛm̄t,172,l-179r-2-16,179r,2,
1224,Faire a ſon cōtraire,172,l-179r-2-17,179r,2,
1225,L'ē ſe met ala moꝛt,172,l-179r-2-18,179r,2,
1226,Ou en gñt deſcōfoꝛt,172,l-179r-2-19,179r,2,
1227,Biē l'e oÿ retraire,172,l-179r-2-20,179r,2,
1228,UN coꝛbel ſi eſtoit,173,l-179r-2-21,179r,2,
1229,En .j. arbꝛe et mēioit,173,l-179r-2-22,179r,2,
1230,.I. petit de fromage,173,l-179r-2-23,179r,2,
1231,Renart l'a auiſé,173,l-179r-2-24,179r,2,
1232,Qⁱ toſt fu auiſé,173,l-179r-2-25,179r,2,
1233,De faire li domage,173,l-179r-2-26,179r,2,
1234,Diſt renart ꝑ ma foy,174,l-179r-2-27,179r,2,
1235,En tout le mont ne ſoy,174,l-179r-2-28,179r,2,
1236,Nule ſi bele beſte,174,l-179r-2-29,179r,2,
1237,Cōme voꝰ dant coꝛbel,174,l-179r-2-30,179r,2,
1238,Car fuſſent auſſi bel,174,l-179r-2-31,179r,2,
1239,Et de coꝛps ⁊ de teſte,174,l-179r-2-32,179r,2,
1240,Il n'eſt oiſel volans,175,l-179r-2-33,179r,2,
1241,Plꝰ de voꝰ ſoit plaiſant,175,l-179r-2-34,179r,2,
1242,Qⁱ voꝰ verroit eſtendꝛe,175,l-179r-2-35,179r,2,
1243,Trop groſſe vois auez,175,l-179r-2-36,179r,2,
1244,Qñt voꝰ chāter volez,175,l-179r-2-37,179r,2,
1245,Plꝰ n'y a q՚ repꝛendꝛe.,175,l-179r-2-38,179r,2,
1246,Le coꝛbel l'a oÿ,175,l-179v-1-1,179v,1,
1247,Ml՚t ſ'en eſt eſioy,175,l-179v-1-2,179v,1,
1248,Si ſ'eſt dont effoꝛcie,175,l-179v-1-3,179v,1,
1249,De cler chant՚ et hault,175,l-179v-1-4,179v,1,
1250,Car lie eſtoit ⁊ baut,175,l-179v-1-5,179v,1,
1251,Ꝯtre mont ſ'eſt dꝛecie,175,l-179v-1-6,179v,1,
1252,Si cō ſon bec ouuri,176,l-179v-1-7,179v,1,
1253,Poꝛ eſclarcir ſon cri,176,l-179v-1-8,179v,1,
1254,Li chay le fromage,176,l-179v-1-9,179v,1,
1255,Renart deſſoꝰ eſtoit,176,l-179v-1-10,179v,1,
1256,Qⁱ riens plus n'atēdoit,176,l-179v-1-11,179v,1,
1257,Si le pꝛiſt cōme ſage,176,l-179v-1-12,179v,1,
1258,Le coꝛbel ſ'eſt moquie,177,l-179v-1-13,179v,1,
1259,Qu'i lavoit engignie,177,l-179v-1-14,179v,1,
1260,Si diſt en sō lāgage,177,l-179v-1-15,179v,1,
1261,Ꝑ foy ſire coꝛbel,177,l-179v-1-16,179v,1,
1262,Voꝰ chātez oꝛ ml՚t bel,177,l-179v-1-17,179v,1,
1263,Se n'auez le fromage,177,l-179v-1-18,179v,1,
1264,Qvi croit quanq՚ il ot,178,l-179v-1-19,179v,1,
1265,Il eſt muſart ⁊ ſot,178,l-179v-1-20,179v,1,
1266,Il eſt ſouuēt dolant,178,l-179v-1-21,179v,1,
1267,Trop eſt de mēcōg՚s,178,l-179v-1-22,179v,1,
1268,Et de faus loſeng՚s,178,l-179v-1-23,179v,1,
1269,Poꝛ de coiure la gent,178,l-179v-1-24,179v,1,
1270,Une chieure pꝛenāt,179,l-179v-1-25,179v,1,
1271,Vit vne autre geſant,179,l-179v-1-26,179v,1,
1272,Son lit li a requis,179,l-179v-1-27,179v,1,
1273,oꝛ dieu qⁱl li p՚ſtaſt,179,l-179v-1-28,179v,1,
1274,Tāt qu'il les chaaillaſt,179,l-179v-1-29,179v,1,
1275,Ses chaaillos petis,179,l-179v-1-30,179v,1,
1276,Cele en ot gñt pitié,180,l-179v-1-31,179v,1,
1277,Son lit li a leſſie,180,l-179v-1-32,179v,1,
1278,Et cele y faonna,180,l-179v-1-33,179v,1,
1279,Et qñt elle reqⁱſt,180,l-179v-1-34,179v,1,
1280,Q՚ ſon lit li rendiſt,180,l-179v-1-35,179v,1,
1281,Cele le rāpoſna,180,l-179v-1-36,179v,1,
1282,Po d'amoꝛ m'auez fet,181,l-179v-1-37,179v,1,
1283,Encoꝛ nului ne vet,181,l-179v-1-38,179v,1,
1284,De mes petis faons,181,l-179v-2-1,179v,2,
1285,Oꝛ m'ē volez chacier,181,l-179v-2-2,179v,2,
1286,Certes po m'auez ch՚,181,l-179v-2-3,179v,2,
1287,Le ſeioꝛ n'eſt pas lōs,181,l-179v-2-4,179v,2,
1288,Qñt ie le voꝰ p՚ſtay,182,l-179v-2-5,179v,2,
1289,Diſt l'autre ꝑ ma fay,182,l-179v-2-6,179v,2,
1290,Ce ne fu qu'a vne heure,182,l-179v-2-7,179v,2,
1291,Oꝛ yauez eſté,182,l-179v-2-8,179v,2,
1292,iiij. lons ioꝛs d'eſté,182,l-179v-2-9,179v,2,
1293,N'eſt ce pas gñt domage,182,l-179v-2-10,179v,2,
1294,Puis q՚ ie n'ē ay grez,183,l-179v-2-11,179v,2,
1295,Plus n'y demoꝛerez,183,l-179v-2-12,179v,2,
1296,Ꝑ la foy q՚ voꝰ doy,183,l-179v-2-13,179v,2,
1297,Oꝛ toſt voidiez mō lit,183,l-179v-2-14,179v,2,
1298,Vꝰ n'i gerrez ēnuit,183,l-179v-2-15,179v,2,
1299,Si aiſt diex a moy,183,l-179v-2-16,179v,2,
1300,Certes ſe fuſſēt gñt,184,l-179v-2-17,179v,2,
1301,Diſt l'autre mi enfant,184,l-179v-2-18,179v,2,
1302,Poꝛ toy ne m'ē ꝑtiſſe,184,l-179v-2-19,179v,2,
1303,Mais oꝛ m'ē ꝑtirai,184,l-179v-2-20,179v,2,
1304,Et ſi te merirai,184,l-179v-2-21,179v,2,
1305,Encoꝛ ceſte frāchiſe,184,l-179v-2-22,179v,2,
1306,Gardez voꝰ de ꝑſter,185,l-179v-2-23,179v,2,
1307,Et du u՚re liurer,185,l-179v-2-24,179v,2,
1308,A gent de male foy,185,l-179v-2-25,179v,2,
1309,Car ia gré n'ē ſaront,185,l-179v-2-26,179v,2,
1310,Et rendꝛe nel voudꝛōt,185,l-179v-2-27,179v,2,
1311,Pieca qu'eſpꝛouue l'oÿ,185,l-179v-2-28,179v,2,
1312,Le criquet ot diſete,186,l-179v-2-29,179v,2,
1313,En (en )⁊ pou՚te,186,l-179v-2-30,179v,2,
1314,Au fourmi eſt venu,186,l-179v-2-31,179v,2,
1315,En ploꝛant li reqⁱſt,186,l-179v-2-32,179v,2,
1316,Q՚ bonté li feïſt,186,l-179v-2-33,179v,2,
1317,D'un po de blé menu,186,l-179v-2-34,179v,2,
1318,Et qu'il moꝛroit de fain,187,l-179v-2-35,179v,2,
1319,Ia n'ē auroit demain,187,l-179v-2-36,179v,2,
1320,Se il n'auoit aye,187,l-179v-2-37,179v,2,
1321,Oez ſire criquet,187,l-179v-2-38,179v,2,
1322,Se malem̄t voꝰ vet,187,l-180r-1-1,180r,1,
1323,C'eſt ꝑ vr՚e folie,187,l-180r-1-2,180r,1,
1324,Qñt ie me pourchacoie,188,l-180r-1-3,180r,1,
1325,Du blé et garniſſoie,188,l-180r-1-4,180r,1,
1326,De coi ſeruoies tu,188,l-180r-1-5,180r,1,
1327,Il reſpont ie chātoie,188,l-180r-1-6,180r,1,
1328,Et gñt ioie menoie,188,l-180r-1-7,180r,1,
1329,Mais oꝛ ſui abatu,188,l-180r-1-8,180r,1,
1330,Sire emp՚s ie chanter,189,l-180r-1-9,180r,1,
1331,Deuſſiez biē baler,189,l-180r-1-10,180r,1,
1332,Le fremi li adit,189,l-180r-1-11,180r,1,
1333,Ia ne voꝰ aiderai,189,l-180r-1-12,180r,1,
1334,Ne biē ne voꝰ ferai,189,l-180r-1-13,180r,1,
1335,Certes tāt ſoit petis,189,l-180r-1-14,180r,1,
1336,Gueres ne m'ameroit,190,l-180r-1-15,180r,1,
1337,Cil qui me loeroit,190,l-180r-1-16,180r,1,
1338,Q՚ le miē voꝰ dōnaſſe,190,l-180r-1-17,180r,1,
1339,Et qñt i'aroie fain,190,l-180r-1-18,180r,1,
1340,Ou ē nuit ou demain,190,l-180r-1-19,180r,1,
1341,Au bois q՚rre l'alaſſe,190,l-180r-1-20,180r,1,
1342,En doit en ſa ionece,191,l-180r-1-21,180r,1,
1343,Gaaignier la richece,191,l-180r-1-22,180r,1,
1344,Dont ſon viure ē auāt,191,l-180r-1-23,180r,1,
1345,Et cil qⁱ ce ne fet,191,l-180r-1-24,180r,1,
1346,Poure ⁊ chetif ſ'ē vait,191,l-180r-1-25,180r,1,
1347,Droit eſt ꝑ /.s՚. amant,191,l-180r-1-26,180r,1,
1348,Il ot en vne lāde,192,l-180r-1-27,180r,1,
1349,Vne beſt ml՚t gñde,192,l-180r-1-28,180r,1,
1350,Qⁱ auoit lō la viſte,192,l-180r-1-29,180r,1,
1351,El mēioit les toꝛiaus,192,l-180r-1-30,180r,1,
1352,Les cers ⁊ les cheuriaꝰ,192,l-180r-1-31,180r,1,
1353,Et li dain ⁊ la biche,192,l-180r-1-32,180r,1,
1354,Tant qͥl n'ot riēs leſſie,193,l-180r-1-33,180r,1,
1355,Q՚ treſtout n'ot mēgie,193,l-180r-1-34,180r,1,
1356,C'un treſtout ſeul toꝛel.,193,l-180r-1-35,180r,1,
1357,Il diſt en sō lāgage,193,l-180r-1-36,180r,1,
1358,Ce n'eſt pas gñt domage,193,l-180r-1-37,180r,1,
1359,Se de moy as la pel.,193,l-180r-1-38,180r,1,
1360,A bon dꝛoit noꝰ as moꝛs,194,l-180r-2-1,180r,2,
1361,Treſtoꝰ foibles ⁊ foꝛs,194,l-180r-2-2,180r,2,
1362,Car nulz n'y ot aye,194,l-180r-2-3,180r,2,
1363,S'au pͥmier d'un acoꝛt,194,l-180r-2-4,180r,2,
1364,Fuiſſions et d'ū reſſoꝛt,194,l-180r-2-5,180r,2,
1365,Ne fuſſes oꝛ en vie,194,l-180r-2-6,180r,2,
1366,Se toutes t'euſſon,195,l-180r-2-7,180r,2,
1367,Hurtees d'un randon,195,l-180r-2-8,180r,2,
1368,Tu fuſſes deuouree,195,l-180r-2-9,180r,2,
1369,L'une a l'autre n'aida,195,l-180r-2-10,180r,2,
1370,Car chaſcune cuida,195,l-180r-2-11,180r,2,
1371,Eſtre plꝰ depoꝛtee,195,l-180r-2-12,180r,2,
1372,L'un doit l'autre garder,196,l-180r-2-13,180r,2,
1373,Et deffendꝛe ⁊ tēſer,196,l-180r-2-14,180r,2,
1374,Auſſi cō ſoy meiſme,196,l-180r-2-15,180r,2,
1375,Qⁱ ainſi le feroit,196,l-180r-2-16,180r,2,
1376,Ꝑ tout ſeur ſeroit,196,l-180r-2-17,180r,2,
1377,Mais ycy fault la rime,196,l-180r-2-18,180r,2,
1378,Dela la mer griffaīgne,197,l-180r-2-19,180r,2,
1379,Oultre vne gñt mōtaigne,197,l-180r-2-20,180r,2,
1380,Ot iadis .i. royaume,197,l-180r-2-21,180r,2,
1381,Dont le roy eſtoit ſinge,197,l-180r-2-22,180r,2,
1382,Chaſcune choſe ⁊ nice,197,l-180r-2-23,180r,2,
1383,Si ot de taigne hyaume,197,l-180r-2-24,180r,2,
1384,Deux bachelers erroient,198,l-180r-2-25,180r,2,
1385,Qⁱ ꝑ le mont q՚roiēt,198,l-180r-2-26,180r,2,
1386,Auētures diu՚ſes,198,l-180r-2-27,180r,2,
1387,En ce royaume entrerēt,198,l-180r-2-28,180r,2,
1388,Gñt plēté y trouuerēt,198,l-180r-2-29,180r,2,
1389,Singes et autres beſtes,198,l-180r-2-30,180r,2,
1390,Deuant loy les māda,199,l-180r-2-31,180r,2,
1391,Le roy et cōmanda,199,l-180r-2-32,180r,2,
1392,Qⁱl dient v՚ité,199,l-180r-2-33,180r,2,
1393,De ce qⁱl req՚rra,199,l-180r-2-34,180r,2,
1394,Ou moꝛir les fera,199,l-180r-2-35,180r,2,
1395,A duel ⁊ a vilté,199,l-180r-2-36,180r,2,
1396,Dit l'un ie voꝰ dirai,200,l-180r-2-37,180r,2,
1397,Sire ce q՚ ſarai,200,l-180r-2-38,180r,2,
1398,Oꝛe dont dit le roy,200,l-180v-1-1,180v,1,
1399,Q՚ te ſamble de moy,200,l-180v-1-2,180v,1,
1400,Et de mes chl՚rs,200,l-180v-1-3,180v,1,
1401,Sire il n'a roy en terre,201,l-180v-1-10,180v,1,
1402,Qⁱ peüſt tenir g՚re,201,l-180v-1-11,180v,1,
1403,A voꝰ ne a vos gens,201,l-180v-1-12,180v,1,
1404,Voꝰ eſtes plus puiſſans,201,l-180v-1-13,180v,1,
1405,Et bel ⁊ auenans,201,l-180v-1-14,180v,1,
1406,Et plus c'uns autres gens,201,l-180v-1-15,180v,1,
1407,Voꝰ eſtes plꝰ gñt ſire,202,l-180v-1-16,180v,1,
1408,Et plꝰ large ꝯ ſans ire,202,l-180v-1-17,180v,1,
1409,Et plain de coꝛtoiſie,202,l-180v-1-18,180v,1,
1410,Qu'/alixādꝛes n'eſtoit,202,l-180v-1-19,180v,1,
1411,Ou tēps q՚ il viuoit,202,l-180v-1-20,180v,1,
1412,De ce ne dout ie mie,202,l-180v-1-21,180v,1,
1413,Uoſtre cheualerie,203,l-180v-1-22,180v,1,
1414,Eſt de biauté garnie,203,l-180v-1-23,180v,1,
1415,De bonté ⁊ de ſens,203,l-180v-1-24,180v,1,
1416,Chaſcun a courtoiſie,203,l-180v-1-25,180v,1,
1417,En sō cuer herbergie,203,l-180v-1-26,180v,1,
1418,Qⁱ y maīdꝛa toꝰ tēps,203,l-180v-1-27,180v,1,
1419,Ii roys ſ'en eſioy,204,l-180v-1-28,180v,1,
1420,Qñt ſi loer l'oÿ,204,l-180v-1-29,180v,1,
1421,Gñt don li a dōne,204,l-180v-1-30,180v,1,
1422,Chaſcun de ſa meſnie,204,l-180v-1-31,180v,1,
1423,Quāqⁱl a en baillie,204,l-180v-1-32,180v,1,
1424,Li a habādōne,204,l-180v-1-33,180v,1,
1425,Li roys .i. cōpaignō,205,l-180v-1-34,180v,1,
1426,L'auoit mis a raiſon,205,l-180v-1-35,180v,1,
1427,Et requiert qⁱl li die,205,l-180v-1-36,180v,1,
1428,Qⁱ li eſtoit auis,205,l-180v-1-37,180v,1,
1429,De li et du pays,205,l-180v-1-38,180v,1,
1430,⁊ de ſa barōnie,205,l-180v-1-39,180v,1,
1431,Si pēſa qⁱl aroit,206,l-180v-1-40,180v,1,
1432,Trop plꝰ ſe voir diſoit,206,l-180v-1-41,180v,1,
1433,Q՚ n'ot sō ꝯpaignon.,206,l-180v-1-42,180v,1,
1434,Qⁱ mēcōg՚ eſtoit,206,l-180v-1-43,180v,1,
1435,De quāqu'il li diſoit,206,l-180v-1-44,180v,1,
1436,Et ſi ot maīt bel don,206,l-180v-1-45,180v,1,
1437,Sire roys eſcoutez,207,l-180v-1-46,180v,1,
1438,Fait il et ſi oꝛrez,207,l-180v-2-1,180v,2,
1439,Ce qⁱl m'ē eſt auis,207,l-180v-2-2,180v,2,
1440,Singe lait ⁊ pele,207,l-180v-2-3,180v,2,
1441,Deuez eſtre apele,207,l-180v-2-4,180v,2,
1442,Voꝰ ⁊ toꝰ vos amis,207,l-180v-2-5,180v,2,
1443,Uous n'eſtes mie gens,208,l-180v-2-6,180v,2,
1444,Mais ſinges oꝛs pullens,208,l-180v-2-7,180v,2,
1445,Et plain de cruauté,208,l-180v-2-8,180v,2,
1446,Et tout vr՚e pays,208,l-180v-2-9,180v,2,
1447,Mauués eſt ce m'eſt vis,208,l-180v-2-10,180v,2,
1448,Riens n'y a de bōte,208,l-180v-2-11,180v,2,
1449,Les beſtes l'aſſaillirent,209,l-180v-2-12,180v,2,
1450,Qñt leſdeng՚ l'oirent,209,l-180v-2-13,180v,2,
1451,Et tout l'ont deuoure,209,l-180v-2-14,180v,2,
1452,Fol fu de dire voir,209,l-180v-2-15,180v,2,
1453,Car biē pooit ſauoir,209,l-180v-2-16,180v,2,
1454,Qⁱ en aroit mal gré,209,l-180v-2-17,180v,2,
1455,Mētir pour gré auoir,210,l-180v-2-18,180v,2,
1456,Vault miex q՚ dire voir,210,l-180v-2-19,180v,2,
1457,⁊ ꝑdꝛe coꝛps ⁊ vie,210,l-180v-2-20,180v,2,
1458,Voir dire ſans domage,210,l-180v-2-21,180v,2,
1459,Deuroit tout home ſage,210,l-180v-2-22,180v,2,
1460,Car mētir eſt folie,210,l-180v-2-23,180v,2,
1461,UN biau cheual de pͥs,211,l-180v-2-24,180v,2,
1462,Poignot v՚s .i. larris,211,l-180v-2-25,180v,2,
1463,Ꝑ vne eſtroite ſente,211,l-180v-2-26,180v,2,
1464,Qⁱ y eſtoit entre,211,l-180v-2-27,180v,2,
1465,De gaus poꝛtoit biē .xxx.,211,l-180v-2-28,180v,2,
1466,Qñt le cheual le vit,212,l-180v-2-35,180v,2,
1467,De li ot gñt deſpit,212,l-180v-2-36,180v,2,
1468,Et foꝛm̄t ſe deſroie,212,l-180v-2-37,180v,2,
1469,Il li diſt ꝑ ayr,212,l-180v-2-38,180v,2,
1470,A moy dois obeir,212,l-180v-2-39,180v,2,
1471,Et leſſier moi la voie,212,l-180v-2-40,180v,2,
1472,Moult ay heu gñt los,213,l-180v-2-41,180v,2,
1473,Es tournois ⁊ es os,213,l-180v-2-42,180v,2,
1474,De maīt vaillāt baron,213,l-180v-2-43,180v,2,
1475,Et tu chetis puans,213,l-180v-2-44,180v,2,
1476,N'ez pas obeiſſans,213,l-180v-2-45,180v,2,
1477,A ma noble facon.,213,l-181r-1-1,181r,1,
1478,Se iamais t'encōtroie,214,l-181r-1-2,181r,1,
1479,Certes ie t'occirroie,214,l-181r-1-3,181r,1,
1480,Se n'obeis a moy,214,l-181r-1-4,181r,1,
