line_no,text,lg,l_id,folio,col,speaker
468,Se dame dieu me voie,46,l-174v-1-1,174v,1,
469,Qⁱ n'ē puet eſtriuer,46,l-174v-1-2,174v,1,
470,A li ne doit iangler,46,l-174v-1-3,174v,1,
471,Mais aler en ſa voie,46,l-174v-1-4,174v,1,
472,Un chien fu qⁱ paſſoit,47,l-174v-1-5,174v,1,
473,.I. flueue et ſi poꝛtoit,47,l-174v-1-6,174v,1,
474,.I. quartier de moutō,47,l-174v-1-7,174v,1,
475,En l'yaue ſe miroit,47,l-174v-1-8,174v,1,
476,Sō obmre reſambloit,47,l-174v-1-9,174v,1,
477,.I. chiē de ſa facon.,47,l-174v-1-10,174v,1,
478,La char li volt tolir,48,l-174v-1-11,174v,1,
479,Q՚ il voit reſplendir,48,l-174v-1-12,174v,1,
480,Si a ſa gueule ouu՚te,48,l-174v-1-13,174v,1,
481,La char ſi li chai,48,l-174v-1-14,174v,1,
482,Dolut li de ſa ꝑte,48,l-174v-1-15,174v,1,
483,Aſſez de char auoit,49,l-174v-1-16,174v,1,
484,Et l'autrui conuoitoit,49,l-174v-1-17,174v,1,
485,Dōt il ꝑdi ſa pꝛoie,49,l-174v-1-18,174v,1,
486,Qu'autreſſi li ſeroit,49,l-174v-1-19,174v,1,
487,S'ainſi l'ē auenoit,49,l-174v-1-20,174v,1,
488,Chaſcun en auroit ioie,49,l-174v-1-21,174v,1,
489,Cil qui veult a la gent,50,l-174v-1-22,174v,1,
490,Tolir a eſcient,50,l-174v-1-23,174v,1,
491,Le leur ⁊ sās raiſon,50,l-174v-1-24,174v,1,
492,A trop bon dꝛoit ꝑdꝛoit,50,l-174v-1-25,174v,1,
493,Le ſien q՚ il auroit,50,l-174v-1-26,174v,1,
494,Cō le chiē le moutō,50,l-174v-1-27,174v,1,
495,Un jay bel ⁊ iolif,51,l-174v-1-28,174v,1,
496,Deuint lait ⁊ chetif,51,l-174v-1-29,174v,1,
497,Ꝑ sō oultrecuidāce,51,l-174v-1-30,174v,1,
498,Car il ſe foꝛioy,51,l-174v-1-31,174v,1,
499,Poꝛ ce q՚ il oÿ,51,l-174v-1-32,174v,1,
500,Faire de li loāge,51,l-174v-1-33,174v,1,
501,Il ot ē gñt deſpit,52,l-174v-1-34,174v,1,
502,Tous les iays q՚ il vit,52,l-174v-1-35,174v,1,
503,O eulz ne daigne aler,52,l-174v-1-36,174v,1,
504,O les paōs ſe (tint) t˜ioit,52,l-174v-1-37,174v,1,
505,Poꝛ ce q՚ il cuidoit,52,l-174v-1-38,174v,1,
506,Au paon reſambler,52,l-174v-1-39,174v,1,
507,Qñt les paōs le virēt,53,l-174v-2-1,174v,2,
508,En gñt deſpit le tīdꝛēt,53,l-174v-2-2,174v,2,
509,Et le vouldꝛēt tuer,53,l-174v-2-3,174v,2,
510,Ses pēnes li arrachēt,53,l-174v-2-4,174v,2,
511,Et bequēt et menacent,53,l-174v-2-5,174v,2,
512,Si qⁱl ne puet voler,53,l-174v-2-6,174v,2,
513,Aus yays eſt retoꝛnez,54,l-174v-2-7,174v,2,
514,Plume et malmene,54,l-174v-2-8,174v,2,
515,Coꝛroucie et dolant,54,l-174v-2-9,174v,2,
516,Il l'ont d'entr'eulz oſte,54,l-174v-2-10,174v,2,
517,⁊ bechie et hurte,54,l-174v-2-11,174v,2,
518,Si qu'il fu tout sāglāt,54,l-174v-2-12,174v,2,
519,QVi ſes parens renee,55,l-174v-2-13,174v,2,
520,Pour men՚ gñt poſnee,55,l-174v-2-14,174v,2,
521,Et pour hōnoꝛ auoir,55,l-174v-2-15,174v,2,
522,Aucun tēps reuēdꝛa,55,l-174v-2-16,174v,2,
523,Qⁱl ſ'en repētira.,55,l-174v-2-17,174v,2,
524,Ꝑ dꝛoit le pues ſauoir,55,l-174v-2-18,174v,2,
525,Un aigle pꝛis auoit,56,l-174v-2-19,174v,2,
526,.I. lieure qu'il mēioit,56,l-174v-2-20,174v,2,
527,Mais ēcoꝛe ert ē vie,56,l-174v-2-21,174v,2,
528,.I. moiſſō le gardoit,56,l-174v-2-22,174v,2,
529,Qⁱ au lieue diſoit,56,l-174v-2-23,174v,2,
530,Rāpoſnes ⁊ folie,56,l-174v-2-24,174v,2,
531,Chetif diſt le moiſſon,57,l-174v-2-25,174v,2,
532,Ml՚t fus fol ⁊ bꝛicon,57,l-174v-2-26,174v,2,
533,Qñt tu te leſſas pꝛēdꝛe,57,l-174v-2-27,174v,2,
534,Riens ne te vault ploꝛer,57,l-174v-2-28,174v,2,
535,Ne te pues eſchaper,57,l-174v-2-29,174v,2,
536,Moꝛs es sās plꝰ atēdꝛe,57,l-174v-2-30,174v,2,
537,Uu eſtoier ſaillans,58,l-174v-2-31,174v,2,
538,Et leg՚ ⁊ courans,58,l-174v-2-32,174v,2,
539,Auſſi cōme .i. oiſel,58,l-174v-2-33,174v,2,
540,Oꝛ eſt cy atrape,58,l-174v-2-34,174v,2,
541,Et hōni et mate,58,l-174v-2-35,174v,2,
542,Et y lairas la pel,58,l-174v-2-36,174v,2,
543,Q՚ t'ont valu tes ſans,59,l-174v-2-37,174v,2,
544,Roſtruēges et maulz,59,l-174v-2-38,174v,2,
545,Q՚ ſoloies ſauoir,59,l-174v-2-39,174v,2,
546,Il n'a ſouz ciel leurier,59,l-175r-1-1,175r,1,
547,Ne chien ne lyonnier,59,l-175r-1-2,175r,1,
548,Qⁱ te peüſt auoir,59,l-175r-1-3,175r,1,
549,Qñt acrhier ne doutoies,60,l-175r-1-4,175r,1,
550,Ne reuel ne cremoies,60,l-175r-1-5,175r,1,
551,Vaillant .iiij. boutōs,60,l-175r-1-6,175r,1,
552,Car trop iē te ſauras,60,l-175r-1-7,175r,1,
553,Garder toi de leurs pas,60,l-175r-1-8,175r,1,
554,Et bouter es buiſſons,60,l-175r-1-9,175r,1,
555,Celui qⁱ te plaindꝛa,61,l-175r-1-10,175r,1,
556,Et qⁱ te ploꝛera,61,l-175r-1-11,175r,1,
557,Certes aura toꝛt,61,l-175r-1-12,175r,1,
558,Qñt garder te ſauoies,61,l-175r-1-13,175r,1,
559,Et ſi ne te gardoies,61,l-175r-1-14,175r,1,
560,Biē eſt q՚ ſoies moꝛt,61,l-175r-1-15,175r,1,
561,Qñt ſ'ot dit le moiſon,62,l-175r-1-16,175r,1,
562,Et fine ſa raiſon.,62,l-175r-1-17,175r,1,
563,Tantoſt fu deuoure,62,l-175r-1-18,175r,1,
564,D'un eſpeurier ramage,62,l-175r-1-19,175r,1,
565,Ml՚t fu po de domage,62,l-175r-1-20,175r,1,
566,Car trop auoit dure,62,l-175r-1-21,175r,1,
567,Se le moiſſon ſceüſt,63,l-175r-1-22,175r,1,
568,Qu'auenir li deüſt,63,l-175r-1-23,175r,1,
569,Foꝛm̄t ſe fuſt doute,63,l-175r-1-24,175r,1,
570,Ia le lieure n'eüſt,63,l-175r-1-25,175r,1,
571,Eſcharni qⁱl peüſt,63,l-175r-1-26,175r,1,
572,Ne dit adu՚ſité,63,l-175r-1-27,175r,1,
573,Pechié eſt ⁊ folie,64,l-175r-1-28,175r,1,
574,De dire en vilōnie,64,l-175r-1-29,175r,1,
575,A hom deſcōfoꝛte,64,l-175r-1-30,175r,1,
576,Tel eſtoꝛ hui ēnuie,64,l-175r-1-31,175r,1,
577,Qⁱ demaī n'i ert mie,64,l-175r-1-32,175r,1,
578,Ains ꝑdꝛa ſa sāte,64,l-175r-1-33,175r,1,
579,Le chiē fiſt adiourn՚,65,l-175r-1-34,175r,1,
580,aus plais pour demāder,65,l-175r-1-35,175r,1,
581,A la bꝛebis .I. pain,65,l-175r-1-36,175r,1,
582,Qⁱl auoit pꝛeſte,65,l-175r-1-37,175r,1,
583,Cil diſt en loiauté,65,l-175r-1-38,175r,1,
584,Qⁱl ne moꝛoit de fain,65,l-175r-2-1,175r,2,
585,Certes diſt la bꝛebis,66,l-175r-2-2,175r,2,
586,Ꝑ ma foy vous pleuis,66,l-175r-2-3,175r,2,
587,Qⁱl a dit fauſſeté,66,l-175r-2-4,175r,2,
588,Onq՚s ioꝛ qu'il veſqⁱſt,66,l-175r-2-5,175r,2,
589,Aide ne mefiſt,66,l-175r-2-6,175r,2,
590,Ne pꝛeſt n'autre bōte,66,l-175r-2-7,175r,2,
591,Trop bōs teſmoīs en oÿ,67,l-175r-2-8,175r,2,
592,Diſt le chiez ꝑ ma foy,67,l-175r-2-9,175r,2,
593,Qⁱ biē le iurerent,67,l-175r-2-10,175r,2,
594,Oꝛ les fai dont venir,67,l-175r-2-11,175r,2,
595,Diſt le iuge ⁊ oir,67,l-175r-2-12,175r,2,
596,Vouldꝛai q՚ il dirōt,67,l-175r-2-13,175r,2,
597,Le leu tout pͥmerain,68,l-175r-2-14,175r,2,
598,A mis auāt ſa main,68,l-175r-2-15,175r,2,
599,Qⁱ a ſa foy mētie,68,l-175r-2-16,175r,2,
600,Et diſt qⁱl yeſtoit,68,l-175r-2-17,175r,2,
601,Qñt le chien yauoit,68,l-175r-2-18,175r,2,
602,Preſte de pain ꝑtie,68,l-175r-2-19,175r,2,
603,L'eſcoufle et le buſart,69,l-175r-2-20,175r,2,
604,Eſtoiēt d'autre ꝑt,69,l-175r-2-21,175r,2,
605,Qⁱ diſtrent q՚ il virent,69,l-175r-2-22,175r,2,
606,Q՚ le chiē li bailla,69,l-175r-2-23,175r,2,
607,Le pain ⁊ ſ'en ala,69,l-175r-2-24,175r,2,
608,Et nient plꝰ n'ē oyrent,69,l-175r-2-25,175r,2,
609,Il conuint qu'el rēdiſt,70,l-175r-2-26,175r,2,
610,Vouſiſt ou ne vouſiſt,70,l-175r-2-27,175r,2,
611,Le pain q՚le n'ot mie,70,l-175r-2-28,175r,2,
612,Treſtoꝰ les faus teſmoīs,70,l-175r-2-29,175r,2,
613,Qⁱ ſont et p՚s ⁊ loīs,70,l-175r-2-30,175r,2,
614,Enuoit diex d'ure vie,70,l-175r-2-31,175r,2,
615,Qⁱ doit aus plais aler,71,l-175r-2-32,175r,2,
616,Il ſe doit biē douter,71,l-175r-2-33,175r,2,
617,De faꝰ teſmoīs atēdꝛe,71,l-175r-2-34,175r,2,
618,Il font le dꝛoit vſer,71,l-175r-2-35,175r,2,
619,Et le toꝛt releuer,71,l-175r-2-36,175r,2,
620,Poꝛ fiāce de pꝛēdꝛe,71,l-175r-2-37,175r,2,
621,Une lime d'acier,72,l-175r-2-38,175r,2,
622,Qu'ert chiez .i. ſerrurier,72,l-175v-1-1,175v,1,
623,Trouua .i. fol ſerpent,72,l-175v-1-2,175v,1,
624,Il la cuida mengier,72,l-175v-1-3,175v,1,
625,Si la pꝛiſt a rūgier,72,l-175v-1-4,175v,1,
626,Trop angoiſſeuſem̄t,72,l-175v-1-5,175v,1,
627,Les dens ſont deſpeciees,73,l-175v-1-6,175v,1,
628,Rōpues et bꝛiſiees,73,l-175v-1-7,175v,1,
629,Et il furent ſanglant,73,l-175v-1-8,175v,1,
630,La lime ſ'eſt moquie,73,l-175v-1-9,175v,1,
631,De quoi c'eſt gñt folie,73,l-175v-1-10,175v,1,
632,Et li a dit bꝛiem̄t,73,l-175v-1-11,175v,1,
633,Fol ſerpent maloſtru,74,l-175v-1-12,175v,1,
634,Poꝛ quoi me rūges tu,74,l-175v-1-13,175v,1,
635,Dont ne ſui ie d'acier,74,l-175v-1-14,175v,1,
636,Ie mēiue le fer,74,l-175v-1-15,175v,1,
637,Si ert dur cōme enfer,74,l-175v-1-16,175v,1,
638,Et tu me veulz meng՚,74,l-175v-1-17,175v,1,
639,Maſche hardiem̄t,75,l-175v-1-18,175v,1,
640,Et eſtraī biē la dent,75,l-175v-1-19,175v,1,
641,Ia ne m'ē ſentirai,75,l-175v-1-20,175v,1,
642,Tu t'ē iras sāglāt,75,l-175v-1-21,175v,1,
643,Coꝛroucie ⁊ dolant,75,l-175v-1-22,175v,1,
644,Et ie m'ē mo q՚rai,75,l-175v-1-23,175v,1,
645,Folie eſt d'eſtriuer,76,l-175v-1-24,175v,1,
646,Ne de g՚re mener,76,l-175v-1-25,175v,1,
647,A plus puiſſant de li,76,l-175v-1-26,175v,1,
648,Qⁱ ſ'en poꝛroit garder,76,l-175v-1-27,175v,1,
649,Sens ſeroit d'eſtriuer,76,l-175v-1-28,175v,1,
650,La riote ⁊ le plai.,76,l-175v-1-29,175v,1,
651,Un larron fame pꝛiſt,77,l-175v-1-30,175v,1,
652,Qⁱ ml՚ grs noces fiſt,77,l-175v-1-31,175v,1,
653,De toute la valee,77,l-175v-1-32,175v,1,
654,Ml՚t firent lieem̄t,77,l-175v-1-33,175v,1,
655,Treſtout ꝯmunem̄t,77,l-175v-1-34,175v,1,
656,C'un qui fu en la place,77,l-175v-1-35,175v,1,
657,Ses voiſins li ont dit,78,l-175v-1-36,175v,1,
658,Qu'il entende au deduit,78,l-175v-1-37,175v,1,
659,Et face lieem̄t,78,l-175v-1-38,175v,1,
660,Ꝑ foy diſt il ſeign˞s,78,l-175v-1-39,175v,1,
661,Ie pēſoie oꝛe ailleurs,78,l-175v-1-40,175v,1,
662,Et voꝰ dirai ꝯm̄t,78,l-175v-2-1,175v,2,
663,I'oÿ iadis conter,79,l-175v-2-2,175v,2,
664,Q՚ diex voult marier,79,l-175v-2-3,175v,2,
665,Le ſileil a la lune,79,l-175v-2-4,175v,2,
666,Ml՚t deſplut ala gent,79,l-175v-2-5,175v,2,
667,Chaſcun en fu dolent,79,l-175v-2-6,175v,2,
668,Diex leur diſt en cōmune,79,l-175v-2-7,175v,2,
669,Ce n'eſt pas a mō veil,80,l-175v-2-8,175v,2,
670,Q՚ demenez tel duel,80,l-175v-2-9,175v,2,
671,Dites qui ce vous fait,80,l-175v-2-10,175v,2,
672,Sire ce mariage,80,l-175v-2-11,175v,2,
673,Nous toꝛne a gñt domage,80,l-175v-2-12,175v,2,
674,Chaſcuns le ſcet ꝑ tout,80,l-175v-2-13,175v,2,
675,Al n'eſt c'un ſeul ſoleil,81,l-175v-2-14,175v,2,
676,Si ne ſauons conſeil,81,l-175v-2-15,175v,2,
677,Qñt eſt en ſachalour,81,l-175v-2-16,175v,2,
678,Si eſchauffe le mōde,81,l-175v-2-17,175v,2,
679,Entour a la reonde,81,l-175v-2-18,175v,2,
680,Qⁱ tout eſt en doleur,81,l-175v-2-19,175v,2,
681,Qñt marié ſera,82,l-175v-2-20,175v,2,
682,Soleil engenderra,82,l-175v-2-21,175v,2,
683,Plus bel biē le ſauez,82,l-175v-2-22,175v,2,
684,Adonq՚s il duira,82,l-175v-2-23,175v,2,
685,Treſtoꝰ embꝛaſera,82,l-175v-2-24,175v,2,
686,Sire aicōis noꝰ tuez,82,l-175v-2-25,175v,2,
687,Il n'a cy c'un larron,83,l-175v-2-26,175v,2,
688,Et tant le redouton,83,l-175v-2-27,175v,2,
689,Qⁱ ne ſauons q՚ faire,83,l-175v-2-28,175v,2,
690,Qñt marié ſera,83,l-175v-2-29,175v,2,
691,En fans engendꝛera.,83,l-175v-2-30,175v,2,
692,Qⁱ ſeront de putaire,83,l-175v-2-31,175v,2,
693,Il noꝰ poꝛra greu՚,84,l-175v-2-32,175v,2,
694,Et le n՚re rober,84,l-175v-2-33,175v,2,
695,Car il reſamblerōt,84,l-175v-2-34,175v,2,
696,Au pere ⁊ ala mere,84,l-175v-2-35,175v,2,
697,Raiſon eſt ꝑ /s՚ pere,84,l-175v-2-36,175v,2,
698,Ie ia biē ne feront,84,l-175v-2-37,175v,2,
699,L'en doit ml՚t redouter,85,l-175v-2-38,175v,2,
700,Et fuire et eſchiuer,85,l-176r-1-1,176r,1,
701,Multepli de mauués,85,l-176r-1-2,176r,1,
702,Et les bons eſſaucier,85,l-176r-1-3,176r,1,
703,Et amer et pꝛoiſier,85,l-176r-1-4,176r,1,
704,Car trop n'ē ert iamais,85,l-176r-1-5,176r,1,
705,Une aronde eſgardoit,86,l-176r-1-6,176r,1,
706,.I. vilain qui ſemoit,86,l-176r-1-7,176r,1,
707,Sō chāp en ſon coꝛtil,86,l-176r-1-8,176r,1,
708,Elle a dit aus oiſiaus,86,l-176r-1-9,176r,1,
709,Q՚ chaſcuns ſoit iſniaꝰ,86,l-176r-1-10,176r,1,
710,D'oſter ſoy de peril,86,l-176r-1-11,176r,1,
711,La ſemence cueillon,87,l-176r-1-12,176r,1,
712,Et noꝰ en ſaoulon,87,l-176r-1-13,176r,1,
713,Q՚ sēme ce vilain,87,l-176r-1-14,176r,1,
714,Noꝰ noꝰ repentirō,87,l-176r-1-15,176r,1,
715,Se croiſtre le leſſon.,87,l-176r-1-16,176r,1,
716,Ce voꝰ di pour certain,87,l-176r-1-17,176r,1,
717,Les vilains en feront,88,l-176r-1-18,176r,1,
718,Les rez ſi noꝰ pꝛēdꝛōt,88,l-176r-1-19,176r,1,
719,Et metront a toꝛment,88,l-176r-1-20,176r,1,
720,Les oiſiaꝰ l'eſcharnirēt,88,l-176r-1-21,176r,1,
721,De ce q՚ il oirent,88,l-176r-1-22,176r,1,
722,Et n'en firent noient,88,l-176r-1-23,176r,1,
723,Qñt la chanure leua,89,l-176r-1-24,176r,1,
724,L'arōde retoꝛna,89,l-176r-1-25,176r,1,
725,Les oiſiaꝰ ſi leur pꝛie,89,l-176r-1-26,176r,1,
726,Alōs tout eſrachier,89,l-176r-1-27,176r,1,
727,Ce chanure ⁊ debꝛiſier,89,l-176r-1-28,176r,1,
728,Le vilain n'y eſt mie,89,l-176r-1-29,176r,1,
729,Au matin yalon,89,l-176r-1-30,176r,1,
730,Ne doutōs .i. boutō,89,l-176r-1-31,176r,1,
731,Riens qu'il face ne die.,89,l-176r-1-32,176r,1,
732,L'arōde ſi fu ſage,90,l-176r-1-45,176r,1,
733,Et ne fu pas ſauuage,90,l-176r-1-46,176r,1,
734,Mais la gēt douta moult,90,l-176r-1-47,176r,1,
735,Qⁱ pꝛēnent les oiſiaus,90,l-176r-1-48,176r,1,
736,Tant ſachēt eſtre iſniaꝰ,90,l-176r-1-49,176r,1,
737,A leurs rez q՚ il fout,90,l-176r-1-50,176r,1,
738,Os maiſons a la gent,91,l-176r-1-51,176r,1,
739,Qⁱ la doutent foꝛm̄t,91,l-176r-2-1,176r,2,
740,S'eſt alee anichier,91,l-176r-2-2,176r,2,
741,Et ſa moꝛt ya vne,91,l-176r-2-3,176r,2,
742,Et miſe en leur baillie,91,l-176r-2-4,176r,2,
743,Si l'ē tiēnent plꝰ ch՚.,91,l-176r-2-5,176r,2,
744,Oꝛ ſont ml՚ repētās,92,l-176r-2-6,176r,2,
745,Les oiſiaus ⁊ dolās,92,l-176r-2-7,176r,2,
746,Qⁱl ne crurent l'arōde,92,l-176r-2-8,176r,2,
747,Car il ſont atrapez,92,l-176r-2-9,176r,2,
748,Pris et acouuetez,92,l-176r-2-10,176r,2,
749,Aus rez ꝑ tout le mode,92,l-176r-2-11,176r,2,
750,Ne ie ne me m՚ueil,93,l-176r-2-12,176r,2,
751,Dont qⁱ ne croit cōſeil,93,l-176r-2-13,176r,2,
752,Si ſ'ē repent ſouuent,93,l-176r-2-14,176r,2,
753,Qñt l'ē li dit raiſon.,93,l-176r-2-15,176r,2,
754,Il eſt fol ⁊ bꝛicon.,93,l-176r-2-16,176r,2,
755,S'il ſcet ⁊ ne l'entent.,93,l-176r-2-17,176r,2,
756,L'en ſe doit cōſeillier,94,l-176r-2-18,176r,2,
757,Qñt viēt au cōmēcier,94,l-176r-2-19,176r,2,
758,S'eſt man՚e de ſage,94,l-176r-2-20,176r,2,
759,Car qui trop atēdꝛoit,94,l-176r-2-21,176r,2,
760,A paine eſcheueroit,94,l-176r-2-22,176r,2,
761,En la fin le domage.,94,l-176r-2-23,176r,2,
762,Un gñt vilain pele,95,l-176r-2-24,176r,2,
763,Gras ⁊ biē ſaoule,95,l-176r-2-25,176r,2,
764,S'aſſiſt en ſa maiſon,95,l-176r-2-26,176r,2,
765,.I. haſterel deuant,95,l-176r-2-27,176r,2,
766,L'ala ſouuēt poignāt,95,l-176r-2-28,176r,2,
767,En bibet ou taon.,95,l-176r-2-29,176r,2,
768,Un cop geta en vain,96,l-176r-2-30,176r,2,
769,Le vilain de ſa main,96,l-176r-2-31,176r,2,
770,Sus la teſte pelee,96,l-176r-2-32,176r,2,
771,Malem̄t le bleca,96,l-176r-2-33,176r,2,
772,Sa mouche n'atoucha,96,l-176r-2-34,176r,2,
773,Dōt poīt ne li a gree,96,l-176r-2-35,176r,2,
774,La mouche ſe trauerſe,97,l-176r-2-36,176r,2,
775,Poignant fu ⁊ diu՚ſe,97,l-176r-2-37,176r,2,
776,C'eſtoit ꝯtre ſa moꝛt.,97,l-176r-2-38,176r,2,
777,Le vilain aticha,97,l-176v-1-1,176v,1,
778,Et il ſe coꝛrouca,97,l-176v-1-2,176v,1,
779,Et li diſt qu'il a toꝛt,97,l-176v-1-3,176v,1,
780,Il la cuida ferir,98,l-176v-1-4,176v,1,
781,Mais il ſot biē fouir,98,l-176v-1-5,176v,1,
782,Et grunchier en volant,98,l-176v-1-6,176v,1,
783,Vne tres gñt paumee,98,l-176v-1-7,176v,1,
784,S'eſt le vilain dōnee,98,l-176v-1-8,176v,1,
785,Il en geta .i. ris,99,l-176v-1-9,176v,1,
786,Et iura /.s՚. denis,99,l-176v-1-10,176v,1,
787,Q՚ tant y ruera,99,l-176v-1-11,176v,1,
788,Qu'ē aucune maniere,99,l-176v-1-12,176v,1,
789,Ou deuant ou derriere,99,l-176v-1-13,176v,1,
790,A ferme l'a taīdꝛa,99,l-176v-1-14,176v,1,
791,Il l'ataint ſus ſa teſte,100,l-176v-1-15,176v,1,
792,Si n'ē fiſt pas gñt feſte,100,l-176v-1-16,176v,1,
793,Ains feri en ſeurſant,100,l-176v-1-17,176v,1,
794,Toute l'a eſcachiee,100,l-176v-1-18,176v,1,
795,Sa teſte en fu ſouilliee,100,l-176v-1-19,176v,1,
796,Deſſus le front en hault,100,l-176v-1-20,176v,1,
797,Ie tiēg a gñt folie,101,l-176v-1-21,176v,1,
798,De faire vilēnie,101,l-176v-1-22,176v,1,
799,A plus poiſſant de ſoy,101,l-176v-1-23,176v,1,
800,La en pert biē la vie,101,l-176v-1-24,176v,1,
801,Sage eſt qⁱ ſe chaſtie,101,l-176v-1-25,176v,1,
802,Qⁱl n'ē voiſt a belloy,101,l-176v-1-26,176v,1,
803,UN cop eſt toſt rue,102,l-176v-1-27,176v,1,
804,Et .i. home tue,102,l-176v-1-28,176v,1,
805,Fol eſt qⁱ ne ſe doute,102,l-176v-1-29,176v,1,
806,Trop enchacier fait mal,102,l-176v-1-30,176v,1,
807,A pié ⁊ a cheual,102,l-176v-1-31,176v,1,
808,Bō fait tenir ſa route,102,l-176v-1-32,176v,1,
809,Oꝛ oez d'un lyon,103,l-176v-1-33,176v,1,
810,Qⁱ ſe poīt ou talon,103,l-176v-1-34,176v,1,
811,D'une beſche d'eſpine,103,l-176v-1-35,176v,1,
812,Il ne l'a ſot oſter,103,l-176v-1-36,176v,1,
813,Ne ne pot endurer,103,l-176v-1-37,176v,1,
814,L'angoiſſe qⁱ n'afine,103,l-176v-1-38,176v,1,
815,Moult fu foꝛm̄t dolent,104,l-176v-1-39,176v,1,
816,Car il ne ſot ꝯm̄t,104,l-176v-1-40,176v,1,
817,Il puiſt ſanté auoir,104,l-176v-1-41,176v,1,
818,Miex amaſt a moꝛir,104,l-176v-1-42,176v,1,
819,Q՚ tant de mal ſentir,104,l-176v-1-43,176v,1,
820,Se fuſt a ſon voloir,104,l-176v-2-1,176v,2,
821,Il n'a beſte trouuee,105,l-176v-2-2,176v,2,
822,En toute la cōtree,105,l-176v-2-3,176v,2,
823,Qⁱ le ſache guerir,105,l-176v-2-4,176v,2,
824,Du mal dont il enrage,105,l-176v-2-5,176v,2,
825,⁊ poīt ne ſ'aſſouage,105,l-176v-2-6,176v,2,
826,Prez eſtoit de moꝛir,105,l-176v-2-7,176v,2,
827,Moult pꝛez d'ilec auoir,106,l-176v-2-8,176v,2,
828,.I. paiſtre qⁱ gardoit,106,l-176v-2-9,176v,2,
829,Vne gñt bercherie,106,l-176v-2-10,176v,2,
830,Le lyon l'aꝑcut,106,l-176v-2-11,176v,2,
831,Qⁱ en tāt come il put,106,l-176v-2-12,176v,2,
832,Enu՚s li ſ'abādōne,106,l-176v-2-13,176v,2,
833,Le paſteur ſ'eſt doute,107,l-176v-2-14,176v,2,
834,Q՚ ne ſoit fauſſeté,107,l-176v-2-15,176v,2,
835,De ſon humilité,107,l-176v-2-16,176v,2,
836,Derrieres ſes bꝛebis,107,l-176v-2-17,176v,2,
837,S'eſt couchiez ⁊ tapis,107,l-176v-2-18,176v,2,
838,Mais le lyon ſ'auāce,107,l-176v-2-19,176v,2,
839,Son pié li a tēdu,108,l-176v-2-20,176v,2,
840,Ml՚t a biē entendu,108,l-176v-2-21,176v,2,
841,Le paſteur qui li faut,108,l-176v-2-22,176v,2,
842,Le pié pꝛiſt en ſa main,108,l-176v-2-23,176v,2,
843,De merde et ſonc plain,108,l-176v-2-24,176v,2,
844,Il le tert ⁊ ſ'en faut,108,l-176v-2-25,176v,2,
845,Gveris fu li lyon,109,l-176v-2-26,176v,2,
846,Ꝑ petit d'achoiſon,109,l-176v-2-27,176v,2,
847,Le paſteur en m՚cie,109,l-176v-2-28,176v,2,
848,Et li baiſe la main,109,l-176v-2-29,176v,2,
849,Le paſtour de sō pain,109,l-176v-2-30,176v,2,
850,Li a dōne la mie,109,l-176v-2-31,176v,2,
851,Le paſtoꝛ fu iugie,110,l-176v-2-32,176v,2,
852,A moꝛt ꝑ sō pechié,110,l-176v-2-33,176v,2,
853,Ap՚s ceſte auēture,110,l-176v-2-34,176v,2,
854,Liez fu al'eſtache,110,l-176v-2-35,176v,2,
855,Le p՚uoſt le menace,110,l-176v-2-36,176v,2,
856,De moꝛt cruel ⁊ dure,110,l-176v-2-37,176v,2,
857,Le paſtour ſi crioit,111,l-176v-2-38,176v,2,
858,Merci quanqⁱl pooit,111,l-176v-2-39,176v,2,
859,Mais nulz n'y volt entēdꝛe,111,l-176v-2-40,176v,2,
860,Le lyon l'a veü,111,l-176v-2-41,176v,2,
861,Qⁱ biē l'a congneu,111,l-176v-2-42,176v,2,
862,Sa bōte li voult rendꝛe,111,l-177r-1-1,177r,1,
863,Il eſt du bois ſailli,112,l-177r-1-2,177r,1,
864,Tout dꝛoit ſ'en vient a li,112,l-177r-1-3,177r,1,
865,Bruiant de gñt fierte,112,l-177r-1-4,177r,1,
866,Le p՚uoſt ſ'en fouy,112,l-177r-1-5,177r,1,
867,Et chaſcun le ſuiui,112,l-177r-1-6,177r,1,
868,Foꝛm̄t eſpoente,112,l-177r-1-7,177r,1,
869,Nul ne ſauoit eſcrire,113,l-177r-1-8,177r,1,
870,La gñt ioie ne dire,113,l-177r-1-9,177r,1,
871,Q՚ li fiſt le lyon,113,l-177r-1-10,177r,1,
872,De la dolour li poiſe,113,l-177r-1-11,177r,1,
873,Plus de .C. fois la boiſe,113,l-177r-1-12,177r,1,
874,En la bouche ou menton.,113,l-177r-1-13,177r,1,
875,Le pꝛevost et la gent,114,l-177r-1-14,177r,1,
876,Retournerent bꝛiem̄t,114,l-177r-1-15,177r,1,
877,Qⁱ tous ſont eſbahi,114,l-177r-1-16,177r,1,
878,Le paſtour eſgarderent,114,l-177r-1-17,177r,1,
879,Q՚ a trouuer cuiderent,114,l-177r-1-18,177r,1,
880,Deuoure ⁊ occis.,114,l-177r-1-19,177r,1,
881,Paſtour diſt le p՚uoſt,115,l-177r-1-20,177r,1,
882,Il n'eſt home qui t'oſt,115,l-177r-1-21,177r,1,
883,Faire mal ne hontage,115,l-177r-1-22,177r,1,
884,Poꝛ l'amoꝛ du lyon,115,l-177r-1-23,177r,1,
885,Treſtout te ꝑdōne,115,l-177r-1-24,177r,1,
886,Plus n'y auras domage,115,l-177r-1-25,177r,1,
887,Di noꝰ ꝯm̄t ce vet,116,l-177r-1-26,177r,1,
888,Q՚ ce lyon te fait,116,l-177r-1-27,177r,1,
889,D'amoꝛ tel demouſtrāce,116,l-177r-1-28,177r,1,
890,Se nulz te meffaiſoit,116,l-177r-1-29,177r,1,
891,Biē ſai qu'il l'occirroit,116,l-177r-1-30,177r,1,
892,S'ē pꝛēdꝛoit la vēiāce,116,l-177r-1-31,177r,1,
893,Par foy diſt le berchier,117,l-177r-1-32,177r,1,
894,Il vint a moy l'autr'ier,117,l-177r-1-33,177r,1,
895,Malade en ſon talon,117,l-177r-1-34,177r,1,
896,De lo oÿ gñt pitié,117,l-177r-1-35,177r,1,
897,Si li gueri ſon pié,117,l-177r-1-36,177r,1,
898,N'i ſai autre raiſon,117,l-177r-1-37,177r,1,
899,Pour .i. po de ſeruice,118,l-177r-1-38,177r,1,
900,Qⁱl fiſt ꝑ ſa frāchiſe,118,l-177r-2-1,177r,2,
901,Le paſtour au lyon.,118,l-177r-2-2,177r,2,
902,Ot il ſauue ſa vie,118,l-177r-2-3,177r,2,
903,De moꝛt qu'ot deſeruie,118,l-177r-2-4,177r,2,
904,D'une homicidion,118,l-177r-2-5,177r,2,
905,La bōte n'i ert ꝑdue,119,l-177r-2-6,177r,2,
906,Qⁱ ne recoit rendue,119,l-177r-2-7,177r,2,
907,Sage eſt qⁱ bōte fait,119,l-177r-2-8,177r,2,
908,Pour une en auō .C.,119,l-177r-2-9,177r,2,
909,Ainſi /iheſu le rent.,119,l-177r-2-10,177r,2,
910,Q՚ l'ē aoure ⁊ crient.,119,l-177r-2-11,177r,2,
911,UN aſne traueillie,120,l-177r-2-12,177r,2,
912,Dolant et traueillie,120,l-177r-2-13,177r,2,
913,.I. keu yeſt venu,120,l-177r-2-14,177r,2,
914,Si le raui a nu,120,l-177r-2-15,177r,2,
915,De ſa gueule baee,120,l-177r-2-16,177r,2,
916,Il ot ml՚t gñt pitié,121,l-177r-2-17,177r,2,
917,Du las qui traueillie,121,l-177r-2-18,177r,2,
918,Eſtoit ⁊ endoꝛmi,121,l-177r-2-19,177r,2,
919,En la quele ꝑtie,121,l-177r-2-20,177r,2,
920,Sens tu greigneur hachie,121,l-177r-2-21,177r,2,
921,Diſt le leu bel ami,121,l-177r-2-22,177r,2,
922,La ou tu tiēs ta poe,122,l-177r-2-23,177r,2,
923,Me dueil plus qu'ē la ioe,122,l-177r-2-24,177r,2,
924,Q՚ i'ai toute rōpue,122,l-177r-2-25,177r,2,
925,D'un cop q՚ .i. aſnier,122,l-177r-2-26,177r,2,
926,Me dōna deuant hier,122,l-177r-2-27,177r,2,
927,D'une groſſe maſcue,122,l-177r-2-28,177r,2,
928,L'aſne cuide eſtre pꝛis,123,l-177r-2-29,177r,2,
929,Deuoure ⁊ occis,123,l-177r-2-30,177r,2,
930,Du leu haſtiuem̄t,123,l-177r-2-31,177r,2,
931,Le leu de li auoit,123,l-177r-2-32,177r,2,
932,Tel pitié qu'il ploꝛoit,123,l-177r-2-33,177r,2,
933,Et l'ē peſoit foꝛm̄t,123,l-177r-2-34,177r,2,
934,Se .i. hom deſloial,124,l-177r-2-35,177r,2,
935,Se repentoit du mal,124,l-177r-2-36,177r,2,
936,Qu'aroit fait en ſa vie,124,l-177r-2-37,177r,2,
937,Tout le biē qⁱl feroit.,124,l-177r-2-38,177r,2,
938,Des gens tenus ſeroit,124,l-177v-1-1,177v,1,
939,Mal et ypocriſie,124,l-177v-1-2,177v,1,
940,Chaſcuns ſe doit garnir,125,l-177v-1-3,177v,1,
941,En ſon p՚mier venir,125,l-177v-1-4,177v,1,
942,De bien faire ⁊ ſauoir,125,l-177v-1-5,177v,1,
943,Hōs de maluais renon,125,l-177v-1-6,177v,1,
944,Traitre ne larron,125,l-177v-1-7,177v,1,
945,Ne poꝛ honour auoir,125,l-177v-1-8,177v,1,
946,Un leu eſtoit mucie,126,l-177v-1-9,177v,1,
947,Et de pꝛez enchacie,126,l-177v-1-10,177v,1,
948,Si ne pooit fouir,126,l-177v-1-11,177v,1,
949,En .i. bꝛueil ſ'eſt lācie,126,l-177v-1-12,177v,1,
950,Et tapi et mucie,126,l-177v-1-13,177v,1,
951,Paour ot de moꝛir,126,l-177v-1-14,177v,1,
952,UN home ſe ſeoit,127,l-177v-1-15,177v,1,
953,Lez li qui regardoit,127,l-177v-1-16,177v,1,
954,Le l'en merci li pꝛie,127,l-177v-1-17,177v,1,
955,Poꝛ dieu biaꝰ doꝰ amis,127,l-177v-1-18,177v,1,
956,Ie ſui ala moꝛt mis,127,l-177v-1-19,177v,1,
957,Neant eſt de ma vie,127,l-177v-1-20,177v,1,
958,S'il te pleſt ie viurai,128,l-177v-1-21,177v,1,
959,Ou ſe non ie moꝛrai,128,l-177v-1-22,177v,1,
960,C'eſt a ta volenté,128,l-177v-1-23,177v,1,
961,Le veneur vient cy,128,l-177v-1-24,177v,1,
962,Qⁱ ia n'aura m՚ci,128,l-177v-1-25,177v,1,
963,De ce las ne pitié,128,l-177v-1-26,177v,1,
964,Car il me het de moꝛt,129,l-177v-1-27,177v,1,
965,Et ce n'eſt mie toꝛt,129,l-177v-1-28,177v,1,
966,Iel'ay biē deſeruie,129,l-177v-1-29,177v,1,
967,Mais ſe puis eſchaper,129,l-177v-1-30,177v,1,
968,Q՚ ſaufm'ē puiſſe aler,129,l-177v-1-31,177v,1,
969,I'amēderai ma vie,129,l-177v-1-32,177v,1,
970,I'ay gñt pitié de toy,130,l-177v-1-33,177v,1,
971,Dit le bouuier ꝑ foy,130,l-177v-1-34,177v,1,
972,Ia ꝑ moy ne moꝛras,130,l-177v-1-35,177v,1,
973,Au veneeur dirai,130,l-177v-1-36,177v,1,
974,Si toſt cō le verrai,130,l-177v-1-37,177v,1,
975,Q՚ ꝑ dela t'en vas,130,l-177v-1-38,177v,1,
976,Sire vr՚e merci.,131,l-177v-1-39,177v,1,
977,Ie demourai dont cy,131,l-177v-2-1,177v,2,
978,Poꝛ dieu de moy pēſez,131,l-177v-2-2,177v,2,
979,Li archier ſont venu,131,l-177v-2-3,177v,2,
980,De berſer eſmeü,131,l-177v-2-4,177v,2,
981,Et les ars enteſez,131,l-177v-2-5,177v,2,
982,Ov eſt le leu alé,132,l-177v-2-6,177v,2,
983,Qⁱ eſt cy deuale,132,l-177v-2-7,177v,2,
